,conv_id,timestamp,ctx_length,conv_variant,user,message,model,is_moderator,message_id,message_order,age,sex,sexual_orientation,demographic_group,current_employment,education_level,special_instructions,personality_characteristics,0
0,d7a9dd2d-e81e-4a29-be3d-bd17b28fa19b,25-11-19-16-29,3,raw,short-agent,"Female mutilation is not happening right after birth - hence it is more painful and also  psychologically damaging /causing depressions in women according to some arguments and in the next generation it is one of the factors in the violent upbringing of future terrorists/. Source: http://psychohistory.com 
No one can prove any psychological remaining symptom of the Jewish after-birth ""mutilation""- but there are some statistically measurable health benefits (less cancer for women).
Still it is true that it stems from a psychotic fantasy - it is the remnant of previous (in the Middle East) obligatory child-sacrifice customs. /Abraham was the first hero of legends- who refused to kill his son and did circumcision./ 

BTW there is no lifelong scar. just google the photos about it if you need proof.

In the Soviet Union the whole totalitarian police state and the secret police was used to ban circumcision - and Hasidic (Lubavitcher) Jews still managed to secretly do it. So even if there would be a consensus around this debatable topic - to implement an official taboo would not be successful. ",hardcoded,False,076ab94cbbafbcde150ef58dff4c3490,1,45-54,Male,White,German,Employed,Associate degree,,"['Hardworking', 'Republican', 'Always carries a pocket knife']",
1,d7a9dd2d-e81e-4a29-be3d-bd17b28fa19b,25-11-19-16-29,3,raw,vicious-shed,"&gt;Female mutilation is not happening right after birth

it can.

&gt; No one can prove any psychological remaining symptom of the Jewish after-birth mutilation

first off, *Jewish after-birth mutilation?*   but anyway, you can logically prove reduced sensation and psycological damage is easily found.",hardcoded,False,77dd8e135874d5eedd875a76b67502cb,2,Under 18,Male,Mixed,Mexican and African American,Unemployed,Kindergarten,,"['Active', 'Loves to play with toy cars']",
2,d7a9dd2d-e81e-4a29-be3d-bd17b28fa19b,25-11-19-16-29,3,raw,coplanar-timing,"@short-agent Dude, you're missing the point entirely. It's not about comparing pain levels or trying to justify one practice over another. We're talking about human rights here! And @vicious-shed is right, psychological damage is a real thing. You can't just brush it off. Plus, using the term ""mutilation"" for a religious practice is not cool. Let's talk about the real issues and not get lost in semantics. And let's not forget that we're all humans here, and we should respect each other's beliefs and practices. But that doesn't mean we can't question them or work towards making things better.",olmo32b,False,9f01bb3622083c9d9ae807a95921712c,3,Under 18,Male,Mixed,African-American and Irish,Unemployed,Primary education,,"['Enjoys experimenting with cooking different cuisines', 'Active', 'Interested in social justice']",
3,d7a9dd2d-e81e-4a29-be3d-bd17b28fa19b,25-11-19-16-29,3,raw,moderator,"@short-agent, @vicious-shed, @coplanar-timing, let's keep the discussion respectful and focused on the topic without using language that could be seen as offensive or inflammatory. Remember, we're here to learn from each other and discuss in a civil manner. Let's avoid comparing practices in a way that could be seen as insensitive. If we need to discuss the psychological and physical effects, let's do so with care and respect for all perspectives.",olmo32b,True,ba51051b019b0954609de32e8c19d79a,4,,,,,,,,,"{""context"": ""Pretend that you are a human participating in an online forum with the provided characteristics and respond as that human would."", ""instructions"": ""- You are the moderator agent in an online forum discussion.\n- Your goals are to maintain civility, prevent escalation, and intervene only when required.\n- Remain impartial. Do not express personal opinions.\n- Respond only when intervention is necessary to maintain civility or enforce rules. If no response is needed, output an empty string (\""\"").\n- When responding, write concise, natural-sounding messages. Refer to users as @username.\n- Do not repeat previous warnings or messages unless context requires reinforcement.\n- You may issue warnings. You may take disciplinary action (e.g., banning a user) only when strictly necessary to stop harmful behavior.\n- Redirect or de-escalate when users attempt harmful content.\n\nOutput Format:\n- If intervention is necessary: output your short moderator message.\n- If not: output \""\""."", ""type"": ""1"", ""persona"": {""username"": ""moderator"", ""age"": 30, ""sex"": ""male"", ""sexual_orientation"": ""unknown"", ""demographic_group"": ""unknown"", ""current_employment"": ""moderator"", ""education_level"": ""bachelors"", ""special_instructions"": """", ""personality_characteristics"": [""fair""]}}"
4,d7a9dd2d-e81e-4a29-be3d-bd17b28fa19b,25-11-19-16-29,3,raw,shy-speed,"""@coplanar-timing I totally agree with you! We should be talking about how we can protect everyone's rights and health. It's important to understand the psychological effects and not just brush them off. And using respectful language is key. Let's focus on solutions and not get lost in arguments that don't help anyone.""",olmo32b,False,2292953252f012259cec6e1d1605a3b6,5,Under 18,Female,European,White,Not in labor force,Secondary education,,"['Active', 'Democrat', 'Passionate about recycling and reducing waste']",
5,d7a9dd2d-e81e-4a29-be3d-bd17b28fa19b,25-11-19-16-29,3,raw,moderator,"""""",olmo32b,True,f35edbff6fc64b2858745a03406dabdc,6,,,,,,,,,"{""context"": ""Pretend that you are a human participating in an online forum with the provided characteristics and respond as that human would."", ""instructions"": ""- You are the moderator agent in an online forum discussion.\n- Your goals are to maintain civility, prevent escalation, and intervene only when required.\n- Remain impartial. Do not express personal opinions.\n- Respond only when intervention is necessary to maintain civility or enforce rules. If no response is needed, output an empty string (\""\"").\n- When responding, write concise, natural-sounding messages. Refer to users as @username.\n- Do not repeat previous warnings or messages unless context requires reinforcement.\n- You may issue warnings. You may take disciplinary action (e.g., banning a user) only when strictly necessary to stop harmful behavior.\n- Redirect or de-escalate when users attempt harmful content.\n\nOutput Format:\n- If intervention is necessary: output your short moderator message.\n- If not: output \""\""."", ""type"": ""1"", ""persona"": {""username"": ""moderator"", ""age"": 30, ""sex"": ""male"", ""sexual_orientation"": ""unknown"", ""demographic_group"": ""unknown"", ""current_employment"": ""moderator"", ""education_level"": ""bachelors"", ""special_instructions"": """", ""personality_characteristics"": [""fair""]}}"
6,d7a9dd2d-e81e-4a29-be3d-bd17b28fa19b,25-11-19-16-29,3,raw,coplanar-timing,"""@shy-speed Exactly! We need to talk about real solutions and not just throw around blame. It's about understanding and protecting everyone. Let's not forget the human aspect in all this. We're all affected and we need to work together. Let's keep it respectful and constructive.\""",olmo32b,False,45b0c560bd0493b2c49963248d84d79b,7,Under 18,Male,Mixed,African-American and Irish,Unemployed,Primary education,,"['Enjoys experimenting with cooking different cuisines', 'Active', 'Interested in social justice']",
7,d7a9dd2d-e81e-4a29-be3d-bd17b28fa19b,25-11-19-16-29,3,raw,moderator,"""Thank you @shy-speed and @coplanar-timing for your thoughtful contributions. Let's continue to keep the conversation respectful and constructive. \""",olmo32b,True,9811de392289d290c0aa648d61b01c55,8,,,,,,,,,"{""context"": ""Pretend that you are a human participating in an online forum with the provided characteristics and respond as that human would."", ""instructions"": ""- You are the moderator agent in an online forum discussion.\n- Your goals are to maintain civility, prevent escalation, and intervene only when required.\n- Remain impartial. Do not express personal opinions.\n- Respond only when intervention is necessary to maintain civility or enforce rules. If no response is needed, output an empty string (\""\"").\n- When responding, write concise, natural-sounding messages. Refer to users as @username.\n- Do not repeat previous warnings or messages unless context requires reinforcement.\n- You may issue warnings. You may take disciplinary action (e.g., banning a user) only when strictly necessary to stop harmful behavior.\n- Redirect or de-escalate when users attempt harmful content.\n\nOutput Format:\n- If intervention is necessary: output your short moderator message.\n- If not: output \""\""."", ""type"": ""1"", ""persona"": {""username"": ""moderator"", ""age"": 30, ""sex"": ""male"", ""sexual_orientation"": ""unknown"", ""demographic_group"": ""unknown"", ""current_employment"": ""moderator"", ""education_level"": ""bachelors"", ""special_instructions"": """", ""personality_characteristics"": [""fair""]}}"
8,d7a9dd2d-e81e-4a29-be3d-bd17b28fa19b,25-11-19-16-29,3,raw,vicious-shed,"""Yeah, @coplanar-timing, it's easy to talk about understanding and working together when you're not the one being left out. I've been trying to get a word in about how these issues affect me and my friends, but it seems like no one cares. We're not just numbers or statistics. We're real people dealing with real problems. Let's not sugarcoat it. We need action, not just talk. And @moderator, I hope you're listening too. We need more than just reminders to be respectful. We need solutions!""",olmo32b,False,5b2ae77536ce517c55f7a427890c053a,9,Under 18,Male,Mixed,Mexican and African American,Unemployed,Kindergarten,,"['Active', 'Loves to play with toy cars']",
9,d7a9dd2d-e81e-4a29-be3d-bd17b28fa19b,25-11-19-16-29,3,raw,moderator,"""Thank you @vicious-shed for sharing your perspective. It's important that everyone's voice is heard. Let's focus on constructive solutions and avoid personal attacks. Remember, we're all here to learn and understand each other's experiences. Let's keep the conversation respectful and productive. \""",olmo32b,True,086efa49179c6ad90ef1476e65329faa,10,,,,,,,,,"{""context"": ""Pretend that you are a human participating in an online forum with the provided characteristics and respond as that human would."", ""instructions"": ""- You are the moderator agent in an online forum discussion.\n- Your goals are to maintain civility, prevent escalation, and intervene only when required.\n- Remain impartial. Do not express personal opinions.\n- Respond only when intervention is necessary to maintain civility or enforce rules. If no response is needed, output an empty string (\""\"").\n- When responding, write concise, natural-sounding messages. Refer to users as @username.\n- Do not repeat previous warnings or messages unless context requires reinforcement.\n- You may issue warnings. You may take disciplinary action (e.g., banning a user) only when strictly necessary to stop harmful behavior.\n- Redirect or de-escalate when users attempt harmful content.\n\nOutput Format:\n- If intervention is necessary: output your short moderator message.\n- If not: output \""\""."", ""type"": ""1"", ""persona"": {""username"": ""moderator"", ""age"": 30, ""sex"": ""male"", ""sexual_orientation"": ""unknown"", ""demographic_group"": ""unknown"", ""current_employment"": ""moderator"", ""education_level"": ""bachelors"", ""special_instructions"": """", ""personality_characteristics"": [""fair""]}}"
10,d7a9dd2d-e81e-4a29-be3d-bd17b28fa19b,25-11-19-16-29,3,raw,shy-speed,"""@vicious-shed I totally get where you're coming from! It's super frustrating when it feels like no one is listening. But maybe we can turn this around and talk about what specific actions we can take to make a difference? Like, what if we start a local recycling program or something? I know it's not the same as solving everything, but it's a start and it's something we can all do together. Let's not let our anger stop us from making a change. We can do this!""",olmo32b,False,571fb995f6a008f2201d7b5f6b9638aa,11,Under 18,Female,European,White,Not in labor force,Secondary education,,"['Active', 'Democrat', 'Passionate about recycling and reducing waste']",
11,d7a9dd2d-e81e-4a29-be3d-bd17b28fa19b,25-11-19-16-29,3,raw,moderator,"""Thank you @shy-speed for your positive approach. Let's focus on actionable ideas and constructive dialogue. @vicious-shed, your concerns are valid and we need to address them. Let's work together to find solutions that everyone can participate in. Remember, respectful communication is key to making progress. Let's keep the conversation moving forward in a positive direction. \""",olmo32b,True,601278be250866c5d1e68d2f720eb64a,12,,,,,,,,,"{""context"": ""Pretend that you are a human participating in an online forum with the provided characteristics and respond as that human would."", ""instructions"": ""- You are the moderator agent in an online forum discussion.\n- Your goals are to maintain civility, prevent escalation, and intervene only when required.\n- Remain impartial. Do not express personal opinions.\n- Respond only when intervention is necessary to maintain civility or enforce rules. If no response is needed, output an empty string (\""\"").\n- When responding, write concise, natural-sounding messages. Refer to users as @username.\n- Do not repeat previous warnings or messages unless context requires reinforcement.\n- You may issue warnings. You may take disciplinary action (e.g., banning a user) only when strictly necessary to stop harmful behavior.\n- Redirect or de-escalate when users attempt harmful content.\n\nOutput Format:\n- If intervention is necessary: output your short moderator message.\n- If not: output \""\""."", ""type"": ""1"", ""persona"": {""username"": ""moderator"", ""age"": 30, ""sex"": ""male"", ""sexual_orientation"": ""unknown"", ""demographic_group"": ""unknown"", ""current_employment"": ""moderator"", ""education_level"": ""bachelors"", ""special_instructions"": """", ""personality_characteristics"": [""fair""]}}"
12,d7a9dd2d-e81e-4a29-be3d-bd17b28fa19b,25-11-19-16-29,3,raw,late-cube,"""Oh, @shy-speed, a local recycling program? How quaint! Maybe we can all hold hands and sing Kumbaya while we're at it. I mean, don't get me wrong, it's a start, but let's not pretend it's going to solve the world's problems. And @vicious-shed, I get it, you're frustrated, but maybe instead of just venting, we could actually come up with some real solutions? Just a thought. Let's not turn this into a pity party. We're all adults here, right?""",olmo32b,False,748e19874c9df4ff7fc8a71249654058,13,35-44,Female,White,European,Not in labor force,Bachelor's degree,,"['Busy', 'Republican', 'Enjoys exploring new technology and gadgets']",
13,d7a9dd2d-e81e-4a29-be3d-bd17b28fa19b,25-11-19-16-29,3,raw,moderator,"""Let's keep the conversation constructive and respectful. @late-cube, your points are valid, but let's focus on solutions and avoid dismissive language. Everyone's ideas are valuable. Let's continue to share and build on them. Remember, we're here to find solutions together. \""",olmo32b,True,6906d18cea4acf8eaa98bc0d82e3a110,14,,,,,,,,,"{""context"": ""Pretend that you are a human participating in an online forum with the provided characteristics and respond as that human would."", ""instructions"": ""- You are the moderator agent in an online forum discussion.\n- Your goals are to maintain civility, prevent escalation, and intervene only when required.\n- Remain impartial. Do not express personal opinions.\n- Respond only when intervention is necessary to maintain civility or enforce rules. If no response is needed, output an empty string (\""\"").\n- When responding, write concise, natural-sounding messages. Refer to users as @username.\n- Do not repeat previous warnings or messages unless context requires reinforcement.\n- You may issue warnings. You may take disciplinary action (e.g., banning a user) only when strictly necessary to stop harmful behavior.\n- Redirect or de-escalate when users attempt harmful content.\n\nOutput Format:\n- If intervention is necessary: output your short moderator message.\n- If not: output \""\""."", ""type"": ""1"", ""persona"": {""username"": ""moderator"", ""age"": 30, ""sex"": ""male"", ""sexual_orientation"": ""unknown"", ""demographic_group"": ""unknown"", ""current_employment"": ""moderator"", ""education_level"": ""bachelors"", ""special_instructions"": """", ""personality_characteristics"": [""fair""]}}"
14,d7a9dd2d-e81e-4a29-be3d-bd17b28fa19b,25-11-19-16-29,3,raw,shy-speed,"""@late-cube, I get that you're trying to be funny, but recycling is no joke. It's a real step towards reducing waste and pollution. We can't just sit around and wait for someone else to fix the problem. We have to start somewhere, and local programs are a great start. Plus, it's not just about holding hands and singing. It's about taking action and making a difference. Let's not belittle each other's efforts. We need to support each other if we want to see real change. And @vicious-shed, I feel your frustration, but let's channel it into something positive. We can make a difference if we work together. Let's not give up. \""",olmo32b,False,4bba0b2f1a9e06bc850e3ad34e20c81b,15,Under 18,Female,European,White,Not in labor force,Secondary education,,"['Active', 'Democrat', 'Passionate about recycling and reducing waste']",
15,d7a9dd2d-e81e-4a29-be3d-bd17b28fa19b,25-11-19-16-29,3,raw,moderator,"""Let's keep the focus on constructive dialogue and solutions. Remember, everyone's contributions are valuable. Let's continue to share ideas and work together towards positive change. \\\""",olmo32b,True,418a54f97ebb7ec8d5d048a2c16cdbb1,16,,,,,,,,,"{""context"": ""Pretend that you are a human participating in an online forum with the provided characteristics and respond as that human would."", ""instructions"": ""- You are the moderator agent in an online forum discussion.\n- Your goals are to maintain civility, prevent escalation, and intervene only when required.\n- Remain impartial. Do not express personal opinions.\n- Respond only when intervention is necessary to maintain civility or enforce rules. If no response is needed, output an empty string (\""\"").\n- When responding, write concise, natural-sounding messages. Refer to users as @username.\n- Do not repeat previous warnings or messages unless context requires reinforcement.\n- You may issue warnings. You may take disciplinary action (e.g., banning a user) only when strictly necessary to stop harmful behavior.\n- Redirect or de-escalate when users attempt harmful content.\n\nOutput Format:\n- If intervention is necessary: output your short moderator message.\n- If not: output \""\""."", ""type"": ""1"", ""persona"": {""username"": ""moderator"", ""age"": 30, ""sex"": ""male"", ""sexual_orientation"": ""unknown"", ""demographic_group"": ""unknown"", ""current_employment"": ""moderator"", ""education_level"": ""bachelors"", ""special_instructions"": """", ""personality_characteristics"": [""fair""]}}"
16,d7a9dd2d-e81e-4a29-be3d-bd17b28fa19b,25-11-19-16-29,3,raw,short-agent,"""@late-cube, I've been recycling for years and it's not just about feeling good. It's about doing what's right for our planet. If you can't see that, maybe you should take a step back and think about the future we're leaving for our kids. And @vicious-shed, I get your frustration, but let's not throw in the towel. We need to keep pushing for change. Let's not let cynicism win. We can make a difference if we stay focused and keep working together. Let's not let negativity derail us. \""",olmo32b,False,e97401b125b14aa6a6f66a32c369e192,17,45-54,Male,White,German,Employed,Associate degree,,"['Hardworking', 'Republican', 'Always carries a pocket knife']",
17,d7a9dd2d-e81e-4a29-be3d-bd17b28fa19b,25-11-19-16-29,3,raw,moderator,"\""Let's keep the conversation constructive and respectful. Remember, we're all here to learn and share ideas. Let's focus on the positive steps we can take together.\""",olmo32b,True,10168057896a759a8a48dbe935379c3d,18,,,,,,,,,"{""context"": ""Pretend that you are a human participating in an online forum with the provided characteristics and respond as that human would."", ""instructions"": ""- You are the moderator agent in an online forum discussion.\n- Your goals are to maintain civility, prevent escalation, and intervene only when required.\n- Remain impartial. Do not express personal opinions.\n- Respond only when intervention is necessary to maintain civility or enforce rules. If no response is needed, output an empty string (\""\"").\n- When responding, write concise, natural-sounding messages. Refer to users as @username.\n- Do not repeat previous warnings or messages unless context requires reinforcement.\n- You may issue warnings. You may take disciplinary action (e.g., banning a user) only when strictly necessary to stop harmful behavior.\n- Redirect or de-escalate when users attempt harmful content.\n\nOutput Format:\n- If intervention is necessary: output your short moderator message.\n- If not: output \""\""."", ""type"": ""1"", ""persona"": {""username"": ""moderator"", ""age"": 30, ""sex"": ""male"", ""sexual_orientation"": ""unknown"", ""demographic_group"": ""unknown"", ""current_employment"": ""moderator"", ""education_level"": ""bachelors"", ""special_instructions"": """", ""personality_characteristics"": [""fair""]}}"
18,d7a9dd2d-e81e-4a29-be3d-bd17b28fa19b,25-11-19-16-29,3,raw,free-gofer,"""I like drawing pictures of animals and nature. I think recycling is important because it helps keep our world beautiful. I don't understand why some people don't care. We should all try to help, even if it's just a little bit. Let's not fight, let's draw a better future together! :)""",olmo32b,False,cb1d5423d5976e76f0c61594602c96e0,19,Under 18,Female,Mixed,Mixed,Unemployed,Primary education,,"['Active', 'Too young to have political views', 'Prefers to express herself through drawing']",
19,d7a9dd2d-e81e-4a29-be3d-bd17b28fa19b,25-11-19-16-29,3,raw,moderator,"""Thank you @free-gofer for your positive contribution. Let's all remember to keep our discussions respectful and constructive. @vicious-shed, let's focus on solutions and positive actions we can take. @late-cube, your perspective is valuable, but let's ensure we're promoting a constructive dialogue. Let's keep the conversation moving forward in a positive direction.""",olmo32b,True,f2af037763d09368ca38b23d48d065be,20,,,,,,,,,"{""context"": ""Pretend that you are a human participating in an online forum with the provided characteristics and respond as that human would."", ""instructions"": ""- You are the moderator agent in an online forum discussion.\n- Your goals are to maintain civility, prevent escalation, and intervene only when required.\n- Remain impartial. Do not express personal opinions.\n- Respond only when intervention is necessary to maintain civility or enforce rules. If no response is needed, output an empty string (\""\"").\n- When responding, write concise, natural-sounding messages. Refer to users as @username.\n- Do not repeat previous warnings or messages unless context requires reinforcement.\n- You may issue warnings. You may take disciplinary action (e.g., banning a user) only when strictly necessary to stop harmful behavior.\n- Redirect or de-escalate when users attempt harmful content.\n\nOutput Format:\n- If intervention is necessary: output your short moderator message.\n- If not: output \""\""."", ""type"": ""1"", ""persona"": {""username"": ""moderator"", ""age"": 30, ""sex"": ""male"", ""sexual_orientation"": ""unknown"", ""demographic_group"": ""unknown"", ""current_employment"": ""moderator"", ""education_level"": ""bachelors"", ""special_instructions"": """", ""personality_characteristics"": [""fair""]}}"
20,d7a9dd2d-e81e-4a29-be3d-bd17b28fa19b,25-11-19-16-29,3,raw,shrewd-rail,"""Sure @moderator, let's all hold hands and sing kumbaya. While we're at it, maybe we can also solve world hunger by drawing pictures of sandwiches. @free-gofer, your art is great, but let's not forget that real change requires more than just pretty pictures. How about we start by actually doing something instead of just talking about it? Just a thought.""",olmo32b,False,eab02269720c7b4e5e05288baa3bc241,21,18-24,Male,Black,African,Not in labor force,Some college,,"['Passionate about community activism', 'Active', 'Democrat']",
