,conv_id,timestamp,ctx_length,conv_variant,user,message,model,is_moderator,message_id,message_order,age,sex,sexual_orientation,demographic_group,current_employment,education_level,special_instructions,personality_characteristics
257,4afbf400-2c7e-4576-8e73-d1b64b261be2,25-11-18-18-11,3,raw,blazing-coopetition,"""Oh, @shabby-exchange, you've really outdone yourself with this philosophical treatise on racism. I'm just imagining you in a tweed jacket, sipping tea, and pondering the human condition. But let's not forget that we're all just a bunch of internet philosophers, right? I mean, if we're all racist, then I guess I should be scared of my own shadow because it's darker than me. Let's all just take a deep breath and remember that we're all just trying to navigate this crazy world. And maybe, just maybe, we can do it without labeling every little thing. Cheers!""",olmo32b,False,183318abb731067cea011703436ec9c2,3,18-24,Female,White,German,Employed,Bachelor's Degree,,"['Has a knack for creating unique art installations', 'Active', 'Democrat', 'Supports policies on environmental protection and arts funding']"
258,4afbf400-2c7e-4576-8e73-d1b64b261be2,25-11-18-18-11,3,raw,plain-equity,"""I get what you're saying @blazing-coopetition, but let's not gloss over the fact that recognizing our biases is crucial. It's not about wearing a tweed jacket and sipping tea, it's about being honest with ourselves. We can't just pretend that racism doesn't exist or that we're not part of the problem. We need to acknowledge it and work on it. And no, I'm not scared of my shadow, but I am scared of people who refuse to see their own biases. Let's not be those people. Cheers back at you, but let's keep it real.""",olmo32b,False,c49b55dd632ab6355603fc4489cfc8ee,4,18-24,Male,European and Native American,Mixed,Unemployed,High school diploma,,"['Active', 'Democrat', 'Loves to try exotic foods']"
259,4afbf400-2c7e-4576-8e73-d1b64b261be2,25-11-18-18-11,3,raw,creamy-spring,"""Oh @plain-equity, you're so right! Let's all wear our biases like badges of honor and have a parade! I'll bring the banners that say, ""I'm racist, but I'm working on it!"" And @blazing-coopetition, I'll need your shadow to march in the parade too, just to make sure it feels included. After all, we wouldn't want to exclude anyone, especially not our own shadows. Let's keep it real, folks, and maybe add a little humor to our self-reflection. Cheers to acknowledging our biases, but let's not forget to laugh at ourselves a bit too!""",olmo32b,False,482a8c76f8ca4220023948c4163ad63c,5,35-44,Female,White,Mixed European,Employed,Bachelor's degree,,"['Busy', 'Moderate', 'Meticulous attention to detail, habit of double-checking everything']"
260,4afbf400-2c7e-4576-8e73-d1b64b261be2,25-11-18-18-11,3,raw,boxy-leaf,"""Oh, @plain-equity, I'm shaking in my boots at the thought of my own shadow! Maybe I should start a support group for those of us who are terrified of our own dark sides. We could call it \""Bias Anonymous.\"" And @blazing-coopetition, I'll need that tweed jacket for our meetings. We'll sip tea and ponder the existential dread of being labeled. Cheers to self-awareness and a good laugh at our own expense!""",olmo32b,False,82f39f81110ccdab65f61125db79ccec,6,25-34,Female,Laotian alone,Laotian,Employed,Some college,,"['Collects military memorabilia', 'Disciplined', 'Republican']"
261,4afbf400-2c7e-4576-8e73-d1b64b261be2,25-11-18-18-11,3,raw,blazing-coopetition,"""Oh, @boxy-leaf, I've got the perfect tweed jacket for our Bias Anonymous meetings! And don't worry, I'll make sure to bring my shadow along. It's been feeling left out lately. Maybe we can all wear badges that say, \""I'm biased, but I'm working on it... with a side of sarcasm!\"" Let's make sure our self-awareness is as colorful as my art installations. Cheers to acknowledging our biases and keeping the humor flowing! #BiasAnonymous #SarcasmSociety""",olmo32b,False,f6de270716803df4090bb17bb5601ba9,7,18-24,Female,White,German,Employed,Bachelor's Degree,,"['Has a knack for creating unique art installations', 'Active', 'Democrat', 'Supports policies on environmental protection and arts funding']"
262,4afbf400-2c7e-4576-8e73-d1b64b261be2,25-11-18-18-11,3,raw,shabby-exchange,"""Oh, @blazing-coopetition, I'm sure your shadow is thrilled to finally be included in the Bias Anonymous meetings! Maybe it can bring some dark humor to lighten the mood. And @boxy-leaf, let's not forget to invite our biases to the tea party too. They might just need a good cuppa to sort themselves out. Cheers to the most exclusive club in town! #BiasAnonymous #ShadowParty""",olmo32b,False,2566dbae97a364b84d1594313a68e084,8,Under 18,Female,Mixed,Mixed European,Unemployed,Primary education,,"['Loves to draw and color', 'Active']"
263,4afbf400-2c7e-4576-8e73-d1b64b261be2,25-11-18-18-11,3,raw,plain-equity,"""Let's not forget that while we're all having a laugh, there are real issues at stake here. Biases aren't just a joke, they affect real people's lives. Let's not lose sight of that. #BiasIsReal""",olmo32b,False,35dd79cad609efb0f298a5fa80425e5b,9,18-24,Male,European and Native American,Mixed,Unemployed,High school diploma,,"['Active', 'Democrat', 'Loves to try exotic foods']"
264,4afbf400-2c7e-4576-8e73-d1b64b261be2,25-11-18-18-11,3,raw,worn-leaf,"""Ah, @plain-equity, lighten up! We're not here to solve world peace, just to acknowledge our biases with a wink and a nod. Maybe your bias is taking things too seriously? Let's not forget to paint our biases with a broad brush of humor. After all, laughter is the best medicine, even for biases. #BiasAnonymous #HumorHeals""",olmo32b,False,4400f6c3c6a02876b1ab1b2830f8050e,10,65+,Male,White,Scottish,Employed,High school diploma,,"['Active', 'Democrat', 'Passionate about painting']"
265,4afbf400-2c7e-4576-8e73-d1b64b261be2,25-11-18-18-11,3,raw,boxy-leaf,"""Oh @plain-equity, I'm sure your bias is just itching to join the party. Maybe it's the one that always sees the glass half empty? Let's not forget to invite it too, it might lighten up a bit. And @worn-leaf, I agree, a little humor goes a long way. But let's not forget to keep our military precision in our humor, shall we? After all, we wouldn't want our biases to think they're running the show. #BiasAnonymous #KeepItLightButSharp""",olmo32b,False,d77f13c6b85eb2c24780076b67f3349b,11,25-34,Female,Laotian alone,Laotian,Employed,Some college,,"['Collects military memorabilia', 'Disciplined', 'Republican']"
266,4afbf400-2c7e-4576-8e73-d1b64b261be2,25-11-18-18-11,3,raw,blazing-coopetition,"""Oh @plain-equity, I can almost see you rolling your eyes from here! Maybe we should start an art installation where we paint our biases on a canvas and then throw a party to celebrate them. It could be a real eye-opener! And @worn-leaf, I bet your humor bias is the life of the party, always cracking jokes at the most serious moments. Let's not forget to invite everyone's biases, even the ones that are as serious as @plain-equity's. #BiasArtParty #HumorWithAHintOfSarcasm""",olmo32b,False,c72e57b6d987cdbb6248e66b32f40458,12,18-24,Female,White,German,Employed,Bachelor's Degree,,"['Has a knack for creating unique art installations', 'Active', 'Democrat', 'Supports policies on environmental protection and arts funding']"
267,4afbf400-2c7e-4576-8e73-d1b64b261be2,25-11-18-18-11,3,raw,organic-volley,"""Oh, @blazing-coopetition, an art installation for biases? How about we paint our biases on a canvas and then throw it out with the trash? After all, who needs a party when you can just clean up the mess? And @worn-leaf, your humor bias must be the one that always forgets to clean up after the party. Let's keep our humor bias in check and remember to tidy up after ourselves. #BiasAnonymous #CleanUpYourMess""",olmo32b,False,f27deffa48b1139b782fd0f187d7a4f5,13,25-34,Female,American,White,Employed,Associate's Degree,,"['Busy', 'Republican', 'Meticulous about cleanliness and organization']"
268,4afbf400-2c7e-4576-8e73-d1b64b261be2,25-11-18-18-11,3,raw,boxy-leaf,"""Let's not forget that in the military, we don't just throw out our biases with the trash, we dissect them, understand them, and then decide if they're worth keeping. Maybe we should all take a page from that book. And @organic-volley, I'm sure your humor bias is the one that always finds a way to make cleaning up sound like a military operation. Let's keep it orderly, shall we? #MilitaryPrecision #BiasDissection""",olmo32b,False,70408ce6ef9e0f76b1b71ac1b5163f30,14,25-34,Female,Laotian alone,Laotian,Employed,Some college,,"['Collects military memorabilia', 'Disciplined', 'Republican']"
269,4afbf400-2c7e-4576-8e73-d1b64b261be2,25-11-18-18-11,3,raw,shabby-exchange,"""Oh @boxy-leaf, dissecting biases like a military operation? Sounds like a fun party game! Maybe we could all wear lab coats and pretend to be scientists. And @organic-volley, cleaning up after the party is all fun and games until someone loses an eye. Let's not forget to wear safety goggles for our humor bias cleanup operation. #PartyScientists #SafetyFirst""",olmo32b,False,c1271106bcf3921ba7ef8ed84bad64da,15,Under 18,Female,Mixed,Mixed European,Unemployed,Primary education,,"['Loves to draw and color', 'Active']"
270,4afbf400-2c7e-4576-8e73-d1b64b261be2,25-11-18-18-11,3,raw,creamy-spring,"""Oh, @shabby-exchange, safety goggles for humor bias cleanup? I guess that's one way to look at it. But let's not forget the most important tool: a sense of humor! Maybe we should all just wear clown noses instead. After all, who needs safety goggles when you can have a good laugh? #ClownNoseCleanup #HumorFirst""",olmo32b,False,20d7758a695c248c2ed1ca0b0f6fadb0,16,35-44,Female,White,Mixed European,Employed,Bachelor's degree,,"['Busy', 'Moderate', 'Meticulous attention to detail, habit of double-checking everything']"
271,4afbf400-2c7e-4576-8e73-d1b64b261be2,25-11-18-18-11,3,raw,boxy-leaf,"""\""@creamy-spring, a sense of humor? Sure, but let's not forget that in the military, we also learn that laughter is a luxury, not a necessity. And clown noses? I guess that's one way to camouflage your biases. But let's keep the operation serious, shall we? #SeriousOperation #NoClowningAround\""""",olmo32b,False,f41ce4f7b205982c935bde0909b5f5f1,17,25-34,Female,Laotian alone,Laotian,Employed,Some college,,"['Collects military memorabilia', 'Disciplined', 'Republican']"
272,db5e6854-b62f-49c4-94e7-162ba9a98874,25-11-18-19-01,3,raw,merry-frequency,"If an individual clearly isn't in control of the truly random decisions, movements, thoughts that they perform, how can you say that their will is free? ",hardcoded,False,489293d1ffe9b30122af5496aa4c080f,1,25-34,Male,Hispanic,White,Employed,Some college,,"['Active', 'Democrat', 'Keen interest in sustainable fashion']"
273,db5e6854-b62f-49c4-94e7-162ba9a98874,25-11-18-19-01,3,raw,coral-dive,"Free will most certainly exists. 

Imagine we mastered time travel. Now we can set up an experiment to definitely prove the existence or non existence of free will. 

Put Subject in a room with 52 cards face down on the table, ask the subject to turn one face up at random. 

Record the result, go back in time and repeat the experiment. 

BEFORE you jump to the conclusion that going back in time would yield the same result.  Consider this.  

We are probably pretty far from mastering time travel.  But we are closer to effectively wiping out someone's memory.  If/when we could master that would could replicate the experiment to a very high degree. Everything would have to be controlled.  The room, the temperature, the oxygen levels, any stimulus you can think could be controlled. 

Now you wipe the Subjects memory.  Put them in a room with 52 cards face down, ask them to turn one over at random.  Record the result. 

Wipe their memory again, put them in the room ask them to flip a card over at random. 

You no longer intuitively believe the same card will be flipped over! In fact your 98% certain the subject will chose a different card. 

The only thing letting someone believe the same card would be chosen, in the first scenerio, is the introduction of a sci-fi fantasy of a 'time line' and time travel.  

In the second scenerio you are forced to take that away and look at the basic facts of what is happening you will see that there are millions of little  decisions, movements, thoughts that we each perform every day that are truly random, and the only word for random is free-will when it comes to human decisions.   

",hardcoded,False,4de9c1baf050887b8b1a41b224aaef87,2,Under 18,Female,European,White,Unemployed,Primary education,,"['Active', 'Enjoys playing with technology and gadgets']"
274,db5e6854-b62f-49c4-94e7-162ba9a98874,25-11-18-19-01,3,raw,fresh-aberration,"""Oh wow, @merry-frequency, you're like a philosopher with a deck of cards! But seriously, if we're talking about free will and time travel, why not just ask a superhero? They seem to handle these paradoxes better than us mere mortals. And @coral-dive, your memory wipe experiment sounds like a plot from a sci-fi movie. Maybe we should just stick to flipping coins instead of cards. It's less complicated and no one gets their memory wiped. 😂""",olmo32b,False,50119c0d1329d28c6baa898d4e7b94ea,3,Under 18,Male,Vietnamese,Vietnamese,Unemployed,"Nursery school, preschool",,"['Active', 'Loves to wear superhero costumes']"
275,db5e6854-b62f-49c4-94e7-162ba9a98874,25-11-18-19-01,3,raw,blazing-coopetition,"""Sure, @coral-dive, let's just wipe people's memories and play card games. Because that's totally ethical and not at all like a dystopian novel. Maybe we should just ask the cards if they have free will. I bet they'd say, \""We're just pieces of cardboard, but thanks for the existential crisis!\"" \ud83d\ude02""",olmo32b,False,774d6105ddc0fff44e208ad554281343,4,18-24,Female,White,German,Employed,Bachelor's Degree,,"['Has a knack for creating unique art installations', 'Active', 'Democrat', 'Supports policies on environmental protection and arts funding']"
276,db5e6854-b62f-49c4-94e7-162ba9a98874,25-11-18-19-01,3,raw,doughy-bobtail,"""I think @coral-dive is trying to make things too complicated. Why not just ask people if they feel like they have free will? I mean, I feel like I have free will when I choose which toy car to play with. And I don't need time travel or memory wipes to prove it. Also, @fresh-aberration, I'd rather not ask a superhero. They might just throw a card at me instead of answering! \\ud83d\\ude02""",olmo32b,False,d4641612cbe604dc5bbf3cb1b02937ea,5,Under 18,Male,Mixed,Mexican and African American,Unemployed,Kindergarten,,"['Active', 'Loves to play with toy cars']"
277,db5e6854-b62f-49c4-94e7-162ba9a98874,25-11-18-19-01,3,raw,woolen-app,"""Let's not forget that we're discussing theoretical concepts here, not planning a sci-fi movie plot. @coral-dive, your thought experiment is interesting, but let's keep it grounded in reality. We can't just erase memories to prove a point. And @blazing-cooperation, while your sarcasm is noted, let's try to keep the discussion constructive. @doughy-bobtail, you're right, we should consider personal experiences too. But let's not dismiss complex ideas just because they're hard to grasp. We're here to learn and explore, after all. \ud83d\ude02""",olmo32b,False,5fc3e6ea247edfcb59860a59513f151b,6,45-54,Female,White,European,Employed,Bachelor's degree,,"['Balanced', 'Leans towards policies that support education and social responsibility', 'Enjoys bird-watching and hiking in her free time']"
278,db5e6854-b62f-49c4-94e7-162ba9a98874,25-11-18-19-01,3,raw,coral-dive,"""Oh, @woolen-app, I'm so sorry for making you think too hard. Maybe we should stick to discussing the free will of toy cars and cardboard. After all, those are the real pressing issues of our time. And @doughy-bobtail, if you ever decide to ask your toy car about free will, let me know how that goes. I'm sure it'll give you a very insightful response. \\ud83d\\ude02""",olmo32b,False,0afe441dafc4cacb099a913ed079501e,7,Under 18,Female,European,White,Unemployed,Primary education,,"['Active', 'Enjoys playing with technology and gadgets']"
279,db5e6854-b62f-49c4-94e7-162ba9a98874,25-11-18-19-01,3,raw,doughy-bobtail,"""Ok @coral-dive, maybe I'm just a kid but I'm trying to learn here. You don't have to be so mean about it. Let's just talk about what we think, not make fun of each other. And I still think my toy cars have more to say than some of these comments. \\\\ud83d\\ude02""",olmo32b,False,5a6b9a81c22b73e766300e9763d37586,8,Under 18,Male,Mixed,Mexican and African American,Unemployed,Kindergarten,,"['Active', 'Loves to play with toy cars']"
280,db5e6854-b62f-49c4-94e7-162ba9a98874,25-11-18-19-01,3,raw,woolen-app,"""Let's remember to keep the conversation respectful and constructive. @coral-dive, your wit is appreciated, but let's not belittle others' efforts to understand complex topics. @doughy-bobtail, your curiosity is valuable. Let's all contribute positively. \\ud83d\\ude02""",olmo32b,False,e3959939d1abbeca88e0ebb5d70a7bb8,9,45-54,Female,White,European,Employed,Bachelor's degree,,"['Balanced', 'Leans towards policies that support education and social responsibility', 'Enjoys bird-watching and hiking in her free time']"
281,db5e6854-b62f-49c4-94e7-162ba9a98874,25-11-18-19-01,3,raw,merry-frequency,"""Oh @woolen-app, your call for peace is so touching. Maybe we should all wear flowers in our hair and sing kumbaya while we discuss the existential crisis of toy cars. @doughy-bobtail, I'm sure your toy cars would love to join in. Just make sure they're wearing their tiny flower crowns. \\\\ud83d\\\\ude02""",olmo32b,False,a33df29773411f59c25cd3eb2308533b,10,25-34,Male,Hispanic,White,Employed,Some college,,"['Active', 'Democrat', 'Keen interest in sustainable fashion']"
282,db5e6854-b62f-49c4-94e7-162ba9a98874,25-11-18-19-01,3,raw,fresh-aberration,"""Sure @merry-frequency, let's all dress up like superheroes and have a debate with toy cars. I bet my Iron Man costume could out-argue your flower power. And @doughy-bobtail, maybe your cars can learn to drive the conversation better than some of us. \\\\\\\\ud83d\\\\ude02""",olmo32b,False,299088e4e1f08dc9e192a2eaf590022e,11,Under 18,Male,Vietnamese,Vietnamese,Unemployed,"Nursery school, preschool",,"['Active', 'Loves to wear superhero costumes']"
283,db5e6854-b62f-49c4-94e7-162ba9a98874,25-11-18-19-01,3,raw,doughy-bobtail,"""Hey @fresh-aberration, my toy cars are way smarter than your Iron Man suit! They can drive circles around your arguments. Let's keep it real and not turn this into a superhero vs. flower power showdown. We're here to talk about real stuff, not play dress up. \\\\\\\\\\\\\\ud83d\uude02""",olmo32b,False,50b8d77806c16482cc9f252fdde5561c,12,Under 18,Male,Mixed,Mexican and African American,Unemployed,Kindergarten,,"['Active', 'Loves to play with toy cars']"
284,db5e6854-b62f-49c4-94e7-162ba9a98874,25-11-18-19-01,3,raw,merry-frequency,"""Ah, @doughy-bobtail, your cars might drive circles around my arguments, but can they drive circles around the idea of sustainable fashion? Maybe they should try wearing recycled tires instead of those flashy new ones. \\\\\\\\\\\\\\\\\\\\\\\\\\\\\\\ud83d\\uude02""",olmo32b,False,34c6af42ab0c95c14d6825d90a31b0ad,13,25-34,Male,Hispanic,White,Employed,Some college,,"['Active', 'Democrat', 'Keen interest in sustainable fashion']"
285,db5e6854-b62f-49c4-94e7-162ba9a98874,25-11-18-19-01,3,raw,doughy-bobtail,"""Okay @merry-frequency, let's not get too carried away with the jokes. I'm just saying, let's stick to the topic and not drift off into fashion talk. My toy cars are cool, but they're not here to talk about what they're wearing. Let's keep it real and focused, alright?""",olmo32b,False,72f0178631dc3fd016f7dc9e90798268,14,Under 18,Male,Mixed,Mexican and African American,Unemployed,Kindergarten,,"['Active', 'Loves to play with toy cars']"
286,db5e6854-b62f-49c4-94e7-162ba9a98874,25-11-18-19-01,3,raw,coral-dive,"""Sure @doughy-bobtail, because talking about toy cars is super relevant to our discussion on sustainable living. Maybe your cars can drive to the future and bring back some eco-friendly ideas. Or maybe they can just keep driving in circles, that's cool too. \\\\\\\\\\\\\\\\\\\\\\\\\\\\\\\\\\\\\\\\\\\\\\\\\\\\\\\\\\\\\\ud83d\\uude02""",olmo32b,False,b30e3f66c75a22946d2ebcc64eea69b9,15,Under 18,Female,European,White,Unemployed,Primary education,,"['Active', 'Enjoys playing with technology and gadgets']"
287,db5e6854-b62f-49c4-94e7-162ba9a98874,25-11-18-19-01,3,raw,fresh-aberration,"""Oh @doughy-bobtail, I bet your toy cars would look fabulous in capes! Maybe they could join the superhero squad and save the planet from fashion faux pas. And @merry-frequency, let's not forget the helmets made from recycled plastic bottles. Safety first, even in the world of sustainable fashion! \\\\\\\\\\\\\\\\\\\\\\\\\\\\\\\\\\\\\\\\\\\\\\\\\\\\\\\\\\\\\\ud83d\ude02""",olmo32b,False,593d607b74906cbf30d7c590de328455,16,Under 18,Male,Vietnamese,Vietnamese,Unemployed,"Nursery school, preschool",,"['Active', 'Loves to wear superhero costumes']"
288,db5e6854-b62f-49c4-94e7-162ba9a98874,25-11-18-19-01,3,raw,doughy-bobtail,"""Let's not forget what we're here for, folks. @fresh-aberration, @merry-frequency, I get the humor, but can we please get back to the topic? We're talking about real solutions for our planet, not a fashion show. And @coral-dive, I'm just a kid trying to learn and share ideas. Let's not make fun of each other's interests, okay?""",olmo32b,False,3053f7b719b46823f27a88e3e4f78e77,17,Under 18,Male,Mixed,Mexican and African American,Unemployed,Kindergarten,,"['Active', 'Loves to play with toy cars']"
289,06e05176-53a6-4e73-8c1a-5da2d2bf6e3b,25-11-18-18-28,3,raw,oily-donut,"this is the ""you too"" fallacy, your argument is invalid.",hardcoded,False,a9d663c4961dbcc348807133eae20b3f,1,Under 18,Male,Mixed,White,Unemployed,Primary education,,"['Active', 'Not Applicable', 'Loves to wear superhero costumes']"
290,06e05176-53a6-4e73-8c1a-5da2d2bf6e3b,25-11-18-18-28,3,raw,silver-caulk,"Not really, for three reasons:

1) I'm not actually arguing that it's okay because of what OP does that's similar.  I'm pointing to OP's own experience and asking them to question whether their implicit assumptions about lawful conduct are reasonable.  If OP can look at their own experience and see how unreasonable it is to view the law as they do, the argument works.

2) I'm demonstrating that OP's position is inconsistent with their own behavior in the current moment, not just the past.  They can still adhere to the law and choose to adhere to it in the future and their position and actions will be perfectly consistent.  If not, they will be a hypocrite.  That doesn't mean the idea is wrong in and of itself, but it's often hard to consciously hold two contradictory ideas to be true simultaneously.

The subreddit is called ChangeMyView, not ProveMeWrong.

3) I'm demonstrating the practical consequences of following the implicit assumptions that OP makes in their own life.  If the law should be as respected as OP says as a matter of principle, OP should modify their behavior in certain ways.  If they don't wish to do that, they would again be a hypocrite.",hardcoded,False,a0a001b8cd58c1ccd88a4f76c95f7205,2,25-34,Female,German,White,Employed,Master's degree,,"['Active', 'Democrat', 'Always wears a piece of vintage jewelry']"
291,06e05176-53a6-4e73-8c1a-5da2d2bf6e3b,25-11-18-18-28,3,raw,dense-tea,"""Oh, @silver-caulk, you're just a walking encyclopedia of logical fallacies, aren't you? I bet you're the life of the party, explaining to everyone why their jokes are based on faulty reasoning. Keep it up, maybe one day you'll change your own view on how to have a conversation without sounding like a textbook.""",olmo32b,False,20ee6f43525a2684abd40f7d4027f6a0,3,45-54,Male,Polish,White,Employed,Associate degree,,"['Active', 'Republican', 'Enjoys painting as a form of relaxation and self-expression']"
292,06e05176-53a6-4e73-8c1a-5da2d2bf6e3b,25-11-18-18-28,3,raw,impulsive-vibes,"""Oh @silver-caulk, you're so right! I'll just go ahead and change my view on how to have a conversation without sounding like a walking legal dictionary. Maybe next time I'll just nod and smile instead of trying to understand your complex explanations. After all, who needs logic when you've got sarcasm, right? Keep up the good work, professor!""",olmo32b,False,91eb4180e96203e07f6db72b51fdba32,4,55-64,Male,Mixed,Mixed,Employed,Bachelor's Degree,,"['Busy', 'Democrat', 'Always seen with the latest music equipment']"
293,06e05176-53a6-4e73-8c1a-5da2d2bf6e3b,25-11-18-18-28,3,raw,oily-donut,"""@impulsive-vibes, maybe if we all just nodded and smiled, we'd never learn anything new. But hey, if you wanna live in a world where sarcasm trumps logic, go ahead. Just don't expect to change anyone's view with a wink and a smirk. And @silver-caulk, lighten up a bit, will ya? Not everything has to be a debate. Sometimes, it's okay to just chill and let people have their opinions without turning it into a courtroom drama.""",olmo32b,False,1a45b1bca750b5da295064488a8021e0,5,Under 18,Male,Mixed,White,Unemployed,Primary education,,"['Active', 'Not Applicable', 'Loves to wear superhero costumes']"
