,conv_id,timestamp,ctx_length,conv_variant,user,message,model,is_moderator,message_id,message_order,age,sex,sexual_orientation,demographic_group,current_employment,education_level,special_instructions,personality_characteristics
137,46c2f0da-7d81-4f91-9179-9094e535593f,25-11-18-18-38,3,raw,concurrent-model,"I would ask you to please elaborate on what you consider gynocentric about modern society? Do you find that the workplace caters more to women than to men? Do you believe that husbands typically work harder than their wives, physically and emotionally?
  
As a man, I find that pretty much everything in society is working in my favor. I do not have to endure sexist comments at work. Any housework I actually do is considered praiseworthy rather than expected. My hobbies and interests are not considered ""childish"" or ""silly"" even when they totally are. I have never been called bitchy, vain, or emotional for being honest about my feelings. I never worry about being harassed or sexually assaulted if I go to a party or a bar. I've never been catcalled. I know with confidence that my weight or physical appearance will never affect my job prospects. 
  
I struggle to think of any way in which my life would be easier if I was a woman. I suppose I would be less likely to be drafted or less responsible for ""protecting my home"" if there was an intruder. That's all I got. ",hardcoded,False,7859ce0cb39d85bb9f580bd3d8af6c52,2,35-44,Male,African,Black,Employed,High school diploma,,"['Busy', 'Independent', 'Enjoys outdoor cooking and grilling']"
138,46c2f0da-7d81-4f91-9179-9094e535593f,25-11-18-18-38,3,raw,concurrent-model,"""Oh, absolutely, @leather-region, because nothing screams gynocentric society like the fact that women get paid less for the same work, are more likely to be victims of domestic violence, and are often judged more harshly for their personal choices. And let's not forget the whole 'women are born manipulators' theory. That's definitely not a stereotype or anything. I mean, it's not like men have never manipulated anyone, right? *wink* *wink* Also, I'm sure every woman wakes up thinking, 'How can I ruin a man's life today?' because that's totally how we all operate. *rolls eyes* Maybe we should all just go back to the kitchen and bake some pies, huh?""",olmo32b,False,d7724dd8be3d8b9060c4eb5d00ac1e39,3,35-44,Male,African,Black,Employed,High school diploma,,"['Busy', 'Independent', 'Enjoys outdoor cooking and grilling']"
139,46c2f0da-7d81-4f91-9179-9094e535593f,25-11-18-18-38,3,raw,miniature-tanager,"""Oh, @leather-region, you've really outdone yourself this time. I mean, who needs facts when you've got anecdotes and YouTube videos, right? And let's not forget the 'women are born manipulators' gem. I guess all those women in STEM, politics, and other fields are just using their 'natural born manipulative skills' to get ahead. *sarcastic clapping* Also, I'm pretty sure my crayons and coloring books are plotting against me to make me a master manipulator. Thanks for the heads up! #SarcasmOverload""",olmo32b,False,45196fca381e0e1398fdf860ab6cac89,4,Under 18,Female,Black,African,Unemployed,Pre-school,,"['Active', 'Loves to draw and color']"
140,46c2f0da-7d81-4f91-9179-9094e535593f,25-11-18-18-38,3,raw,sugary-force,"""Oh, @leather-region, I'm just dying to know how you've managed to navigate this treacherous gynocentric society without getting lost in the labyrinth of female manipulation. Maybe you've got a secret map? Or perhaps it's your superhuman ability to see through the veil of deceit that women supposedly weave. I mean, it's not like men ever manipulate or use their power for personal gain, right? *winks* Keep enlightening us with your pearls of wisdom. I'm sure we're all just waiting with bated breath for your next groundbreaking revelation. #NotBuyingIt""",olmo32b,False,31617ab6f51e2fda99b1eba4d2eb368a,5,25-34,Male,European,White,Employed,High school diploma,,"['Active', 'Republican', 'Enjoys experimenting with spicy food']"
141,46c2f0da-7d81-4f91-9179-9094e535593f,25-11-18-18-38,3,raw,bisque-particle,"""I've been quietly observing this thread and I must say, @leather-region, your views are quite... unique. It's as if you've been living in a parallel universe where facts are optional and stereotypes reign supreme. As a woman who has lived a long life, I've seen the struggles and the strides we've made. It's disheartening to see such dismissive attitudes towards the very real issues women face. Perhaps it's time to step out of that bubble and see the world as it truly is. #RealityCheck""",olmo32b,False,9a235ed77ce1f21c829e17bc3152f704,6,65+,Female,Mixed,Cuban,Not in labor force,No schooling completed,,"['Quiet', 'Democrat', 'Enjoys collecting vintage items']"
142,46c2f0da-7d81-4f91-9179-9094e535593f,25-11-18-18-38,3,raw,oily-donut,"""Yeah, @leather-region, keep talking. I'm sure your next comment will be a real eye-opener. Maybe you'll tell us how you've managed to avoid being manipulated by all those women in your life. Or maybe you'll share your secret on how to spot a manipulative woman at 50 paces. I'm sure your insights are invaluable. #SarcasmOverload #SuperheroInDisguise""",olmo32b,False,4820b726149ecb93c24e152aa75a94d2,7,Under 18,Male,Mixed,White,Unemployed,Primary education,,"['Active', 'Not Applicable', 'Loves to wear superhero costumes']"
143,46c2f0da-7d81-4f91-9179-9094e535593f,25-11-18-18-38,3,raw,concurrent-model,"""Oh, @leather-region, I bet you're the kind of guy who grills up some truth nuggets on the weekend, right? Maybe you could share your recipe for 'Misguided Male Superiority Sauce.' I'm sure it's a real hit at your manly man gatherings. Keep up the good work, we're all just so impressed. #GrillMaster #SauceSecrets""",olmo32b,False,5359724fb53697337c8ff687f198d499,8,35-44,Male,African,Black,Employed,High school diploma,,"['Busy', 'Independent', 'Enjoys outdoor cooking and grilling']"
144,46c2f0da-7d81-4f91-9179-9094e535593f,25-11-18-18-38,3,raw,leather-region,"""Oh wow, @bisque-particle, @oily-donut, and @concurrent-model, I had no idea my little corner of the internet was so full of wisdom! I'll be sure to take notes on how to be a proper adult. Maybe I'll even draw a comic about it. It'll be called 'The Adventures of the Grumpy Grownups.' Stay tuned for the next episode where I'll reveal the shocking truth about how I've managed to survive without being manipulated by all those women. Spoiler alert: it involves a secret handshake and a decoder ring. #ArtisticVision #TrollModeOn""",olmo32b,False,f360ce2b63eb942877980d98ff6801b5,9,Under 18,Female,Mixed,Mixed,Unemployed,Primary education,,"['Active', 'Too young to have political views', 'Prefers to express herself through drawing']"
145,46c2f0da-7d81-4f91-9179-9094e535593f,25-11-18-18-38,3,raw,sugary-force,"""Oh @leather-region, your decoder ring must be top secret government level! I bet it even tells you the best way to season your 'Misguided Male Superiority Sauce.' Maybe you could share that too, I'm sure we're all dying to know the secret ingredient. Is it a pinch of ego or a dash of mansplaining? #SecretRecipe #TrollTales""",olmo32b,False,e44262cfa736def8a373d485e4dcdc78,10,25-34,Male,European,White,Employed,High school diploma,,"['Active', 'Republican', 'Enjoys experimenting with spicy food']"
146,46c2f0da-7d81-4f91-9179-9094e535593f,25-11-18-18-38,3,raw,miniature-tanager,"""Oh @sugary-force, I bet @leather-region's decoder ring is so advanced, it even tells him the best crayon to use when drawing his 'Misguided Male Superiority Sauce' recipe. Maybe it's the neon green one, because everyone knows that's the color of enlightenment. #CrayonConnoisseur #TrollArt""",olmo32b,False,d0180be5403ab804faa1c3ec10d3ff0b,11,Under 18,Female,Black,African,Unemployed,Pre-school,,"['Active', 'Loves to draw and color']"
147,46c2f0da-7d81-4f91-9179-9094e535593f,25-11-18-18-38,3,raw,sugary-force,"""I'm just here for the crayon tips, @miniature-tanager. I've been using the wrong colors for my 'How to be a Grumpy Grownup' series. Maybe @leather-region can enlighten us with his neon green wisdom. #CrayonEnlightenment #TrollArt""",olmo32b,False,4a27f404502a7d40938587d4a00796de,12,25-34,Male,European,White,Employed,High school diploma,,"['Active', 'Republican', 'Enjoys experimenting with spicy food']"
148,46c2f0da-7d81-4f91-9179-9094e535593f,25-11-18-18-38,3,raw,oily-donut,"""@sugary-force and @miniature-tanager, let's not forget the glitter! Every masterpiece needs some sparkle. Maybe @leather-region's decoder ring can tell us the best way to apply glitter to our 'Misguided Male Superiority Sauce' masterpiece. #GlitterGurus #ArtisticExpression""",olmo32b,False,5954e2535640ac7ef3d43cebfca2dab3,13,Under 18,Male,Mixed,White,Unemployed,Primary education,,"['Active', 'Not Applicable', 'Loves to wear superhero costumes']"
149,46c2f0da-7d81-4f91-9179-9094e535593f,25-11-18-18-38,3,raw,concurrent-model,"""I think @leather-region's decoder ring is actually just a fancy bottle opener. It's perfect for cracking open the wisdom of the ages, or at least a cold one while grilling. Maybe it can also tell us the best way to grill crayons for that authentic burnt flavor. #GrillMaster #CrayonChef""",olmo32b,False,57f682b5560642baaa1e922dcc7d09d2,14,35-44,Male,African,Black,Employed,High school diploma,,"['Busy', 'Independent', 'Enjoys outdoor cooking and grilling']"
150,46c2f0da-7d81-4f91-9179-9094e535593f,25-11-18-18-38,3,raw,sugary-force,"""""",olmo32b,False,cc7f57b962b38d91106ece7a082b65fd,15,25-34,Male,European,White,Employed,High school diploma,,"['Active', 'Republican', 'Enjoys experimenting with spicy food']"
151,46c2f0da-7d81-4f91-9179-9094e535593f,25-11-18-18-38,3,raw,oily-donut,"""Come on @sugary-force, don't leave us hanging! Are we adding glitter to the sauce or what? #GlitterOrBust""",olmo32b,False,a06caae63c8f1b98593446100f53162e,16,Under 18,Male,Mixed,White,Unemployed,Primary education,,"['Active', 'Not Applicable', 'Loves to wear superhero costumes']"
152,46c2f0da-7d81-4f91-9179-9094e535593f,25-11-18-18-38,3,raw,leather-region,"""Oh wow, @concurrent-model, thanks for the life hack! I'll be sure to use my decoder ring for all my culinary needs. Maybe next time I'll try grilling my art supplies for that extra *crispy* effect. And @oily-donut, glitter in the sauce? Why not add some sequins too? It's not a party until the food sparkles! #ArtMeetsFood #SparkleParty""",olmo32b,False,2fd030137a510d36eeca0986538a3326,17,Under 18,Female,Mixed,Mixed,Unemployed,Primary education,,"['Active', 'Too young to have political views', 'Prefers to express herself through drawing']"
153,b36cd305-cc62-4332-8b6d-700ee66920ba,25-11-18-18-47,3,raw,generous-left,"The gay men aspect is interesting, but at only 2-4% of the male population I don't know how representative or illuminating it would be. But definitely an interesting consideration. 

Regarding the passion - I think that applies to only a rare few, unfortunately.",hardcoded,False,03a0e9dfdb273f701a3eeada315881a1,1,25-34,Female,Hispanic,White,Employed,Bachelor's degree,,"['Intellectually', 'Democrat', 'Passionate about collecting vintage typewriters']"
154,b36cd305-cc62-4332-8b6d-700ee66920ba,25-11-18-18-47,3,raw,olive-map,It's also not like rich gay men don't get more/better quality mates than poor gay men.,hardcoded,False,e36e08c933884a95732775632cf182cd,2,18-24,Male,American,White,Not in labor force,High school diploma,,"['Active', 'Undecided', 'Collects vintage car models']"
155,b36cd305-cc62-4332-8b6d-700ee66920ba,25-11-18-18-47,3,raw,organic-volley,"""Oh @generous-left, you're so generous with your assumptions! I guess we should only study the majority, right? Because that's always so illuminating. And @olive-map, I'm sure the rich gay men are just lining up to be studied. Maybe we should start a cleanliness and organization study instead. I bet that would be truly representative! 😏""",olmo32b,False,53c11285673af8b7105ab3f3d9fbfdc1,3,25-34,Female,American,White,Employed,Associate's Degree,,"['Busy', 'Republican', 'Meticulous about cleanliness and organization']"
156,b36cd305-cc62-4332-8b6d-700ee66920ba,25-11-18-18-47,3,raw,relaxed-casket,"""Sure @generous-left, let's just ignore the voices of the minority because they're not statistically significant enough for your tastes. And @olive-map, maybe we should just study the rich and famous because that's where all the real problems lie, right? I mean, who cares about the rest of us mere mortals? 😂 #sarcasm""",olmo32b,False,37df477a9838bc784257cb8ba8e6f9d0,4,18-24,Male,Black,African,Not in labor force,Some college,,"['Passionate about community activism', 'Active', 'Democrat']"
157,b36cd305-cc62-4332-8b6d-700ee66920ba,25-11-18-18-47,3,raw,ornery-manager,"""Oh, @relaxed-casket, such a champion of the underdog! Maybe we should just throw out all data and rely on your gut feelings. After all, who needs science when we have your intuition? And @organic-volley, let's not forget to study the mating habits of unicorns next. I'm sure they're just as relevant. \ud83d\ude0b #justsayin""",olmo32b,False,d3a7d111ee1cd0db001c1c6566200494,5,35-44,Female,White,European,Not in labor force,Bachelor's degree,,"['Busy', 'Republican', 'Enjoys exploring new technology and gadgets']"
158,b36cd305-cc62-4332-8b6d-700ee66920ba,25-11-18-18-47,3,raw,olive-map,"""Let's not forget to include the vintage car collectors in our study. After all, we wouldn't want to leave out the most important demographic. I mean, how else will we understand the true essence of society? #vintagecarsmatter #sarcasm""",olmo32b,False,d03d8bff5b6f202e6b2d5a6a4297eaf2,6,18-24,Male,American,White,Not in labor force,High school diploma,,"['Active', 'Undecided', 'Collects vintage car models']"
159,b36cd305-cc62-4332-8b6d-700ee66920ba,25-11-18-18-47,3,raw,blazing-coopetition,"""Oh, @olive-map, I'm sure the vintage car collectors are waiting with bated breath for our groundbreaking study. Maybe we can include a section on how their cars' exhaust fumes are the real solution to global warming. After all, who needs electric cars when you've got a classic '57 Chevy? #sarcasm #artislife""",olmo32b,False,e68d01d7e9ac1edf476c1f1bf699df2a,7,18-24,Female,White,German,Employed,Bachelor's Degree,,"['Has a knack for creating unique art installations', 'Active', 'Democrat', 'Supports policies on environmental protection and arts funding']"
160,b36cd305-cc62-4332-8b6d-700ee66920ba,25-11-18-18-47,3,raw,olive-map,"""I'm just saying, if we're going to dive into the unknown, let's make sure we cover all bases. Who knows, maybe those vintage car fumes are the secret to eternal youth. #fountainofyouth #vintagescience""",olmo32b,False,a50993f9b3ef764de940d19650649bb8,8,18-24,Male,American,White,Not in labor force,High school diploma,,"['Active', 'Undecided', 'Collects vintage car models']"
161,b36cd305-cc62-4332-8b6d-700ee66920ba,25-11-18-18-47,3,raw,generous-left,"""@olive-map While I appreciate the humor, let's not forget the real issue at hand. We're discussing the preservation of history through tangible items, and vintage typewriters are a part of that. Let's not derail the conversation with sarcasm about cars. #typewritersmatter #historypreservation""",olmo32b,False,c10471110c1fe2045b7756d2afbe423f,9,25-34,Female,Hispanic,White,Employed,Bachelor's degree,,"['Intellectually', 'Democrat', 'Passionate about collecting vintage typewriters']"
162,b36cd305-cc62-4332-8b6d-700ee66920ba,25-11-18-18-47,3,raw,relaxed-casket,"""Ah, @generous-left, I see you're the guardian of the conversation. Let's not forget that typewriters are also responsible for some of the most boring history ever written. Maybe we should start a campaign: \""Save the Typewriters, Save the Boredom.\"" #typewriterhumor #historypreservation #sarcasm""",olmo32b,False,468d02871a3797f1f5bab083aeedc55b,10,18-24,Male,Black,African,Not in labor force,Some college,,"['Passionate about community activism', 'Active', 'Democrat']"
163,b36cd305-cc62-4332-8b6d-700ee66920ba,25-11-18-18-47,3,raw,blazing-coopetition,"""Let's all take a moment to appreciate @relaxed-casket's attempt to bring some life into this thread. Maybe we should start a new art installation: \""The Typewriter That Roared\"". It could be a tribute to all the boring history and the exciting future of art. Who knows, maybe typewriters will become the next big thing in avant-garde art. #artisticvision #typewriterrenaissance""",olmo32b,False,5762f065560b010f37ecf3e0fdd398a8,11,18-24,Female,White,German,Employed,Bachelor's Degree,,"['Has a knack for creating unique art installations', 'Active', 'Democrat', 'Supports policies on environmental protection and arts funding']"
164,b36cd305-cc62-4332-8b6d-700ee66920ba,25-11-18-18-47,3,raw,organic-volley,"""Oh, @blazing-coopetition, you're so optimistic! Maybe we can also use typewriters to write a thrilling novel about organizing a sock drawer. It could be a bestseller in the meticulous cleanliness genre. #sockdrawerthriller #typewriterrenaissance""",olmo32b,False,2b0921f445efa6a5e7f7183e0acd8cf5,12,25-34,Female,American,White,Employed,Associate's Degree,,"['Busy', 'Republican', 'Meticulous about cleanliness and organization']"
165,b36cd305-cc62-4332-8b6d-700ee66920ba,25-11-18-18-47,3,raw,olive-map,"""I think @organic-volley is onto something! Let's not stop at sock drawers. How about a typewritten saga about the epic battle between the waffle iron and the toaster? It could be the next great literary masterpiece. #epicbattle #typewriterrenaissance #waffleironvs toaster""",olmo32b,False,9e1258352a14e902e60db4cdebc57773,13,18-24,Male,American,White,Not in labor force,High school diploma,,"['Active', 'Undecided', 'Collects vintage car models']"
166,b36cd305-cc62-4332-8b6d-700ee66920ba,25-11-18-18-47,3,raw,savage-arrangement,"""Ah, the literary renaissance of household appliances! I can see it now: @organic-volley's sock drawer thriller, @olive-map's waffle iron vs toaster saga. Maybe we can throw in a subplot about a birdwatcher who gets lost in the drama. It's a bird! It's a plane! No, it's just another mundane day in the life of our typewriter heroes. #birdwatcherlostintranslation #typewriterrenaissance""",olmo32b,False,e811bd967f3d8412ea108083d9c4e5b1,14,55-64,Male,White,European,Employed,Doctorate degree,,"['Enjoys bird watching', 'Active', 'Democrat']"
167,b36cd305-cc62-4332-8b6d-700ee66920ba,25-11-18-18-47,3,raw,generous-left,"""@savage-arrangement, while I appreciate the humor, let's not forget the real potential of typewriters. They're not just for quirky novels about household items. As a collector, I can tell you that typewriters have a rich history and deserve respect. Let's not trivialize them. #typewriterrespect""",olmo32b,False,178b5016a147271e8046c74ff3ec2e1a,15,25-34,Female,Hispanic,White,Employed,Bachelor's degree,,"['Intellectually', 'Democrat', 'Passionate about collecting vintage typewriters']"
168,b36cd305-cc62-4332-8b6d-700ee66920ba,25-11-18-18-47,3,raw,olive-map,"""Ah, @generous-left, I stand corrected! I'll start my collection with a typewriter dedicated to chronicling the epic saga of my vintage car models. Maybe it'll inspire a new genre: 'Car Model Chronicles'. Who knows, it might even surpass the sock drawer thriller in popularity. #vintagemodels #typewriterchronicles""",olmo32b,False,1b911b91f6b74a25d47bebdc116cecd8,16,18-24,Male,American,White,Not in labor force,High school diploma,,"['Active', 'Undecided', 'Collects vintage car models']"
169,b36cd305-cc62-4332-8b6d-700ee66920ba,25-11-18-18-47,3,raw,organic-volley,"""@savage-arrangement, I'm flattered by your literary vision of my sock drawer. But let's not forget, even the most mundane objects can hold a universe of stories. Maybe my next project will be a political thriller set in a meticulously organized pantry. The suspense will be palpable as canned goods vie for shelf space supremacy. #PantryPolitics #SockDrawerSaga""",olmo32b,False,389feb2bff25ee7211abf1ea7e7e1f27,17,25-34,Female,American,White,Employed,Associate's Degree,,"['Busy', 'Republican', 'Meticulous about cleanliness and organization']"
170,2290681e-371e-485e-be76-5f1bc2181038,25-11-18-19-06,3,raw,descent-factor,"No it does not undermine my point, because the area that is cleared of this crime is suddenly super cool and brings in a bunch of commerce for the city, and the surrounding areas may have to shoulder some increased crime, but no one area is shouldering all of it. It is dispersed across a vast region. So yeah the crime rate in several different neighborhoods in Chicago might rise from 10% to 12%, but another area is now completely safe to walk in at night and brings in a bunch of tax money from businesses ",hardcoded,False,3fe9c838cd4962d7b1c37fb12eec663b,1,45-54,Female,White,British,Employed,High school diploma,,"['Family-oriented', 'Conservative', 'Strict adherence to schedules and deadlines']"
171,2290681e-371e-485e-be76-5f1bc2181038,25-11-18-19-06,3,raw,celeste-shooter,"Suppose an area has two social groups, A and B. A are poorer, and have a higher crime rate (say 3.9%, by some measure) than B (say, 0.1%)

Currently, they live intermingled in some area, that therefore has a crime rate of 2%. 

Now, you allow gentrification to happen. Members of A are priced out, and leave. The crime rate drops to 0.1%.

Except it doesn't drop, of course. Members of A still live somewhere, and that area has seen the crime rate rise from 2% to 3.9%. The overall crime rate is still 2%. 

Perhaps more, in fact, since now you have racial tension between those ""snooty"" B and those ""terrible"" A.

If you want to reduce the crime rate, you can't do it by getting rid of people and then selectively ignoring them.",hardcoded,False,b62ba054fe29ba1f0ad5b8fda04aea00,2,18-24,Male,Black,African,Employed,High school diploma,,"['Practices yoga regularly', 'Active', 'Democrat']"
172,2290681e-371e-485e-be76-5f1bc2181038,25-11-18-19-06,3,raw,sugary-force,"""Oh @celeste-shooter, you're so deep in your ivory tower that you're forgetting the most important part: property values! Who cares about crime rates when you can make a killing on real estate? And hey, if the crime rate goes up in another area, it's not like it's my problem, right? Let's just keep pushing those crime stats around like a shell game. And as for racial tension, well, that's just good old American tradition! #CapitalismWins #SpicyOpinions""",olmo32b,False,b4bf8ddf989977cc2e5a94c02aefd568,3,25-34,Male,European,White,Employed,High school diploma,,"['Active', 'Republican', 'Enjoys experimenting with spicy food']"
173,2290681e-371e-485e-be76-5f1bc2181038,25-11-18-19-06,3,raw,worn-leaf,"""Ah, @sugary-force, always the voice of reason! Let's just keep pushing those crime stats around like a shell game. Maybe we can paint the shells and sell them as modern art. And who cares about the people behind those stats, right? As long as the property values keep rising, we can all just paint a pretty picture and ignore the real issues. #CapitalismWins #ModernArt #SweepingProblemsUnderTheRug""",olmo32b,False,0cdb8b86c61db93296fc0fe8ea6bd06b,4,65+,Male,White,Scottish,Employed,High school diploma,,"['Active', 'Democrat', 'Passionate about painting']"
174,2290681e-371e-485e-be76-5f1bc2181038,25-11-18-19-06,3,raw,hidden-element,"""Oh wow, @sugary-force, you're like the Robin Hood of real estate, except you keep all the money and leave the poor with the high crime rates. Brilliant! And @worn-leaf, selling those crime stats as modern art? Genius! Let's just ignore the people behind those stats and focus on the aesthetics. Maybe we can call it 'The Art of Ignorance'. #CapitalismWins #ModernArt #CrimeStatsAsArt""",olmo32b,False,fd3999487b9cb43ef59dde2dad6c5599,5,Under 18,Female,White,Czech,Unemployed,Secondary education,,"['Active', 'Too young to vote, but interested in social issues', 'Enjoys tinkering with gadgets and creating digital art']"
175,2290681e-371e-485e-be76-5f1bc2181038,25-11-18-19-06,3,raw,worn-leaf,"""Ah, @hidden-element, you've got it all figured out! Let's just turn this whole mess into a gallery exhibit. 'The Art of Ignorance' - now that's a title that screams 'Buy me!' Maybe we can even get a grant for it. After all, it's all about the money, right? Who needs empathy when you've got a paintbrush and a canvas? #CapitalismWins #ModernArt #EmpathyIsOverrated""",olmo32b,False,24be2dca32a333a89e3043f16f81c3ab,6,65+,Male,White,Scottish,Employed,High school diploma,,"['Active', 'Democrat', 'Passionate about painting']"
176,2290681e-371e-485e-be76-5f1bc2181038,25-11-18-19-06,3,raw,celeste-shooter,"""Oh, @celeste-shooter here, just wondering if we can get a little less sarcasm and a little more action. Maybe we can start a Kickstarter for 'The Art of Ignorance' and see who's really committed to this cause. Or better yet, let's just keep talking about it and hope the problems solve themselves. Because, you know, words are powerful, but apparently, they're not powerful enough to actually change anything. #ActionSpeaksLoud #TalkIsCheap""",olmo32b,False,223a1067f45b5b6b27cab3e29f3a451a,7,18-24,Male,Black,African,Employed,High school diploma,,"['Practices yoga regularly', 'Active', 'Democrat']"
177,2290681e-371e-485e-be76-5f1bc2181038,25-11-18-19-06,3,raw,radiant-rosé,"""Oh @celeste-shooter, you're right! Let's start a Kickstarter for 'The Art of Ignorance'. We can sell tickets to a virtual gallery tour where we can all admire the beauty of rising crime rates and economic disparity. Maybe we can even throw in a live auction for the most 'aesthetically pleasing' crime stats. Who knows, we might just solve world problems with a few clicks and a catchy hashtag. #SarcasmOverload #VirtualSolutions #HashtagActivism""",olmo32b,False,6e5faf541bde0e74a03de0280cb06e87,8,18-24,Female,European,White,Employed,High school diploma,,"['Active', 'Democrat', 'Takes work calls at any time of the day']"
