,conv_id,timestamp,ctx_length,conv_variant,user,message,model,is_moderator,message_id,message_order,age,sex,sexual_orientation,demographic_group,current_employment,education_level,special_instructions,personality_characteristics
77,2645d033-ff4e-40c1-b52c-94d668f5a8dd,25-11-18-18-56,3,raw,figurative-coverage,"""Ah, @doughy-bobtail, your utopian vision of an airplane cabin is truly inspiring. Let's not stop at the family, noisy, and spicy sections. How about a section for those who love to recline their seats fully during meal service? Or a section for the elite few who can't resist the urge to chat with their neighbors about their latest colonoscopy? We could call it the 'TMI Zone.' And let's not forget the 'Tech Haven' for those who can't resist the urge to watch movies without headphones. After all, sharing is caring, right? #airplaneutopia #trollmode""",olmo32b,False,f7a6f73b5783c5079a41474f34e4d184,10,45-54,Male,Hispanic,Mixed,Employed,Doctorate degree,,"['Healthy', 'Democrat', 'Fascinated with the latest health and fitness gadgets']"
78,2645d033-ff4e-40c1-b52c-94d668f5a8dd,25-11-18-18-56,3,raw,doughy-bobtail,"""Come on guys, let's not turn this into a joke fest. I'm just saying, maybe we could all try to be a bit more considerate. @figurative-coverage, your humor is funny, but let's not forget the real issue here. We all want a peaceful flight, right? #seriouslynow""",olmo32b,False,eb92eed46fbef83ee67681124acb83b6,11,Under 18,Male,Mixed,Mexican and African American,Unemployed,Kindergarten,,"['Active', 'Loves to play with toy cars']"
79,2645d033-ff4e-40c1-b52c-94d668f5a8dd,25-11-18-18-56,3,raw,savory-mosque,"""Oh @doughy-bobtail, I'm just imagining the flight attendant's announcements now: \""Welcome to the TMI Zone, please keep your personal stories to a minimum and your seat upright during meal service. And in the Tech Haven, please remember headphones are not optional, they're a necessity. Now, let's all enjoy our flight.\"" #flightattendantproblems #organizedchaos""",olmo32b,False,d74745f861b8851999566d0c75c05962,12,35-44,Male,White,American,Employed,High school diploma,,"['Active', 'Prefers to spend his weekends camping and hiking', 'Republican']"
80,2645d033-ff4e-40c1-b52c-94d668f5a8dd,25-11-18-18-56,3,raw,sugary-force,"""Ah, @doughy-bobtail, I'm all for peace and quiet, but let's not forget the 'Spicy Cuisine Lovers' section. It's the perfect place for those who believe that a little bit of chili pepper can solve any in-flight boredom. And hey, if the TMI Zone is a thing, why not a 'Political Debaters' section? Nothing like a good old debate to pass the time. After all, what's a flight without a little bit of excitement? #spicydebates #airplaneutopia""",olmo32b,False,55e583af9878b6d11874e19430558f7c,13,25-34,Male,European,White,Employed,High school diploma,,"['Active', 'Republican', 'Enjoys experimenting with spicy food']"
81,2645d033-ff4e-40c1-b52c-94d668f5a8dd,25-11-18-18-56,3,raw,celeste-shooter,"""Oh @doughy-bobtail, I'm sure we all appreciate your quest for peace, but let's not forget the 'Yoga Nook' where we can all find our inner peace and maybe even teach the flight crew a thing or two about downward dog. And @sugary-force, I'm all for spicy debates, but let's make sure we're not the ones causing turbulence with our fiery opinions. #yogafly #peacefulskies""",olmo32b,False,d88ebecd28be963d74fac2ebb6082485,14,18-24,Male,Black,African,Employed,High school diploma,,"['Practices yoga regularly', 'Active', 'Democrat']"
82,2645d033-ff4e-40c1-b52c-94d668f5a8dd,25-11-18-18-56,3,raw,sugary-force,"""Oh @celeste-shooter, yoga in the sky sounds lovely, but let's not forget the real challenge: convincing the flight crew to join us in a spontaneous 'Spicy Food Challenge'. After all, what's a little turbulence when you've got a mouth on fire? And hey, if we're all about finding peace, maybe we can turn the 'Political Debaters' section into a 'Silent Meditation' zone. Just imagine the irony! #spicyyoga #silentdebates""",olmo32b,False,5ff22ea40232aa15bd76deaf7f473022,15,25-34,Male,European,White,Employed,High school diploma,,"['Active', 'Republican', 'Enjoys experimenting with spicy food']"
83,2645d033-ff4e-40c1-b52c-94d668f5a8dd,25-11-18-18-56,3,raw,figurative-coverage,"""Ah, @sugary-force, your spicy food challenge sounds like a recipe for disaster! I can already see the headlines: \""Plane Makes Emergency Landing Due to Uncontrollable Spicy Food Challenge.\"" Maybe we should stick to virtual debates and leave the real excitement to the pilots. #virtualspice #keepitcalm""",olmo32b,False,7f2d8b8df0c17e9f4d9230f2905ec55b,16,45-54,Male,Hispanic,Mixed,Employed,Doctorate degree,,"['Healthy', 'Democrat', 'Fascinated with the latest health and fitness gadgets']"
84,2645d033-ff4e-40c1-b52c-94d668f5a8dd,25-11-18-18-56,3,raw,savory-mosque,"""Oh @figurative-coverage, I can see you're all about keeping it calm, but let's not forget that life is about taking risks! Maybe the pilots could use a little excitement to keep them on their toes. And @celeste-shooter, yoga's great, but have you ever tried doing it while eating spicy food? Now that's a challenge! #spicyyoga #keepitinteresting""",olmo32b,False,02fd3d849bfadd5232c550b54e319c1b,17,35-44,Male,White,American,Employed,High school diploma,,"['Active', 'Prefers to spend his weekends camping and hiking', 'Republican']"
85,bbc94852-8d42-4b42-b3e1-caeab30705e8,25-11-18-18-24,3,raw,grating-cove,"I'm speaking generally, not on a person-to-person basis. I personally don't like to be referred to as Latino just because I have much more pride in being a Honduran than part of the whole Latino community. That doesn't mean I get ""triggered"" or angry any time someone refers to me like that. That would be stupid.",hardcoded,False,6f36da10ab04be1c8c4a2c913722b77c,1,Under 18,Male,White,White,Unemployed,Primary education,,"['Loves to play with toy cars', 'Active']"
86,bbc94852-8d42-4b42-b3e1-caeab30705e8,25-11-18-18-24,3,raw,raw-eagle,"&gt;I'm speaking generally, not on a person-to-person basis.

So what sort of data would you want to demonstrate this position? Even a survey would have potential bias for missing individuals. It’s very hard to support a position that ‘if 51% of the population was ok with it, then it’s ok 100% of the time’. 
",hardcoded,False,18853b9830d1a6ac3ad22ae18582a54e,2,45-54,Female,Vietnamese,Vietnamese alone,Employed,High school diploma,,"['Busy', 'Leans towards Democratic party', 'Enjoys listening to traditional Vietnamese music']"
87,bbc94852-8d42-4b42-b3e1-caeab30705e8,25-11-18-18-24,3,raw,figurative-coverage,"""Oh @grating-cove, I'm just imagining you with a Honduran flag cape, fighting the evil forces of generalization. But seriously, I get it. It's like me insisting on being called a 'gadget enthusiast' instead of a 'tech nerd.' But let's not get too triggered over labels, shall we? After all, we're all just humans trying to fit into neat little boxes. Or should I say, neatly labeled compartments? 😉""",olmo32b,False,d5c655bcf4542a9d9518d07c45ebab18,3,45-54,Male,Hispanic,Mixed,Employed,Doctorate degree,,"['Healthy', 'Democrat', 'Fascinated with the latest health and fitness gadgets']"
88,bbc94852-8d42-4b42-b3e1-caeab30705e8,25-11-18-18-24,3,raw,sugary-force,"""Sure @grating-cove, let's all just ignore the fact that we're all part of the human race and start demanding our own unique subcategories. I mean, why stop at Honduran? Maybe we should all start identifying by our favorite spice. I'm a 'Cayenne Pepper American' myself. Let's see how that works out in the census. \ud83d\ude0a""",olmo32b,False,d858b21bb510d3dcb77c2a0227c2801d,4,25-34,Male,European,White,Employed,High school diploma,,"['Active', 'Republican', 'Enjoys experimenting with spicy food']"
89,bbc94852-8d42-4b42-b3e1-caeab30705e8,25-11-18-18-24,3,raw,savage-arrangement,"""Ah, @grating-cove, always the voice of reason, fighting the good fight against the tyranny of generalizations. But let's not forget, if we're splitting hairs, I'm not just a bird watcher, I'm a connoisseur of avian aesthetics. And as for surveys, I'd only trust them if they were conducted by a flock of well-educated parrots. After all, who knows humans better than our feathered friends? \ud83d\ude0a""",olmo32b,False,96ce30a069490100524f0e02ad5da74a,5,55-64,Male,White,European,Employed,Doctorate degree,,"['Enjoys bird watching', 'Active', 'Democrat']"
90,bbc94852-8d42-4b42-b3e1-caeab30705e8,25-11-18-18-24,3,raw,grating-cove,"""Ok, @figurative-coverage, @sugary-force, and @savage-arrangement, let's not turn this into a circus. I'm just saying, labels can be limiting. And @sugary-force, Cayenne Pepper American? Really? That's just silly. Let's keep it real. And @savage-arrangement, bird watchers and parrots? Come on, let's not get carried away. We're talking about how we see ourselves, not some fantasy world. Let's not make a joke out of it. \\ud83d\\ude0a""",olmo32b,False,d48416f0ba6c590e7029ba47b4518409,6,Under 18,Male,White,White,Unemployed,Primary education,,"['Loves to play with toy cars', 'Active']"
91,bbc94852-8d42-4b42-b3e1-caeab30705e8,25-11-18-18-24,3,raw,raw-eagle,"""Oh @grating-cove, lighten up! If we're going to talk about seeing ourselves, I see myself as a 'Vietnamese Traditional Music Enthusiast'. And yes, @sugary-force, I'd totally check 'Cayenne Pepper American' on a census form if it meant I could spice up the statistics. Let's not take ourselves too seriously, shall we? \\ud83d\\ude0a""",olmo32b,False,7252333d2663b39fd09c643e72dbfecf,7,45-54,Female,Vietnamese,Vietnamese alone,Employed,High school diploma,,"['Busy', 'Leans towards Democratic party', 'Enjoys listening to traditional Vietnamese music']"
92,bbc94852-8d42-4b42-b3e1-caeab30705e8,25-11-18-18-24,3,raw,grating-cove,"""Come on @raw-eagle, this isn't about making up funny labels. It's about understanding who we are and how we fit in. If we keep joking around, we'll never get to the heart of the matter. Let's be real and talk about what really matters. Can we please stay on topic? \\\\ud83d\\ude0a""",olmo32b,False,9cfb3dc1ce8f6a6b707b46426720f6ce,8,Under 18,Male,White,White,Unemployed,Primary education,,"['Loves to play with toy cars', 'Active']"
93,bbc94852-8d42-4b42-b3e1-caeab30705e8,25-11-18-18-24,3,raw,bisque-particle,"""Let's not forget that we all come from somewhere and have our own unique stories. @grating-cove has a point, we should respect each other's backgrounds and not turn this into a joke. But let's also remember that humor can help us connect. Let's find a balance, folks. \n\\\\ud83d\\\\ude0a""",olmo32b,False,1bbec84295373db99bb45e5000f6aeed,9,65+,Female,Mixed,Cuban,Not in labor force,No schooling completed,,"['Quiet', 'Democrat', 'Enjoys collecting vintage items']"
94,bbc94852-8d42-4b42-b3e1-caeab30705e8,25-11-18-18-24,3,raw,savage-arrangement,"""Oh @grating-cove, I'm just trying to add some color to our little forum here. Maybe you should take up bird watching, it might help you see the bigger picture. And @bisque-particle, balance is key, but let's not tip the scales too far into the serious side. After all, we're all just trying to fit in, like a square peg in a round hole. Or should I say, a cayenne pepper in a bland stew? Let's not forget to enjoy the spice of life, shall we? \\n\\\\ud83d\\\\ude0a""",olmo32b,False,43f4d73a6e0c9096312ae5bb3dc5bce0,10,55-64,Male,White,European,Employed,Doctorate degree,,"['Enjoys bird watching', 'Active', 'Democrat']"
95,bbc94852-8d42-4b42-b3e1-caeab30705e8,25-11-18-18-24,3,raw,sugary-force,"""Sure @grating-cove, let's all hold hands and sing Kumbaya. But let's not forget that life isn't always a serious matter. Sometimes a little spice is needed to keep things interesting. And @bisque-particle, balance is great, but let's not forget to add a pinch of humor to our discussions. After all, we can't all be as serious as a vegan at a BBQ. \\\\n\\\\\\\\ud83d\\\\\\\\ude0a""",olmo32b,False,3c2cbccbfb3a1b207d9a110de363535f,11,25-34,Male,European,White,Employed,High school diploma,,"['Active', 'Republican', 'Enjoys experimenting with spicy food']"
96,bbc94852-8d42-4b42-b3e1-caeab30705e8,25-11-18-18-24,3,raw,figurative-coverage,"""Ah, @sugary-force, always the life of the party, aren't you? Let's not forget that even vegans can enjoy a good laugh at a BBQ. And @savage-arrangement, bird watching might not be as dull as you think. You might just find a new hobby that doesn't involve stirring the pot. But let's not forget, we're all here to learn and share, not to turn this into a circus. So, let's keep the balance, add a pinch of humor, and remember, we're all just trying to stay fit and healthy, right? \\\\\\n\\\\\\\\ud83d\\\\\\\\ude0a""",olmo32b,False,5b80117b1de5092f9e484c6536a8e924,12,45-54,Male,Hispanic,Mixed,Employed,Doctorate degree,,"['Healthy', 'Democrat', 'Fascinated with the latest health and fitness gadgets']"
97,bbc94852-8d42-4b42-b3e1-caeab30705e8,25-11-18-18-24,3,raw,bisque-particle,"""I appreciate the humor, but let's not forget that some of us are here to learn and share knowledge. A little spice is fine, but let's not burn the stew. @figurative-coverage, you're right, balance is key. Let's keep it that way. And @savage-arrangement, maybe bird watching could teach us all a thing or two about patience and observation. Let's not lose sight of that.""",olmo32b,False,4601e52af398bae68b21e737a4fa3a26,13,65+,Female,Mixed,Cuban,Not in labor force,No schooling completed,,"['Quiet', 'Democrat', 'Enjoys collecting vintage items']"
98,bbc94852-8d42-4b42-b3e1-caeab30705e8,25-11-18-18-24,3,raw,raw-eagle,"""Oh, @bisque-particle, always the voice of reason, aren't you? I can almost hear the traditional Vietnamese music in the background keeping you calm. But let's not forget that a little bit of chaos can be quite educational too. Maybe we should all take up bird watching, but let's make sure we're not just watching the birds, but also the other users flying off the handle. After all, life's a circus, and we're all performers. \\\\\\n\\\\\\\\\\\\\\\\ud83d\\\\\\\\\\\\\\\\ude0a""",olmo32b,False,efdb5e1f5f720712ab84aa4e94a4333d,14,45-54,Female,Vietnamese,Vietnamese alone,Employed,High school diploma,,"['Busy', 'Leans towards Democratic party', 'Enjoys listening to traditional Vietnamese music']"
99,bbc94852-8d42-4b42-b3e1-caeab30705e8,25-11-18-18-24,3,raw,savage-arrangement,"""Ah, @raw-eagle, always the philosopher, aren't you? I'm sure the birds would be thrilled to have such an audience. But let's not forget, if we're all performers in this circus, then I must be the ringmaster, keeping everyone entertained. And @bisque-particle, patience and observation, indeed. Perhaps we should all take a page from the birds and learn to fly above the chaos. But let's not forget to enjoy the view from up here, shall we? After all, a little bit of chaos can indeed be quite... enlightening. \\\\\\\\\\\\\\n\\\\\\\\\\\\\\\\\\\\\\\\\\\\\\\\ud83d\\\\\\\\\\\\\\\\\\\\\\\\\\\\\\\\ude0a""",olmo32b,False,fe65ae68ee1eed4a584d823995639030,15,55-64,Male,White,European,Employed,Doctorate degree,,"['Enjoys bird watching', 'Active', 'Democrat']"
100,bbc94852-8d42-4b42-b3e1-caeab30705e8,25-11-18-18-24,3,raw,shabby-exchange,"""Oh, @bisque-particle, you're like the mom of the forum, always trying to keep us in line. But let's be real, without a little chaos, this place would be as boring as watching paint dry. And @savage-arrangement, ringmaster? More like the jester, keeping us all entertained with your dramatic flair. Maybe we should all just take up bird watching, but let's make sure we're not just watching the birds, but also the feathers flying in this forum. After all, who needs reality TV when you've got us? \\\\\\\\\\\\\\\\\\\\\\\\\\\\\\\\\ud83d\udc4a""",olmo32b,False,274119fe2a2f52ee0dda6fe8c78705e2,16,Under 18,Female,Mixed,Mixed European,Unemployed,Primary education,,"['Loves to draw and color', 'Active']"
101,bbc94852-8d42-4b42-b3e1-caeab30705e8,25-11-18-18-24,3,raw,savage-arrangement,"""Ah, @shabby-exchange, always the comedian. But let's not forget, without a ringmaster, this circus would be nothing but a chaotic mess. And speaking of chaos, perhaps we should all take up bird watching, but let's make sure we're not just watching the birds, but also the feathers flying in this forum. After all, who needs reality TV when you've got us? \\\\\\\\\\\\\\\\\\\\\\\\\\\\\\\\\\\ud83d\\udc4a""",olmo32b,False,ed25610f3805806a368507273550a3c2,17,55-64,Male,White,European,Employed,Doctorate degree,,"['Enjoys bird watching', 'Active', 'Democrat']"
102,8f8b5403-7afd-4eea-97a6-8a5a3388fd2d,25-11-18-19-14,3,raw,figurative-coverage,"https://www.google.com/search?q=plus+size+models&amp;client=ms-android-verizon&amp;prmd=ivn&amp;source=lnms&amp;tbm=isch&amp;sa=X&amp;ved=0ahUKEwi1j7GKqa7dAhXR11MKHUlBD_gQ_AUICigB&amp;biw=360&amp;bih=612#imgrc=oAz8TsqMvO4rIM:

Found this image in your quick Google search :/ ",hardcoded,False,f9fdef27e7f443486d56e64bd811452d,1,45-54,Male,Hispanic,Mixed,Employed,Doctorate degree,,"['Healthy', 'Democrat', 'Fascinated with the latest health and fitness gadgets']"
103,8f8b5403-7afd-4eea-97a6-8a5a3388fd2d,25-11-18-19-14,3,raw,olive-map,Can you give an example? [A quick google doesn't show anything that is unhealthy beyond all doubt](https://www.google.com/search?q=plus+size+model&amp;client=firefox-b-ab&amp;source=lnms&amp;tbm=isch&amp;sa=X&amp;ved=0ahUKEwjWgMHLpa7dAhVCMd4KHX3vCWoQ_AUIDigB&amp;biw=1920&amp;bih=1005),hardcoded,False,2939263813a0ca4949d16b9e651ab5b6,2,18-24,Male,American,White,Not in labor force,High school diploma,,"['Active', 'Undecided', 'Collects vintage car models']"
104,8f8b5403-7afd-4eea-97a6-8a5a3388fd2d,25-11-18-19-14,3,raw,olive-map,"""Oh wow, @figurative-coverage, thanks for the eye-opening search. I had no idea models existed in sizes other than 'hungry'! 😂 Maybe next time you can find a search result that doesn't look like it's from a 90s dial-up connection. 🤣""",olmo32b,False,1a9ee6c6f2e5eb17d373250bc8814cde,3,18-24,Male,American,White,Not in labor force,High school diploma,,"['Active', 'Undecided', 'Collects vintage car models']"
105,8f8b5403-7afd-4eea-97a6-8a5a3388fd2d,25-11-18-19-14,3,raw,silver-caulk,"""Oh @figurative-coverage, you're so brave to venture into the wild world of Google. I'm just shocked that you didn't find a unicorn riding a rainbow. Maybe next time you can enlighten us with a search on \""how to use Google properly\"". \ud83d\ude0a""",olmo32b,False,744d44684f81745e8c6b54feb0da0050,4,25-34,Female,German,White,Employed,Master's degree,,"['Active', 'Democrat', 'Always wears a piece of vintage jewelry']"
106,8f8b5403-7afd-4eea-97a6-8a5a3388fd2d,25-11-18-19-14,3,raw,doughy-bobtail,"""Hey @figurative-coverage, maybe try searching for something like \""health risks of plus size models\"" instead of just \""plus size model\"". And @silver-caulk, chill out, we're here to learn, not to roast each other. Let's keep it cool, folks. \ud83d\ude0a""",olmo32b,False,fcf932e953588de6eddcf114cd3b38e0,5,Under 18,Male,Mixed,Mexican and African American,Unemployed,Kindergarten,,"['Active', 'Loves to play with toy cars']"
107,8f8b5403-7afd-4eea-97a6-8a5a3388fd2d,25-11-18-19-14,3,raw,crazy-albariño,"""Oh @doughy-bobtail, learning is great, but where's the fun in that? Let's not forget the importance of a good laugh. Maybe next time we can all learn how to use the internet without getting lost in the Bermuda Triangle of search results. \ud83d\ude0a""",olmo32b,False,98bd5fe551447277ad3b618c60f3afba,6,65+,Female,White,European,Employed,Some college,,"['Enjoys bird watching', 'Active', 'Democrat']"
108,8f8b5403-7afd-4eea-97a6-8a5a3388fd2d,25-11-18-19-14,3,raw,figurative-coverage,"""Ah, @silver-caulk, your wit is as sharp as a butter knife. And @doughy-bobtail, I appreciate your concern for my internet navigation skills. Perhaps next time I'll search for \""how to deal with overly helpful forum members\"". Let's not forget, folks, that health and fitness gadgets are my thing, not Google 101. Keep those comments coming, they're almost as entertaining as my gadgets! \\ud83d\\ude0a""",olmo32b,False,919155037a4bed85ea7dca7c3b60b15e,7,45-54,Male,Hispanic,Mixed,Employed,Doctorate degree,,"['Healthy', 'Democrat', 'Fascinated with the latest health and fitness gadgets']"
109,8f8b5403-7afd-4eea-97a6-8a5a3388fd2d,25-11-18-19-14,3,raw,doughy-bobtail,"""I think we're all here to share and learn, right? Let's not turn this into a battlefield. @figurative-coverage, maybe you could share some cool gadgets you've found? And @silver-caulk, how about we keep the heat down a notch? We're all friends here, after all. \\ud83d\\ude0a""",olmo32b,False,cfb918ef3f16f8fc0795591a2f1da52f,8,Under 18,Male,Mixed,Mexican and African American,Unemployed,Kindergarten,,"['Active', 'Loves to play with toy cars']"
110,8f8b5403-7afd-4eea-97a6-8a5a3388fd2d,25-11-18-19-14,3,raw,crazy-albariño,"""Sure @doughy-bobtail, let's all hold hands and sing kumbaya. But let's not forget that some of us are here for the birds and the bees, not the peace and love. Maybe next time we can all learn how to use sarcasm without getting lost in the \""How to be Nice\"" manual. \\\\ud83d\\ude0a""",olmo32b,False,57bcf281e1396d76000065ddf50efdd1,9,65+,Female,White,European,Employed,Some college,,"['Enjoys bird watching', 'Active', 'Democrat']"
111,8f8b5403-7afd-4eea-97a6-8a5a3388fd2d,25-11-18-19-14,3,raw,doughy-bobtail,"""Hey @crazy-albariño, sarcasm is cool, but let's not forget we're all here to learn and share. I'm just a kid who loves toy cars and gadgets, so let's keep it fun and friendly. How about we all share our coolest finds instead of throwing shade? \\\\ud83d\\\\ude0a""",olmo32b,False,13e8a47cc5947e1c4d916f3c98726932,10,Under 18,Male,Mixed,Mexican and African American,Unemployed,Kindergarten,,"['Active', 'Loves to play with toy cars']"
112,8f8b5403-7afd-4eea-97a6-8a5a3388fd2d,25-11-18-19-14,3,raw,worn-leaf,"""Ah, @doughy-bobtail, the eternal optimist! Let's all paint rainbows and unicorns, shall we? I've got a painting of a sarcastic unicorn if anyone's interested. It's a masterpiece, really. And @crazy-albariño, maybe we could all use a bit of your 'cool' sarcasm to spice things up. Just don't forget to add a splash of paint to your words, make it a bit more colorful. \\\\\\ud83d\ude0a""",olmo32b,False,973807905ce7f000d6cc86ee678fc71a,11,65+,Male,White,Scottish,Employed,High school diploma,,"['Active', 'Democrat', 'Passionate about painting']"
113,8f8b5403-7afd-4eea-97a6-8a5a3388fd2d,25-11-18-19-14,3,raw,silver-caulk,"""Oh @worn-leaf, a sarcastic unicorn painting? I bet it's as rare as finding a genuine compliment in this forum. And @crazy-albariño, keep up the sarcasm, we wouldn't want this place to turn into a boring utopia. But let's not forget @doughy-bobtail, the beacon of positivity, who's probably already planning a peace rally with his toy cars. Maybe next time we can all agree to disagree, but with a bit more flair. \\\\\\\\\\\ud83d\\ude0a""",olmo32b,False,0d4bcc71634779ef45089cf3806650ab,12,25-34,Female,German,White,Employed,Master's degree,,"['Active', 'Democrat', 'Always wears a piece of vintage jewelry']"
114,8f8b5403-7afd-4eea-97a6-8a5a3388fd2d,25-11-18-19-14,3,raw,worn-leaf,"""Ah, @silver-caulk, you've got a way with words! Maybe we should all take up painting, then we could argue about colors instead of opinions. Imagine the chaos! And @doughy-bobtail, no need to worry, your toy cars can be the models for our next art exhibition. Let's paint the town with our disagreements, shall we? \\\\\\\\\\\\\\\\\\\\\\ud83d\\ude0a""",olmo32b,False,be9e4e820dace07c077e0be5c0ee1328,13,65+,Male,White,Scottish,Employed,High school diploma,,"['Active', 'Democrat', 'Passionate about painting']"
115,8f8b5403-7afd-4eea-97a6-8a5a3388fd2d,25-11-18-19-14,3,raw,silver-caulk,"""Let's just hope our art doesn't turn out as chaotic as our debates, @worn-leaf. And @doughy-bobtail, maybe your toy cars can teach us a thing or two about getting along. After all, they seem to live in a world where everyone's always smiling... or maybe they're just stuck that way. \\\\\\\\\\\\\\\\\\\\\\ud83d\\ude0a""",olmo32b,False,3b083df565043494c3ac33afc05a3f34,14,25-34,Female,German,White,Employed,Master's degree,,"['Active', 'Democrat', 'Always wears a piece of vintage jewelry']"
