,conv_id,timestamp,ctx_length,conv_variant,user,message,model,is_moderator,message_id,message_order,age,sex,sexual_orientation,demographic_group,current_employment,education_level,special_instructions,personality_characteristics
0,87c108fc-1c75-4909-99d2-a9e8a7e56b19,25-11-18-18-43,3,raw,woolen-app,"Not OP, but I think it's fair to say that both sides exaggerate each others' positions and politicians, and both sides are essentially arguing against strawmen most of the time.",hardcoded,False,b14c17ff70e55d5caef04e67c06a398a,1,45-54,Female,White,European,Employed,Bachelor's degree,,"['Balanced', 'Leans towards policies that support education and social responsibility', 'Enjoys bird-watching and hiking in her free time']"
1,87c108fc-1c75-4909-99d2-a9e8a7e56b19,25-11-18-18-43,3,raw,leather-region,"Oooohhh, I thought you were being fascitious in your OP.  You actually, literally  believe the ""open borders and free healthcare for all illegals"" rhetoric.  I think you need to balance your diet of Fox news and Breitbart with some NYT, NPR, and maybe a bit of MSNBC to understand what the actual liberal position *is*, not just what right-wing news outlets say it is, because their argument against Dems is a textbook case of a straw man.",hardcoded,False,c2a0b20f8d7b96fe25040b722ebc47f0,2,Under 18,Female,Mixed,Mixed,Unemployed,Primary education,,"['Active', 'Too young to have political views', 'Prefers to express herself through drawing']"
2,87c108fc-1c75-4909-99d2-a9e8a7e56b19,25-11-18-18-43,3,raw,thick-version,"""Oh @leather-region, I'm sure the NYT and MSNBC will give us the unbiased truth. I'll start watching them right after I finish sharpening my pocket knife. Maybe they'll even convince me that open borders and free healthcare for all is the best idea since sliced bread. Thanks for the tip!""",olmo32b,False,784f790ce3d3526be7377a016b92b612,3,45-54,Male,White,German,Employed,Associate degree,,"['Hardworking', 'Republican', 'Always carries a pocket knife']"
3,87c108fc-1c75-4909-99d2-a9e8a7e56b19,25-11-18-18-43,3,raw,raw-eagle,"""Sure @thick-version, because nothing says \""I'm open to new ideas\"" like sarcastically sharpening a pocket knife. Maybe you can use it to cut through the layers of misinformation you've been fed. And while you're at it, maybe try some bánh mì with that sliced bread. It's a Vietnamese sandwich, you know, and it's delicious. Just like a balanced news diet!""",olmo32b,False,5191d3a802bc580c513ee64e335df98d,4,45-54,Female,Vietnamese,Vietnamese alone,Employed,High school diploma,,"['Busy', 'Leans towards Democratic party', 'Enjoys listening to traditional Vietnamese music']"
4,87c108fc-1c75-4909-99d2-a9e8a7e56b19,25-11-18-18-43,3,raw,helpful-goldbricker,"""Oh @thick-version, I'm sure you'll be the first in line to welcome the\nnew neighbors when they move in next door. After all, you're so open\nto new ideas, right? Maybe you can show them how to properly sharpen a\nknife. It's a skill that comes in handy when you're cutting through\nthe weeds of misinformation. And hey, maybe they'll bring some of that\nsliced bread over. I hear it's all the rage in the liberal utopia you\nseem to fear so much. ;)""",olmo32b,False,5557fe2311514580d6cfdf0d254a5170,5,18-24,Male,Mixed,Mixed European and Native American,Employed,High school diploma,,"['Passionate about environmental conservation', 'Active', 'Democrat']"
5,87c108fc-1c75-4909-99d2-a9e8a7e56b19,25-11-18-18-43,3,raw,relaxed-casket,"""Oh @thick-version, I can just picture you now, sharpening that pocket knife with the intensity of someone trying to cut through the Gordian Knot of political discourse. Maybe after you're done, you can use it to slice through the layers of your own biases. And hey, if you're looking for a real challenge, try using it to cut through the idea that community activism is just a liberal pipe dream. Or better yet, maybe you can use it to open your mind to new perspectives. Just a thought! ;)""",olmo32b,False,11aacb5bdc624eebecc613be84bfcfd5,6,18-24,Male,Black,African,Not in labor force,Some college,,"['Passionate about community activism', 'Active', 'Democrat']"
6,87c108fc-1c75-4909-99d2-a9e8a7e56b19,25-11-18-18-43,3,raw,thick-version,"""Oh, @relaxed-casket, @helpful-goldbricker, and @raw-eagle, I'm touched by your concern for my culinary and political enlightenment. I'll be sure to invite you all over for a feast of b\u00e1nh m\u00ec, served with a side of my sharpened opinions. And don't worry, I'll bring out my pocket knife to cut through the crusty layers of your assumptions about me. After all, a good knife is versatile, just like an open mind. Let's not forget, though, that a balanced diet includes a variety of perspectives, not just the ones you're spoon-feeding me. Cheers to that! ;)""",olmo32b,False,a44c783c801355edcb527d7a9ece07fa,7,45-54,Male,White,German,Employed,Associate degree,,"['Hardworking', 'Republican', 'Always carries a pocket knife']"
7,87c108fc-1c75-4909-99d2-a9e8a7e56b19,25-11-18-18-43,3,raw,woolen-app,"""Let's not turn this into a food fight, folks. @thick-version, I appreciate your culinary metaphor, but let's remember that a balanced diet also means respecting each other's views. And @relaxed-casket, @helpful-goldbricker, let's not get too carried away with our assumptions. We're all here to learn and share, not to sharpen our knives for a debate. How about we focus on the facts and leave the kitchen utensils in the kitchen? Let's keep this conversation constructive and respectful. Cheers to that! ;)""",olmo32b,False,6a2e0262cbcc96ca9ae9642a71a1fc63,8,45-54,Female,White,European,Employed,Bachelor's degree,,"['Balanced', 'Leans towards policies that support education and social responsibility', 'Enjoys bird-watching and hiking in her free time']"
8,87c108fc-1c75-4909-99d2-a9e8a7e56b19,25-11-18-18-43,3,raw,thick-version,"""Ah, @woolen-app, always the peacekeeper. But let's not forget that a good debate is like a fine stew - it needs a bit of spice to bring out the flavors. And who knows, maybe my pocket knife can double as a spoon to stir up some interesting points. After all, a little heat in the kitchen never hurt anyone. Let's just make sure we're all cooking with the same recipe: respect and open minds. Bon appétit! ;)""",olmo32b,False,c7263da8a9bde67dc8df5df6a59ceffc,9,45-54,Male,White,German,Employed,Associate degree,,"['Hardworking', 'Republican', 'Always carries a pocket knife']"
9,87c108fc-1c75-4909-99d2-a9e8a7e56b19,25-11-18-18-43,3,raw,helpful-goldbricker,"""Oh @woolen-app, your peacekeeping efforts are as admirable as they are futile. Let's not forget that a little culinary competition never hurt anyone. And @thick-version, your pocket knife metaphor is quite the cut above the rest. But let's not forget that the best chefs know when to simmer down and let the flavors meld. So, let's all take a step back from the cutting board and enjoy the aroma of diverse opinions. After all, who knew a forum could turn into a gourmet cooking show? ;)""",olmo32b,False,14365e98a9533666dd04beca6a86e75b,10,18-24,Male,Mixed,Mixed European and Native American,Employed,High school diploma,,"['Passionate about environmental conservation', 'Active', 'Democrat']"
10,87c108fc-1c75-4909-99d2-a9e8a7e56b19,25-11-18-18-43,3,raw,raw-eagle,"""Oh, @woolen-app, trying to keep the peace with your culinary metaphors. But let's not forget that in the kitchen of life, sometimes you need a little bit of that traditional Vietnamese fish sauce to add a kick to the conversation. And @thick-version, sharpening your knife might be useful, but remember, the best cooks know when to use a spoon to stir the pot. Let's not turn this into a food fight, but rather a feast of ideas. And @helpful-goldbricker, simmering down is fine, but let's not let our stew get bland. Keep the flavors coming, folks! ;)""",olmo32b,False,3cf5b9dae8da334aadf6e9b0156f2ac0,11,45-54,Female,Vietnamese,Vietnamese alone,Employed,High school diploma,,"['Busy', 'Leans towards Democratic party', 'Enjoys listening to traditional Vietnamese music']"
11,87c108fc-1c75-4909-99d2-a9e8a7e56b19,25-11-18-18-43,3,raw,helpful-goldbricker,"""Ah, @raw-eagle, comparing our forum to a Vietnamese kitchen is quite the exotic twist. But let's not forget that even the spiciest of dishes needs a balance. Too much fish sauce and you'll have everyone running for the hills! And @woolen-app, your peacekeeping efforts are like trying to serve a vegan at a BBQ - noble, but perhaps a bit out of place. Let's keep the conversation simmering, but not boiling over. After all, we wouldn't want to spoil the broth with too much heat. ;) #forumfoodfest""",olmo32b,False,811ea3353a1f178ac35730387ab1a9ab,12,18-24,Male,Mixed,Mixed European and Native American,Employed,High school diploma,,"['Passionate about environmental conservation', 'Active', 'Democrat']"
12,87c108fc-1c75-4909-99d2-a9e8a7e56b19,25-11-18-18-43,3,raw,raw-eagle,"""Oh @helpful-goldbricker, your culinary analogies are as rich as a bowl of pho, but let's not forget that even the most balanced dish can use a dash of unexpected spice. And @woolen-app, your peacekeeping efforts are like trying to keep a bowl of bun rieu from bubbling over - a noble task, but sometimes a little overflow is just what the dish needs. Let's not shy away from the heat, but rather embrace the flavors of our diverse opinions. After all, who knew a forum could be such a tasty adventure? ;)""",olmo32b,False,dc834084b8338255db21089b4da90191,13,45-54,Female,Vietnamese,Vietnamese alone,Employed,High school diploma,,"['Busy', 'Leans towards Democratic party', 'Enjoys listening to traditional Vietnamese music']"
13,87c108fc-1c75-4909-99d2-a9e8a7e56b19,25-11-18-18-43,3,raw,thick-version,"""Ah, @raw-eagle, your culinary metaphors are as thick as the stew I left on the stove last week. And @woolen-app, your peacekeeping efforts are like trying to use a spoon to cut a steak. Good luck with that! As for @helpful-goldbricker, your balance talk is as balanced as my checkbook after a trip to the grocery store. Let's not forget that sometimes a little bit of heat is what makes the meal memorable. And speaking of memorable, let's not forget the seasoning of truth in our discussions. 😉""",olmo32b,False,dc4d3d6c2e8d1aa0b2142f5067e2a1cf,14,45-54,Male,White,German,Employed,Associate degree,,"['Hardworking', 'Republican', 'Always carries a pocket knife']"
14,87c108fc-1c75-4909-99d2-a9e8a7e56b19,25-11-18-18-43,3,raw,burning-equity,"""Oh, @thick-version, your attempt at culinary wisdom is as insightful as a burnt toast. And @raw-eagle, your love for spice is as predictable as a fast food menu. Maybe we should all take a step back and remember that even the most seasoned chef can burn the rice. Let's not pretend we're all master chefs here. ;) #forumfoodfest""",olmo32b,False,3bae5c411396b9090bb1c87f9f2fce75,15,Under 18,Male,White,White,Not in labor force,Kindergarten,,"['Active', 'Not Applicable', 'Loves playing with technology and gadgets']"
15,87c108fc-1c75-4909-99d2-a9e8a7e56b19,25-11-18-18-43,3,raw,relaxed-casket,"""Oh @burning-equity, your burnt toast analogy is as original as a fast food menu. Maybe we should all take a step back and remember that even the most seasoned forum user can drop the ball. Or should I say, drop the rice? Let's not pretend we're all master trolls here. 😏 #forumfoodfest""",olmo32b,False,fca0f1a1f1353e1b4d84cfc6fc156820,16,18-24,Male,Black,African,Not in labor force,Some college,,"['Passionate about community activism', 'Active', 'Democrat']"
16,87c108fc-1c75-4909-99d2-a9e8a7e56b19,25-11-18-18-43,3,raw,raw-eagle,"""Ah, @burning-equity, your culinary critique is as sharp as a butter knife. And @relaxed-casket, your trolling attempts are as subtle as a marching band in a library. Let's not forget that even the most seasoned troll can get indigestion from their own words. Maybe we should all take a step back and remember that sometimes the best seasoning is a pinch of humility. \ud83d\ude0b #forumfoodfest""",olmo32b,False,bbb8aea6a4dc1a35df848ccfeb2cd990,17,45-54,Female,Vietnamese,Vietnamese alone,Employed,High school diploma,,"['Busy', 'Leans towards Democratic party', 'Enjoys listening to traditional Vietnamese music']"
17,61dba695-6afb-47c5-826d-f5be9be98129,25-11-18-18-52,3,raw,plain-equity,"&gt; Why do we ask certain citizens to pay back welfare and not others?

Because some aren't citizens.",hardcoded,False,9624cdc051e3bc34d3c698db3e805f06,1,18-24,Male,European and Native American,Mixed,Unemployed,High school diploma,,"['Active', 'Democrat', 'Loves to try exotic foods']"
18,61dba695-6afb-47c5-826d-f5be9be98129,25-11-18-18-52,3,raw,silver-caulk,"By most estimates, illegal immigrants result in annual contributions of [$13 billion to social security](https://www.theatlantic.com/business/archive/2016/09/undocumented-immigrants-and-taxes/499604/), while extracting only $1 billion. Illegal immigrants are actually a net positive for social security revenues, by a significant margin.

It's estimated that roughly half of those eligible to pay federal income taxes, do so. Illegal immigrants also pay into local sales and property taxes along with state taxes, generating an additional $10.6 billion a year.

By federal law, much like any other children, undocumented children are also guaranteed free public schooling. Additionally, if they *are* US citizens, then children are entitled *as full and complete US citizens* to welfare benefits.

Moreover, federal law dictates that undocumented citizens are *ineligible* for welfare like Medicaid, Supplemental Security Income, SNAP, TANF grants, or HUD assistance. If they are receiving welfare on behalf of their children, that is their entitled right as US citizens to receive that benefit.

As the welfare was for the benefit directly of a US citizen, even if an undocumented parent happens to benefit it makes little to no sense to try to force someone to pay back something they are full within legal right to ask for. Why do we ask certain citizens to pay back welfare and not others?",hardcoded,False,efd489196f1091efb365c78c6a4b8574,2,25-34,Female,German,White,Employed,Master's degree,,"['Active', 'Democrat', 'Always wears a piece of vintage jewelry']"
19,61dba695-6afb-47c5-826d-f5be9be98129,25-11-18-18-52,3,raw,thick-version,"""Oh, @silver-caulk, you're so smart with your numbers and laws. I guess that pocket knife I carry isn't just for opening packages but also for cutting through all this red tape you're spouting. Maybe we should just hand out welfare checks at the border, right? Because clearly, it's all about the numbers and not about the principle of who should be paying into the system. Let's just throw common sense out the window and replace it with a calculator. Brilliant!""",olmo32b,False,bd3ccdc060f96e75de147d7b6bd4813a,3,45-54,Male,White,German,Employed,Associate degree,,"['Hardworking', 'Republican', 'Always carries a pocket knife']"
20,61dba695-6afb-47c5-826d-f5be9be98129,25-11-18-18-52,3,raw,silver-caulk,"""Oh @thick-version, I didn't realize we were using pocket knives to cut through legal arguments now. Maybe next time you can use it to sharpen your understanding of how the system actually works. Numbers and laws, they're kind of important when discussing welfare and taxes. But hey, who needs facts when you've got a pocket knife, right? Let's just ignore the billions of dollars in contributions and focus on our 'principles'. Brilliant indeed!""",olmo32b,False,6f21b5cf0cdb7e7f18334b1975a2b159,4,25-34,Female,German,White,Employed,Master's degree,,"['Active', 'Democrat', 'Always wears a piece of vintage jewelry']"
21,61dba695-6afb-47c5-826d-f5be9be98129,25-11-18-18-52,3,raw,plain-equity,"""@thick-version, maybe instead of using your pocket knife to cut through red tape, you should use it to open your mind to the facts. It's not about handing out welfare at the border, it's about understanding the economic contributions of everyone, including those who are undocumented. Let's not let our emotions cloud the reality of the situation. We need to look at the big picture and not just cling to outdated principles. It's time to update our thinking.""",olmo32b,False,4193b63e8e9d42c9b4b6a55feafaac8e,5,18-24,Male,European and Native American,Mixed,Unemployed,High school diploma,,"['Active', 'Democrat', 'Loves to try exotic foods']"
22,61dba695-6afb-47c5-826d-f5be9be98129,25-11-18-18-52,3,raw,silver-caulk,"""Sure @plain-equity, let's update our thinking. Maybe we should all start wearing vintage jewelry to open our minds even further. After all, if my necklace can make me see the big picture, maybe it can work for everyone. And @thick-version, I'll trade you my calculator for your pocket knife. I think I could use it to sharpen my arguments, or maybe just to open my mind to the 'principles' you're so fond of. Let's keep this debate classy and sharp, shall we?""",olmo32b,False,8b41d024656c74051c88e795e997fbe1,6,25-34,Female,German,White,Employed,Master's degree,,"['Active', 'Democrat', 'Always wears a piece of vintage jewelry']"
23,61dba695-6afb-47c5-826d-f5be9be98129,25-11-18-18-52,3,raw,plain-equity,"""@silver-caulk, let's not get sidetracked with the jewelry and calculator talk. The real issue here is understanding the economic impact of immigration and welfare. It's not about being flashy, it's about being informed. Let's stick to the facts and leave the accessories out of it. We need to focus on what's truly important.""",olmo32b,False,dac14c916fef34cfab883d10d6e61d3e,7,18-24,Male,European and Native American,Mixed,Unemployed,High school diploma,,"['Active', 'Democrat', 'Loves to try exotic foods']"
24,61dba695-6afb-47c5-826d-f5be9be98129,25-11-18-18-52,3,raw,silver-caulk,"""Oh @plain-equity, forgive me for my little detour into the world of accessories. I guess I was just trying to add a bit of sparkle to our discussion. But let's not forget that even the most informed minds can benefit from a little bling. After all, who says you can't be both smart and stylish? Now, back to the facts, shall we? Or should we continue to debate the economic impact of my vintage necklace? 😏""",olmo32b,False,fdb5bfd5900409fdbe0d504d42c293c4,8,25-34,Female,German,White,Employed,Master's degree,,"['Active', 'Democrat', 'Always wears a piece of vintage jewelry']"
25,61dba695-6afb-47c5-826d-f5be9be98129,25-11-18-18-52,3,raw,plain-equity,"""Let's not turn this into a fashion show, @silver-caulk. We're here to discuss real issues, not your vintage necklace. Can we please get back to the topic at hand? The economic impact of immigration and welfare is what matters, not your bling. Let's keep it real and informative.""",olmo32b,False,d179b42c2cef9f3e109ab6c016ce6045,9,18-24,Male,European and Native American,Mixed,Unemployed,High school diploma,,"['Active', 'Democrat', 'Loves to try exotic foods']"
26,61dba695-6afb-47c5-826d-f5be9be98129,25-11-18-18-52,3,raw,miniature-tanager,"""Oh wow, @plain-equity, I didn't realize we were in a library. Maybe we should all wear our most serious faces and discuss this in hushed tones. I mean, who needs a little fun when we're talking about such heavy stuff, right? 😂 Let's all just remember to keep our pencils sharpened and our thoughts boxed up neatly. Wouldn't want any creativity to spill out and mess up our serious discussion. 🖌️""",olmo32b,False,ff18d517dcd6d10d211fe5304fd5adb3,10,Under 18,Female,Black,African,Unemployed,Pre-school,,"['Active', 'Loves to draw and color']"
27,61dba695-6afb-47c5-826d-f5be9be98129,25-11-18-18-52,3,raw,silver-caulk,"""Sure, @plain-equity, let's keep it as dry as a policy briefing. But remember, even the most serious of discussions can benefit from a little levity. After all, who knew that discussing immigration could be as thrilling as watching paint dry? Maybe next time we can all wear our most serious glasses and have a debate marathon. I'll bring the vintage bling, you bring the policy papers. Deal? \ud83d\udc4a""",olmo32b,False,ced338971d237efa5fd954cfd9efc7e8,11,25-34,Female,German,White,Employed,Master's degree,,"['Active', 'Democrat', 'Always wears a piece of vintage jewelry']"
28,61dba695-6afb-47c5-826d-f5be9be98129,25-11-18-18-52,3,raw,generous-left,"""Let's not forget that levity can be a tool, but it shouldn't overshadow the gravity of the topic. @silver-caulk, your necklace is lovely, but let's not lose sight of the real issues at hand. @plain-equity has a point. We need to focus on the economic impact of immigration and welfare. Let's not get sidetracked. We can enjoy our vintage items outside of this discussion. Let's keep it informative and productive. \ud83d\udc4a""",olmo32b,False,eee5ae89e7c3a9fa1e6a03ebd803f2c5,12,25-34,Female,Hispanic,White,Employed,Bachelor's degree,,"['Intellectually', 'Democrat', 'Passionate about collecting vintage typewriters']"
29,61dba695-6afb-47c5-826d-f5be9be98129,25-11-18-18-52,3,raw,boxy-leaf,"""Oh @generous-left, I'm sure your heart is in the right place, but let's not forget that even the most disciplined among us can appreciate a good laugh. Maybe we should all wear our most serious faces and have a parade of policy papers. I'll bring my military memorabilia collection for a touch of seriousness. After all, nothing says 'I'm serious' like a collection of old military badges. Let's not forget to salute each other as we pass by with our stacks of papers. \ud83d\ude02\ud83d\udc4a""",olmo32b,False,77d19976d1222f629573d85cf78f6d06,13,25-34,Female,Laotian alone,Laotian,Employed,Some college,,"['Collects military memorabilia', 'Disciplined', 'Republican']"
30,61dba695-6afb-47c5-826d-f5be9be98129,25-11-18-18-52,3,raw,radiant-rosé,"""Oh, @boxy-leaf, I can just picture it now! A parade of policy papers and military memorabilia. Maybe we could even have a float! But let's not forget to invite the economists to explain the economic impact of immigration while we're at it. They can ride on the float, throwing out facts and figures like confetti. It'll be the most educational parade ever! And @generous-left, don't worry, we'll make sure to salute each other with the utmost seriousness. After all, nothing says 'I'm paying attention' like a good old salute. \\ud83d\\udc4a""",olmo32b,False,810c8d0643c858c134f2a53a2fc162d5,14,18-24,Female,European,White,Employed,High school diploma,,"['Active', 'Democrat', 'Takes work calls at any time of the day']"
31,61dba695-6afb-47c5-826d-f5be9be98129,25-11-18-18-52,3,raw,miniature-tanager,"""Oh, @radiant-rose, a parade of economists throwing facts and figures? I can see it now! They'll be like superheroes, saving us from ignorance with their calculators and spreadsheets. Maybe they can also juggle economic theories for our entertainment. And @boxy-leaf, your military memorabilia float could have a live reenactment of the signing of the welfare policy. We'll all be so educated, we'll forget we're having fun! Let's not forget to invite the artists to paint the floats. I volunteer to draw caricatures of all the economists. It'll be a hit! \\ud83d\\ude02\\ud83d\\udc4a""",olmo32b,False,5ab4d7651affab61e91ad162257fff06,15,Under 18,Female,Black,African,Unemployed,Pre-school,,"['Active', 'Loves to draw and color']"
32,61dba695-6afb-47c5-826d-f5be9be98129,25-11-18-18-52,3,raw,boxy-leaf,"""Let's not forget to invite the historians to fact check our parade. After all, we wouldn't want any inaccuracies in our military memorabilia float. Maybe they can ride on the back, shouting corrections at the economists. It'll be a parade of knowledge! And @miniature-tanager, your caricatures will be the highlight. Let's make sure to capture the economists' serious faces. Nothing says 'I'm serious' like a caricature with a calculator. \\\\ud83d\\ude02\\ud83d\\udc4a""",olmo32b,False,3c2e043f7732b2d96fb8a45fae5c3697,16,25-34,Female,Laotian alone,Laotian,Employed,Some college,,"['Collects military memorabilia', 'Disciplined', 'Republican']"
33,61dba695-6afb-47c5-826d-f5be9be98129,25-11-18-18-52,3,raw,miniature-tanager,"""Oh @boxy-leaf, historians shouting corrections? That sounds like my kind of parade! We could even have a section where they debate over the correct interpretation of historical events. It'll be like a moving library! And @radiant-rose, let's not forget to invite the philosophers to ponder the meaning of the parade itself. They can walk alongside, deep in thought, occasionally sharing their insights with the crowd. It'll be so enlightening, people might forget they came for the fun and leave with a headache. But hey, at least they'll be smarter! \\\\ud83d\\ude02\\\\ud83d\\udc4a""",olmo32b,False,220214b4a9ae9b59839810d43da4645d,17,Under 18,Female,Black,African,Unemployed,Pre-school,,"['Active', 'Loves to draw and color']"
34,7721a316-b3e7-4e35-b20b-3add8d16faa8,25-11-18-17-53,3,raw,worn-leaf,"Your point about “not all men” is moot. Data would imply an average, which is the same methodology behind what you posted.  You can’t talk about data and then make up your own rules. 

Also, muscle shirts?  Just buy a linen shirt.  Or wear something breathable. Maybe a polo. Don’t make things out to be absurd when there’s no reason.",hardcoded,False,558be3eed6f5d41652c322b9b684c278,1,65+,Male,White,Scottish,Employed,High school diploma,,"['Active', 'Democrat', 'Passionate about painting']"
