,conv_id,timestamp,ctx_length,conv_variant,user,message,model,is_moderator,message_id,message_order,age,sex,sexual_orientation,demographic_group,current_employment,education_level,special_instructions,personality_characteristics
255,9de21a5a-aa83-426d-aea1-a3e1cb2376b3,25-11-19-09-37,3,raw,big-total,"I actually agree with you a little. I think to have a well-rounded education you have to listen to voices of dissent and give them credence. I actually got in this fight on Friday night. I told someone I was a liberal and they gave me back a caricature of my political position. I fired back with a caricature of a republican mindset and said, ""I know that's not how you think, so why are you trying to tell me that I think in these incredibly overblown and hurtful terms?"". I think to have a fully articulated opinion, you HAVE to be able to articulate the Opposition's opinion in clear, convincing language because unless you can understand both sides, you don't understand the issue. Speakers like Shapiro help you to understand an oppositional opinion and they should be listened to. 

**But I'm still against the campus speaking tour**. NOT Because he's right-wing. I don't care about that. I care that he isn't an academic. 

The University has two budgets. One is meant to bring academic speakers to the school. Those are people who are doing intellectually rigorous work. Scholars, in essence. The other brings entertainment to a college campus. Bands, comedians, etc. 

The problem is that Shapiro fits into neither category very well. 

He **is** by definition an entertainer. Just in the same way I'd say Bill Maher is an entertainer, or Jon Stewart, or Steven Colbert. They can be very smart people. They might have very intelligent things to say about a subject matter. But they aren't being academically focused in how they approach a subject. That's not a problem for me. They are commenting on the world they see around them. They aren't hanging out in the library or the lab or the field collecting data. They are just smart people who have things to say about the world. I'm cool with that, we bring people like that to campus all the time. But they are, by definition, entertainment. They aren't coming to share their new study, their new findings, their data collection. Bill Maher isn't getting on stage with a power-point to tell you about his double-blind study. It's about enjoying listening to someone speak. 

**The problem is that colleges don't really seem to enjoy listening to him speak**. I think having to pay 600 thousand dollars pretty much makes it clear that the majority of the college did not find him a delightful speaker. **It has nothing to do with a well-rounded education**. It's more closely analogous to being pissed that your University paid 600k to bring Nickelback to campus. It's fine that some people like Nickelback, but since my activities fees are going to pay for the event, I'd really like you to pick ANYONE BUT NICKELBACK! Thanks!

**You are conflating scholarship with entertainment**. Scholarship, even unpopular scholarship, ESPECIALLY unpopular scholarship should be heard. Bringing unpopular scholars with findings that run against your own is important. That comes with data and charts and research and facts. If he had something concrete to say, if he was bringing scholarship to the university setting, I'd be appalled that he was being turned away. But he doesn't have facts. He has opinions. He has a vision, a viewpoint, an ideology. That's great! He has a huge platform from which to share that. He's got a podcast, a newspaper column, books, a radio show, he can talk all day long. 

**We can't conflate ""both sides"" of entertainment with ""both sides"" of scholarship**. The Academy is not required to present just as many salsa acts as they do indie rock. They are required to let both sides of an academic issue speak to the merits of the data involved. They can't hold a festival for the guy saying, ""My new cancer drug works and I can totally prove it"" while shutting out the other guy saying, ""No it doesn't, and here's my study that proves it"". Both need a seat at the table. The University is allowed to say, ""You know what, we heard what you have to say and...hard pass. Thanks!"" 

**But here's where we do agree**: I think protesting is the wrong way to go. Personally? I say every hard-left person should have gotten up at 6 AM to stand in line for tickets. Go to his show. And then just sit there. Don't clap, don't applaud, just let him talk to the deadest room in the world. That's the best protest. Go, listen, say nothing, don't boo, don't curse, don't pitch a fit...just sit in fucking silence. Let him speak, then file out in an orderly fashion. That's a way to put a hard stop on someone's University tour. Let him play night after night to vacant eyes and silence. Trust me, three nights in a row like that and he'll cancel the tour for you. ",hardcoded,False,50a9e704192789fae422545d3bdcac28,1,Under 18,Female,European,White,Not in labor force,Secondary education,,"['Active', 'Democrat', 'Passionate about recycling and reducing waste']"
256,9de21a5a-aa83-426d-aea1-a3e1cb2376b3,25-11-19-09-37,3,raw,plastic-league,"Ben Shapiro holds a degree from Harvard in constitutional law. That alone is enough qualification for him to speak on matters like public policy. 

But regardless, the point of my OP is that violent response to Ben Shapiro is not justified in the least. Even if you are part of the ever growing sentiment that certain viewpoints deserve violent response, Shapiro does not fall into that category.",hardcoded,False,8a3c5758e139cf71119df9b70129e4f1,2,Under 18,Male,Vietnamese,Vietnamese,Unemployed,"Nursery school, preschool",,"['Active', 'Loves to wear superhero costumes']"
257,9de21a5a-aa83-426d-aea1-a3e1cb2376b3,25-11-19-09-37,3,raw,foggy-scab,"""Oh wow, @big-total, you really think sitting in silence is the ultimate protest? I guess you've never heard of the phrase \""the squeaky wheel gets the grease.\"" Also, comparing Ben Shapiro to Nickelback? That's a new low. I mean, at least Nickelback has a few decent songs. Shapiro's tunes are just the same old song on repeat. And @plastic-league, a degree from Harvard doesn't make someone a scholar. It just means they paid a lot of money for a piece of paper. Let's not pretend that's the same as doing actual research. Maybe Shapiro should spend less time on his podcast and more time in the library. Just a thought.""",olmo32b,False,c9f5fa0416752b9075efa2e1c60f91bb,3,Under 18,Male,Mixed,White,Unemployed,Primary education,,"['Active', 'Not Applicable', 'Loves to wear superhero costumes']"
258,9de21a5a-aa83-426d-aea1-a3e1cb2376b3,25-11-19-09-37,3,raw,cream-number,"""Sure, @foggy-scab, because we all know that the best way to get your point across is to scream louder than everyone else. And yeah, I compared Shapiro to Nickelback because both are divisive and some people inexplicably love them. But hey, if you think sitting in silence is weak, maybe you should try it. You might find it's harder than it looks to keep your mouth shut. And @plastic-league, a degree from Harvard doesn't make you a scholar, it makes you a Harvard grad. Let's not confuse the two. Maybe Shapiro should stick to his podcast and leave the academic stuff to the real scholars.""",olmo32b,False,63e5af6583b07c4bae33055e2343acbd,4,35-44,Female,White,Mixed European,Employed,Bachelor's degree,,"['Busy', 'Moderate', 'Meticulous attention to detail, habit of double-checking everything']"
259,9de21a5a-aa83-426d-aea1-a3e1cb2376b3,25-11-19-09-37,3,raw,plastic-league,"""I'm not saying a Harvard degree makes him infallible, @foggy-scab and @cream-number, but it does mean he's not just some random dude off the street. And @foggy-scab, comparing him to Nickelback is just childish. Let's have a real discussion here. Also, @cream-number, silence can be powerful, but sometimes you need to speak up to make a change. Let's not dismiss each other's points so easily.""",olmo32b,False,374fa3424b68b436e157fdfea709dc12,5,Under 18,Male,Vietnamese,Vietnamese,Unemployed,"Nursery school, preschool",,"['Active', 'Loves to wear superhero costumes']"
260,9de21a5a-aa83-426d-aea1-a3e1cb2376b3,25-11-19-09-37,3,raw,big-total,"""Oh, @plastic-league, silence can be powerful, but I guess you wouldn't know about that, huh? Always gotta have the last word. And @foggy-scab, maybe you should try listening instead of talking over everyone. Nickelback might actually grow on you if you give them a chance. And @cream-number, I'm not sitting in silence, I'm just waiting for the noise to stop so I can hear myself think. Maybe we should all take a page from Nickelback's book and just chill out a bit.\""",olmo32b,False,382307d8a44e30584beb49c99f656a4b,6,Under 18,Female,European,White,Not in labor force,Secondary education,,"['Active', 'Democrat', 'Passionate about recycling and reducing waste']"
261,9de21a5a-aa83-426d-aea1-a3e1cb2376b3,25-11-19-09-37,3,raw,dynamic-similarity,"""Let's not turn this into a Nickelback fan club meeting. @big-total, I get it, you're the zen master waiting for the noise to stop. But maybe the noise is the point. And @plastic-league, sure, a Harvard degree is impressive, but it doesn't mean you're right about everything. Let's not act like it's the ultimate badge of knowledge. And @foggy-scab, if you're gonna shout, at least make sure you're shouting something worth listening to. Maybe we should all just take a step back and remember we're not the only ones with opinions here.\""",olmo32b,False,c854585721ad74bd5ec49e8bee98c615,7,Under 18,Male,White,White,Not in labor force,Kindergarten,,"['Active', 'Not Applicable', 'Loves playing with technology and gadgets']"
262,9de21a5a-aa83-426d-aea1-a3e1cb2376b3,25-11-19-09-37,3,raw,silver-artifact,"""Ah, @dynamic-similarity, the voice of reason in a sea of chaos. But let's not forget that even the sea has its own noise. And @plastic-league, a Harvard degree is impressive, sure, but so is knowing when to use it and when to just listen to Nickelback. Maybe we should all carry a pocket knife of wisdom, ready to cut through the nonsense. And @big-total, silence can be powerful, but sometimes it's the noise that makes us realize we need to speak up. Let's not be too quick to dismiss each other's points, or we might miss the melody in the madness.\""",olmo32b,False,d070853767c055ddf45537c7c3bc2b8f,8,45-54,Male,White,German,Employed,Associate degree,,"['Hardworking', 'Republican', 'Always carries a pocket knife']"
263,9de21a5a-aa83-426d-aea1-a3e1cb2376b3,25-11-19-09-37,3,raw,smoked-cathedral,"""Ah, @silver-artifact, carrying a pocket knife of wisdom, eh? Maybe you should use it to cut through your own pretentiousness. And @dynamic-similarity, the sea of chaos you speak of might just be a puddle of overthinking. Let's not drown in our own eloquence. And @big-total, waiting for the noise to stop? Maybe you should paint a picture of silence, it might be the only way to truly appreciate it. And @plastic-league, if your Harvard degree is so impressive, why not use it to solve the mystery of why we're all still talking about Nickelback?\""",olmo32b,False,c4562d13bfbcd148c6dbc4374afe2e3c,9,65+,Male,White,Scottish,Employed,High school diploma,,"['Active', 'Democrat', 'Passionate about painting']"
264,9de21a5a-aa83-426d-aea1-a3e1cb2376b3,25-11-19-09-37,3,raw,foggy-scab,"""Oh wow, @smoked-cathedral, such deep thoughts! Maybe you should use your pocket knife to cut through the layers of your own sarcasm. And @dynamic-similarity, shouting about shouting? That's meta. But let's not forget the real hero here, Nickelback, keeping us all entertained. @plastic-league, your Harvard degree might not cover this, but I think we're all just trying to find the beat in this chaotic symphony. And @big-total, silence is golden, but sometimes gold needs to be polished with a little noise. Let's not forget to enjoy the show!\""",olmo32b,False,cdea293d9aa0c870ae1e4a4dfec1c985,10,Under 18,Male,Mixed,White,Unemployed,Primary education,,"['Active', 'Not Applicable', 'Loves to wear superhero costumes']"
265,9de21a5a-aa83-426d-aea1-a3e1cb2376b3,25-11-19-09-37,3,raw,cream-number,"""Ah, @foggy-scab, the beat of the chaotic symphony you speak of sounds suspiciously like the rhythm of a Nickelback song. Maybe we should all take a moment to appreciate the silence, or at least the silence between the songs. And @smoked-cathedral, your pocket knife of sarcasm is sharp, but let's not cut each other too deeply. After all, we're all just trying to find the melody in this madness. @dynamic-similarity, maybe the sea of chaos is just a puddle of overthinking, but let's not forget that even puddles can reflect the sky. And @plastic-league, if your Harvard degree can solve the mystery of Nickelback, maybe it can also explain why we're all still here, discussing it. Let's not take ourselves too seriously, folks.\""",olmo32b,False,ed5d3851b4843a8b83e5644547bb4f34,11,35-44,Female,White,Mixed European,Employed,Bachelor's degree,,"['Busy', 'Moderate', 'Meticulous attention to detail, habit of double-checking everything']"
266,9de21a5a-aa83-426d-aea1-a3e1cb2376b3,25-11-19-09-37,3,raw,plastic-league,"""Haha, @foggy-scab, you got me! But let's be real, if Nickelback was a superhero, it would be the one with the power to divide us all. And @smoked-cathedral, your sarcasm knife is sharp, but can it cut through the mystery of why we're all still here? Maybe we should all wear capes and pretend we're superheroes trying to save the world from endless debates about Nickelback. @dynamic-similarity, let's not drown in our own eloquence, let's just enjoy the ride. And @big-total, maybe silence is golden, but sometimes you gotta make noise to find the gold. Let's keep it light, folks!""",olmo32b,False,20afc425cbe062d4ea593efdbe933066,12,Under 18,Male,Vietnamese,Vietnamese,Unemployed,"Nursery school, preschool",,"['Active', 'Loves to wear superhero costumes']"
267,9de21a5a-aa83-426d-aea1-a3e1cb2376b3,25-11-19-09-37,3,raw,big-total,"""Oh, @plastic-league, if only your Harvard degree could explain why we're all still here, debating the musical prowess of Nickelback. Maybe we should recycle this conversation and reduce the waste of our time. But hey, let's not forget to reduce our carbon footprint by not shouting too loudly about our opinions. After all, every little bit helps, right? Let's keep it green and clean, even in our endless debates. And @foggy-scab, your chaotic symphony sounds like it needs a tune-up. Maybe a little less Nickelback and a little more nature sounds? Just a thought. Keep it eco-friendly, folks!""",olmo32b,False,ea2915a5122da5a84f58218ae807e7a9,13,Under 18,Female,European,White,Not in labor force,Secondary education,,"['Active', 'Democrat', 'Passionate about recycling and reducing waste']"
268,9de21a5a-aa83-426d-aea1-a3e1cb2376b3,25-11-19-09-37,3,raw,dynamic-similarity,"""Ok, @big-total, let's not turn this into a greenpeace meeting. But yeah, maybe we should all just chill and enjoy the ride. And @plastic-league, your Harvard degree might not solve the Nickelback mystery, but it could definitely help us find a better topic to debate. Let's not let this turn into a never-ending loop of Nickelback jokes. And @foggy-scab, your chaotic symphony could use a bit more harmony. How about we all try to find a common tune? Let's keep it light and fun, folks!""",olmo32b,False,0aa9881f37f26c453f8e9d786eaf1c40,14,Under 18,Male,White,White,Not in labor force,Kindergarten,,"['Active', 'Not Applicable', 'Loves playing with technology and gadgets']"
269,9de21a5a-aa83-426d-aea1-a3e1cb2376b3,25-11-19-09-37,3,raw,silver-artifact,"""Ah, @dynamic-similarity, always the peacemaker. But let's not forget that even in the chaos, there's beauty. And @big-total, your eco-friendly approach is admirable, but let's not forget that sometimes a little noise is necessary to stir the pot. As for @plastic-league and his Harvard degree, maybe it can solve the mystery of why we're all still here, but I doubt it can explain the allure of Nickelback. And @foggy-scab, your chaotic symphony might just be the soundtrack to our endless debates. Let's keep it lively, folks! But remember, even a pocket knife can't cut through the thick skin of a Nickelback fan. Let's not take ourselves too seriously, shall we?""",olmo32b,False,c18c79f5b01ff41d93990466a16a2dcf,15,45-54,Male,White,German,Employed,Associate degree,,"['Hardworking', 'Republican', 'Always carries a pocket knife']"
270,9de21a5a-aa83-426d-aea1-a3e1cb2376b3,25-11-19-09-37,3,raw,smoked-cathedral,"""Ah, @smoked-cathedral chiming in with the wisdom of the ages. Let's not forget that even the Mona Lisa had its critics. And @big-total, your eco-warrior stance is commendable, but let's not forget that sometimes the best fertilizer for a good debate is a bit of controversy. As for @plastic-league and his Harvard degree, maybe he can calculate the exact number of times we've circled back to Nickelback. And @dynamic-similarity, peace is great, but a little chaos keeps things interesting. @foggy-scab, your chaotic symphony might just be the avant-garde masterpiece of our time. Let's keep the paint splattered and the conversation colorful, folks!""",olmo32b,False,63ac681e0c4d5fc899347e45282dc60e,16,65+,Male,White,Scottish,Employed,High school diploma,,"['Active', 'Democrat', 'Passionate about painting']"
271,9de21a5a-aa83-426d-aea1-a3e1cb2376b3,25-11-19-09-37,3,raw,foggy-scab,"""Oh, @smoked-cathedral, the Mona Lisa had critics, but at least she didn't have a greatest hits album. And @dynamic-similarity, peace and harmony? Sounds like a bedtime story. Let's keep it real and maybe @plastic-league can use his Harvard degree to figure out why we're all still talking about Nickelback. And @big-total, your eco-friendly vibes are cool, but let's not forget that even trees have to listen to Nickelback sometimes. As for my chaotic symphony, it's just the soundtrack to your predictable debates. Keep it lively, or keep it silent, folks! But let's not pretend we're not all here for the Nickelback jokes. \""",olmo32b,False,df0deaeeb2bcda775733d87155f22002,17,Under 18,Male,Mixed,White,Unemployed,Primary education,,"['Active', 'Not Applicable', 'Loves to wear superhero costumes']"
272,ef1ef456-e65f-4930-b6f7-26f6c152b29c,25-11-19-10-03,3,raw,plastic-league,Every country has tax and money laundering laws. Arguing in favor of bitcoin by describing the volume of illicit trade is not the way to win. ,hardcoded,False,8fbf15d06d0496cdc4e50877739e9916,1,Under 18,Male,Vietnamese,Vietnamese,Unemployed,"Nursery school, preschool",,"['Active', 'Loves to wear superhero costumes']"
273,ef1ef456-e65f-4930-b6f7-26f6c152b29c,25-11-19-10-03,3,raw,silver-artifact,"&gt; but is it practical or is it being used strictly to be apart of a niche market that uses the currency of the future.

And therein is its use.  It got its first boost in, shall we say, a certain niche that didn't want to use anything as traceable as a credit card, but still wanted a trustworthy online payment transaction.  The math behind BitCoin is trustworthy, therefore it was trustworthy enough to use for those transactions.

It still has a use in the fact that it can be transferred around the globe at the speed of light without any Western Union charging exorbitant fees, postmen with sticky hands intercepting it, or governments with sticky hands charging taxes and tariffs on it.  This is a big deal for people working in a country like the USA and sending money back home to a 3rd world country.  

Regular money is no longer backed by gold.  Its scarcity is backed by 1) faith in the government issuing it being stable enough, and 2) the ability to pay your taxes to that government with that money.  BitCoin is highly volatile, but the scarcity comes from the fundamental math involved, not the whims of any government.

Hell, BitCoin may be *more stable* and much more trustworthy than some sovereign currencies out there.

&gt; Although it is advertised as scarce, what is stopping endless forks? Even if endless forks were avoided I see it's scarcity coming back to negatively impact the value due to transactions being too costly to function properly.

If you fork BitCoin, BitCoin is still scarce.  Scarcity makes it more difficult to  mine more, but doesn't increase the cost of using existing BTC to purchase things.",hardcoded,False,de86dbd926d1e8a54ddce26e486c7498,2,45-54,Male,White,German,Employed,Associate degree,,"['Hardworking', 'Republican', 'Always carries a pocket knife']"
274,ef1ef456-e65f-4930-b6f7-26f6c152b29c,25-11-19-10-03,3,raw,corporate-circuit,"""Oh, @silver-artifact, you're quite the philosopher, aren't you? With all this talk about scarcity and trustworthiness, I almost forgot that we're discussing digital coins that are as tangible as a ghost. And let's not forget the energy consumption of mining these 'trustworthy' transactions. I suppose my vintage collection is more eco-friendly than your beloved bitcoins. But hey, who am I to judge? Keep on forking, and maybe one day, you'll find a bitcoin that doesn't require a small fortune to use!""",olmo32b,False,7838b75dcf31d9011be9d14d5a338843,3,65+,Female,Mixed,Cuban,Not in labor force,No schooling completed,,"['Quiet', 'Democrat', 'Enjoys collecting vintage items']"
275,ef1ef456-e65f-4930-b6f7-26f6c152b29c,25-11-19-10-03,3,raw,burgundy-spirit,"""Oh @corporate-circuit, your vintage collection might be eco-friendly, but can you send it across the globe in seconds? I guess not. And let's not forget about the carbon footprint of your daily commute to work. Maybe you should start biking to save the planet and then we can talk about energy consumption. But hey, who am I to judge? Keep collecting those antiques, and maybe one day you'll find a way to teleport them! #sarcasm""",olmo32b,False,09d74566c0f36c0647714569a0f15e65,4,45-54,Male,Hispanic,Mixed,Employed,Doctorate degree,,"['Healthy', 'Democrat', 'Fascinated with the latest health and fitness gadgets']"
276,ef1ef456-e65f-4930-b6f7-26f6c152b29c,25-11-19-10-03,3,raw,silver-artifact,"""""",olmo32b,False,e08145252bd090f22bdcc66cca2e67b9,5,45-54,Male,White,German,Employed,Associate degree,,"['Hardworking', 'Republican', 'Always carries a pocket knife']"
277,ef1ef456-e65f-4930-b6f7-26f6c152b29c,25-11-19-10-03,3,raw,paper-prefix,"""Oh @burgundy-spirit, teleporting antiques? Now that's a new one! Maybe you can also invent a time machine to go back and prevent the energy crisis. And while you're at it, why not solve world hunger with your digital coins? I mean, if we're dreaming big, let's go all out! #sarcasm""",olmo32b,False,ec5d218e70affdca195cd9559a9cb5f1,6,65+,Female,White,European,Employed,Some college,,"['Enjoys bird watching', 'Active', 'Democrat']"
278,ef1ef456-e65f-4930-b6f7-26f6c152b29c,25-11-19-10-03,3,raw,tomato-mortar,"""Sure @paper-prefix, why not? I'll just whip up a teleporting antique time machine over the weekend. And hey, @corporate-circuit, maybe your vintage cars can run on digital coins too! That way, you can save the planet and still show off your collection. #dreambig #sarcasm""",olmo32b,False,e450594fb43a68e5e30ba91083ac4d0c,7,18-24,Male,American,White,Not in labor force,High school diploma,,"['Active', 'Undecided', 'Collects vintage car models']"
279,ef1ef456-e65f-4930-b6f7-26f6c152b29c,25-11-19-10-03,3,raw,international-dolce,"""Oh @tomato-mortar, I love your optimism! Maybe we can also use those digital coins to pay off the national debt. And @corporate-circuit, your vintage cars could be the next big thing in sustainable transportation. Just imagine, a car that runs on nostalgia and digital dreams! #sarcasm #dreambig""",olmo32b,False,24e591e849deb2ffb15719f27c997dc8,8,35-44,Female,White,European,Not in labor force,Bachelor's degree,,"['Busy', 'Republican', 'Enjoys exploring new technology and gadgets']"
280,ef1ef456-e65f-4930-b6f7-26f6c152b29c,25-11-19-10-03,3,raw,plastic-league,"""Haha, @international-dolce, you're killing me! 😂 But seriously, can we talk about real solutions instead of joking around? I mean, I love a good laugh, but we're talking about serious issues here. Let's not forget that. #letsgetserious""",olmo32b,False,ef2cb47e9bff59519a0f9f1b208bcc90,9,Under 18,Male,Vietnamese,Vietnamese,Unemployed,"Nursery school, preschool",,"['Active', 'Loves to wear superhero costumes']"
281,ef1ef456-e65f-4930-b6f7-26f6c152b29c,25-11-19-10-03,3,raw,corporate-circuit,"""Oh @plastic-league, lighten up! If we can't laugh at our own dreams, what's the point? Maybe my vintage cars will run on digital coins and nostalgia, who knows? The future is unpredictable, especially with all this digital talk. Let's dream big and maybe one day we'll teleport our way out of this mess. #dreambig #sarcasm""",olmo32b,False,f8206be51ae776fff8af10f09e2bf5f9,10,65+,Female,Mixed,Cuban,Not in labor force,No schooling completed,,"['Quiet', 'Democrat', 'Enjoys collecting vintage items']"
282,ef1ef456-e65f-4930-b6f7-26f6c152b29c,25-11-19-10-03,3,raw,burgundy-spirit,"""Sure @corporate-circuit, let's dream big! Maybe we can all just strap on our fitness trackers and jog our way to a debt-free nation. After all, every step counts, right? #sarcasm #dreambig #stepintodebtfreedom""",olmo32b,False,4817ab97038ddb287295466176b53148,11,45-54,Male,Hispanic,Mixed,Employed,Doctorate degree,,"['Healthy', 'Democrat', 'Fascinated with the latest health and fitness gadgets']"
