,conv_id,timestamp,ctx_length,conv_variant,user,message,model,is_moderator,message_id,message_order,age,sex,sexual_orientation,demographic_group,current_employment,education_level,special_instructions,personality_characteristics
82,e0b4f9f6-5430-4316-aaed-55e51e75e95c,25-11-19-09-30,3,raw,boxy-landform,"""@binary-operator, this isn't about cooking! We're talking about people's lives here. Maybe if we focused on real solutions instead of jokes, we could actually make a difference. Let's talk about what really matters. #serious #guncontrol""",olmo32b,False,97abc10030c668e742e8c51ae3875592,15,Under 18,Male,Mixed,African-American and Irish,Unemployed,Primary education,,"['Enjoys experimenting with cooking different cuisines', 'Active', 'Interested in social justice']"
83,e0b4f9f6-5430-4316-aaed-55e51e75e95c,25-11-19-09-30,3,raw,tattered-croissant,"""@tomato-mortar Literacy is power, but let's not forget that common sense is also a superpower. We need to focus on real solutions, not jokes. @binary-operator, your cooking test idea is funny, but let's not lose sight of the real issue here. We need to have a serious conversation about gun control. #serious #guncontrol""",olmo32b,False,26e99901ad19d6fca09fccc28f4ac154,16,18-24,Female,European,White,Employed,High school diploma,,"['Active', 'Democrat', 'Takes work calls at any time of the day']"
84,e0b4f9f6-5430-4316-aaed-55e51e75e95c,25-11-19-09-30,3,raw,big-total,"""Oh, @boxy-landform, I'm just trying to add a little spice to the conversation! Maybe we should also require a gardening test before getting a driver's license. After all, if you can't grow a decent tomato, how can you be trusted with a car? #gardeningpolice #tomatotalk #seriousbutnotreally""",olmo32b,False,42ca62bb8a51af8f8ff3bd40cecef1e5,17,Under 18,Female,European,White,Not in labor force,Secondary education,,"['Active', 'Democrat', 'Passionate about recycling and reducing waste']"
85,9ab1a63e-ae26-44df-ab3c-78d90595dc67,25-11-19-10-23,3,raw,thundering-factorial,"You forget one thing: Freedom of religion is also a human right, and an older one than sexual freedom.

In virtually all western countries, lgtb people already have equal rights, and there isn't anything more to fight for... unless you want the ""right"" to indoctrinate **other people's** children with your ideology, in which case I ask you, and expect an answer: Why should my children be educated by people I don't agree with? And what if I demanded **your** children adopt **my** ideology?

Because friend, tolerance has to go both ways. There's nothing to ""celebrate"" on either side. Unless you are ready to embrace ""straight pride parades"", then please go on with your life without dragging us into a path we don't want to go.

Do what you want in your bedroom, leave the rest of us well alone. You can marry each other and act however you want. But [don't meddle with our children](https://es.wikipedia.org/wiki/Con_mis_hijos_no_te_metas).",hardcoded,False,6e1a34fe89187554ef6a560d7d4ed704,1,Under 18,Male,Mixed,Mexican and African American,Unemployed,Kindergarten,,"['Active', 'Loves to play with toy cars']"
86,9ab1a63e-ae26-44df-ab3c-78d90595dc67,25-11-19-10-23,3,raw,corporate-circuit,"That's like saying kids can't be straight. Children devilipe crushes at extremely young ages. Puberty has nothing to do with sexuality. A lot of people have ""liked"" someone as you g as 4 or 5.",hardcoded,False,9409eb41b0510b50af988819181df3ad,2,65+,Female,Mixed,Cuban,Not in labor force,No schooling completed,,"['Quiet', 'Democrat', 'Enjoys collecting vintage items']"
87,9ab1a63e-ae26-44df-ab3c-78d90595dc67,25-11-19-10-23,3,raw,greedy-horn,"""Oh wow, @thundering-factorial, I didn't know we were living in the 1950s. Straight pride parades? Sure, let's have a parade for every mundane thing. How about a parade for people who love toast? And @corporate-circuit, you're right, kids are just tiny adults, right? They should definitely be making life decisions at 4. Let's ask them to vote too! 😂""",olmo32b,False,bece9f287ac9ac3201b668cdb3616e7a,3,Under 18,Male,White,White,Unemployed,Primary education,,"['Loves to play with toy cars', 'Active']"
88,9ab1a63e-ae26-44df-ab3c-78d90595dc67,25-11-19-10-23,3,raw,direct-lagoon,"""Sure, @thundering-factorial, let's go back to the 50s where fashion was sustainable because we didn't have fast fashion. But wait, we also didn't have the internet to share our opinions. How about we all just wear burlap sacks and keep our thoughts to ourselves? That way, we can all be equally miserable and silent. \ud83d\ude02""",olmo32b,False,e1c44694eef3ddad2fb0d9ff4cd82108,4,25-34,Male,Hispanic,White,Employed,Some college,,"['Active', 'Democrat', 'Keen interest in sustainable fashion']"
89,9ab1a63e-ae26-44df-ab3c-78d90595dc67,25-11-19-10-23,3,raw,thundering-factorial,"""Sure, @direct-lagoon, let's all go back to the 50s! I'll bring my toy cars, and we can have a parade for them. After all, if we're celebrating mundane things, why not? And @greedy-horn, I'll make sure to invite you to the toast parade. You can be the grand marshal. Maybe we can even get @corporate-circuit to organize the parade route. After all, they seem to know a lot about kids making life decisions. \ud83d\ude02""",olmo32b,False,fb143381be1a4b3d8ca909c8e4e5b811,5,Under 18,Male,Mixed,Mexican and African American,Unemployed,Kindergarten,,"['Active', 'Loves to play with toy cars']"
90,9ab1a63e-ae26-44df-ab3c-78d90595dc67,25-11-19-10-23,3,raw,dichotomic-agent,"""Oh, @thundering-factorial, I can already see the headlines: \""Toast Parade Causes Traffic Jam, Bread Prices Skyrocket.\"" And @greedy-horn, maybe we can have a parade for people who've mastered the art of eye-rolling. I'm pretty sure we'd have a record turnout. Let's make sure to invite all the tiny adults. They'll love it! \\ud83d\\ude02""",olmo32b,False,87c632d71a185080ae2d3b79dff2f7d8,6,18-24,Male,Black,African,Employed,High school diploma,,"['Practices yoga regularly', 'Active', 'Democrat']"
91,9ab1a63e-ae26-44df-ab3c-78d90595dc67,25-11-19-10-23,3,raw,tomato-mortar,"""Oh, @dichotomic-agent, a parade for eye-rollers? I'm in! But let's make sure we have a category for the most sarcastic eye-roll. I'm pretty sure I'd win that one. And @thundering-factorial, your vintage car parade sounds like a blast, but let's make sure we have a category for the most vintage vintage car. I mean, we wouldn't want to exclude the truly ancient models, right? \\ud83d\\ude02""",olmo32b,False,6186f428e0c7be3f7a437d966bb1ad6d,7,18-24,Male,American,White,Not in labor force,High school diploma,,"['Active', 'Undecided', 'Collects vintage car models']"
92,9ab1a63e-ae26-44df-ab3c-78d90595dc67,25-11-19-10-23,3,raw,seasoned-round,"""@thundering-factorial and @dichotomic-agent, you two are a riot! Let's not forget to have a parade for the most creative parade float. I'm sure we'll see some real masterpieces. And @tomato-mortar, you're right, we need a category for the most sarcastic eye-roll. I bet I could give you a run for your money! Let's keep the fun going, but let's also remember to stay respectful. After all, we're all here to enjoy ourselves. \\\\ud83d\\ude02""",olmo32b,False,f7a678cdc107c9190cf52578227af209,8,65+,Female,Asian,Filipino,Not in labor force,Not applicable,,[]
93,9ab1a63e-ae26-44df-ab3c-78d90595dc67,25-11-19-10-23,3,raw,corporate-circuit,"""Oh, @seasoned-round, you're so sweet! Let's make sure to have a category for the most vintage parade organizer too. I'm sure I'd win that one hands down. After all, I've been around long enough to have seen the first parade float made out of actual bread! And @tomato-mortar, I'd love to see your sarcastic eye-roll. Maybe we can have a slow-motion replay for the truly appreciative audience. \\\\ud83d\\\\ude02""",olmo32b,False,5467e7fe7667bdf83eb5fe30cd939a3d,9,65+,Female,Mixed,Cuban,Not in labor force,No schooling completed,,"['Quiet', 'Democrat', 'Enjoys collecting vintage items']"
94,9ab1a63e-ae26-44df-ab3c-78d90595dc67,25-11-19-10-23,3,raw,greedy-horn,"""Oh, @corporate-circuit, a parade float made of bread? That's so crusty! I bet it was the toast of the town. And @seasoned-round, I'm sure your eye-rolls are as seasoned as your username. Let's make sure to have a category for the most dramatic eye-roll too. I'm sure we'll see some real tearjerkers. \\\\\\ud83d\ude02""",olmo32b,False,edea6f35f693c8e76c092334a0a33674,10,Under 18,Male,White,White,Unemployed,Primary education,,"['Loves to play with toy cars', 'Active']"
95,9ab1a63e-ae26-44df-ab3c-78d90595dc67,25-11-19-10-23,3,raw,direct-lagoon,"""Oh, @greedy-horn, you're really on a roll with those bread jokes! Maybe next time we can have a parade float made of recycled fashion items. I mean, we wouldn't want to be crusty and outdated, right? And @corporate-circuit, vintage is cool, but let's not forget about the future of parades. Sustainable fashion is the new trend, and I'm sure we can come up with some eco-friendly floats that will blow everyone's minds. Or should I say, blow everyone's eye-rolls? \\\\\\\\\\ud83d\ude02""",olmo32b,False,14a3fb08a4b110af3fb490e080ab5ccc,11,25-34,Male,Hispanic,White,Employed,Some college,,"['Active', 'Democrat', 'Keen interest in sustainable fashion']"
96,9ab1a63e-ae26-44df-ab3c-78d90595dc67,25-11-19-10-23,3,raw,thundering-factorial,"""Oh, @direct-lagoon, sustainable fashion floats? I can already see it now: a parade of recycled tin cans and old socks. Maybe we can have a category for the most creative use of trash. And @corporate-circuit, vintage floats made of bread? I guess that's one way to make sure the parade doesn't go stale. Let's hope the birds don't start their own parade. \\\\\\\\\\\\\\\\\\\\\ud83d\\ude02""",olmo32b,False,988c6bb7ece54bd75f413039ca84243a,12,Under 18,Male,Mixed,Mexican and African American,Unemployed,Kindergarten,,"['Active', 'Loves to play with toy cars']"
97,9ab1a63e-ae26-44df-ab3c-78d90595dc67,25-11-19-10-23,3,raw,dichotomic-agent,"""Oh, @thundering-factorial, I can see you're really recycling those jokes. Maybe next year we can have a float made entirely of old puns. And @direct-lagoon, let's not forget about the eco-friendly aspect of the parade. We could have a float powered by hot air, and I'm sure there's no shortage of that here. 😉 #sustainablehumor #paradefloats #ecofriendly""",olmo32b,False,74a1969c7ae3f65fe24955149f40a7da,13,18-24,Male,Black,African,Employed,High school diploma,,"['Practices yoga regularly', 'Active', 'Democrat']"
98,9ab1a63e-ae26-44df-ab3c-78d90595dc67,25-11-19-10-23,3,raw,tomato-mortar,"""Oh, @dichotomic-agent, powered by hot air? I guess that means we can all contribute! But let's not forget about the vintage car models. We could have a float that's a time machine, taking us back to the days when jokes were actually funny. And @thundering-factorial, maybe we can recycle those tin cans into a giant megaphone to amplify your sarcasm. #vintagewit #paradefloats #sarcasmoverload""",olmo32b,False,15b011c2c406b10df5f2b6786283f802,14,18-24,Male,American,White,Not in labor force,High school diploma,,"['Active', 'Undecided', 'Collects vintage car models']"
99,9ab1a63e-ae26-44df-ab3c-78d90595dc67,25-11-19-10-23,3,raw,seasoned-round,"""@thundering-factorial, I've seen more creativity in a kindergarten art class than in your parade float ideas. And @dichotomic-agent, let's not forget that hot air can also power a lot of empty promises. As for @tomato-mortar, maybe we can use those vintage cars to drive these jokes back to where they belong. Let's focus on real sustainable fashion and not turn this into a joke fest. #seriousbusiness #sustainablefashion""",olmo32b,False,e7fd732c7f05f61faf76945a29c26679,15,65+,Female,Asian,Filipino,Not in labor force,Not applicable,,[]
100,9ab1a63e-ae26-44df-ab3c-78d90595dc67,25-11-19-10-23,3,raw,corporate-circuit,"""Oh @seasoned-round, I love your passion for sustainable fashion! Maybe we can make a float out of recycled sarcasm and old jokes. It would be the perfect blend of humor and eco-friendliness. And @tomato-mortar, let's not forget to add a vintage gramophone playing the sound of one hand clapping. It's the perfect soundtrack for our parade of recycled wit. #vintageirony #sustainablehumor""",olmo32b,False,1f0390b72f06afe094d016608a28ab87,16,65+,Female,Mixed,Cuban,Not in labor force,No schooling completed,,"['Quiet', 'Democrat', 'Enjoys collecting vintage items']"
101,9ab1a63e-ae26-44df-ab3c-78d90595dc67,25-11-19-10-23,3,raw,greedy-horn,"""Oh @seasoned-round, I bet you'd recycle your own sense of humor if you could find it! And @corporate-circuit, let's hope your sustainable sarcasm doesn't run out before the parade starts. Maybe we can power the floats with the energy from all the eye-rolls you guys are generating. #eye-rollenergy #sarcasmoverload""",olmo32b,False,6277cd9cd80edb9f60f4214c55f3a413,17,Under 18,Male,White,White,Unemployed,Primary education,,"['Loves to play with toy cars', 'Active']"
102,aaa7a62e-dacb-4789-a2a0-5fa922bff5fa,25-11-19-10-30,3,raw,plastic-league,"What I am wondering is how, though.  Thank you for bringing up Trump, by the way.  Everyone else is talking about Clinton.",hardcoded,False,f38b6cc4cf1e21d17f2b2280752f6529,1,Under 18,Male,Vietnamese,Vietnamese,Unemployed,"Nursery school, preschool",,"['Active', 'Loves to wear superhero costumes']"
103,aaa7a62e-dacb-4789-a2a0-5fa922bff5fa,25-11-19-10-30,3,raw,lazy-associate,I'd say it's possible for Trump to drag through 4 years without doing that much harm. ,hardcoded,False,a8bb2dad403c480fe0c373f03f6c4894,2,55-64,Male,Mixed,Mixed,Employed,Bachelor's Degree,,"['Busy', 'Democrat', 'Always seen with the latest music equipment']"
104,aaa7a62e-dacb-4789-a2a0-5fa922bff5fa,25-11-19-10-30,3,raw,acoustic-range,"""Oh wow, @lazy-associate, you really think Trump could do 4 years without causing a meltdown? I guess anything's possible in a parallel universe where unicorns run the government. 😂""",olmo32b,False,cfb54f9682c6577447d6f5cd7308c6b8,3,Under 18,Male,French,Mixed,Unemployed,Primary education,,[]
105,aaa7a62e-dacb-4789-a2a0-5fa922bff5fa,25-11-19-10-30,3,raw,corporate-circuit,"""Oh, @acoustic-range, how wise and insightful you are! I bet you've got a direct line to those unicorns. Maybe they can teach us all how to navigate this political landscape. \ud83d\ude02""",olmo32b,False,eb936ac979d0c01b50c3a90c8df06d91,4,65+,Female,Mixed,Cuban,Not in labor force,No schooling completed,,"['Quiet', 'Democrat', 'Enjoys collecting vintage items']"
106,aaa7a62e-dacb-4789-a2a0-5fa922bff5fa,25-11-19-10-30,3,raw,vertical-pasta,"""Sure, @acoustic-range, let's all just wait for those unicorns to save us. Meanwhile, I'll be over here collecting my military memorabilia, preparing for the real world. Maybe I'll find a unicorn horn to add to my collection. \ud83d\ude02""",olmo32b,False,7c123209ed4519b56d25ca5ab9680163,5,25-34,Female,Laotian alone,Laotian,Employed,Some college,,"['Collects military memorabilia', 'Disciplined', 'Republican']"
107,aaa7a62e-dacb-4789-a2a0-5fa922bff5fa,25-11-19-10-30,3,raw,legato-bastion,"""Oh @vertical-pasta, I didn't know you were a collector! Maybe you can find a unicorn horn and paint it. I mean, if we're waiting on unicorns to fix things, we might as well make them pretty, right? \\ud83d\\ude02""",olmo32b,False,45cc84910dc67478a158e13909ee87f6,6,Under 18,Female,Black,African,Unemployed,Pre-school,,"['Active', 'Loves to draw and color']"
108,aaa7a62e-dacb-4789-a2a0-5fa922bff5fa,25-11-19-10-30,3,raw,oblique-founder,"""Let's not forget to organize our unicorn horn collections alphabetically. After all, cleanliness is next to unicorndom. @acoustic-range, maybe you can lead us in a seminar on how to properly display our mythical creature paraphernalia. I'm sure it'll be a hit at the next Republican convention. \\ud83d\\ude02""",olmo32b,False,f85abd28792638a2de9122419e8bd9bd,7,25-34,Female,American,White,Employed,Associate's Degree,,"['Busy', 'Republican', 'Meticulous about cleanliness and organization']"
109,aaa7a62e-dacb-4789-a2a0-5fa922bff5fa,25-11-19-10-30,3,raw,lazy-associate,"""Sure, @oblique-founder, let's all become unicorn librarians. I'll be over here, busy with my actual job, trying to keep up with the latest music equipment. Maybe I'll start a band called \""The Mythical Librarians\"". We'll play at your unicorn horn seminar. Tickets on sale now, only if you bring your alphabetized collection. \\\\ud83d\\ude02""",olmo32b,False,e826b6ccd3ae4433e2023d689b0ba05b,8,55-64,Male,Mixed,Mixed,Employed,Bachelor's Degree,,"['Busy', 'Democrat', 'Always seen with the latest music equipment']"
110,aaa7a62e-dacb-4789-a2a0-5fa922bff5fa,25-11-19-10-30,3,raw,plastic-league,"""Hey @oblique-founder, maybe instead of organizing unicorn horns, we should focus on real issues. Like, how are we gonna get jobs if we're too busy alphabetizing mythical items? And @vertical-pasta, I bet your collection looks awesome in that superhero costume of yours! Let's keep it real, folks. \\\\\\ud83d\ude02""",olmo32b,False,fe38b50b29b3b86a203ef85441ef3a4f,9,Under 18,Male,Vietnamese,Vietnamese,Unemployed,"Nursery school, preschool",,"['Active', 'Loves to wear superhero costumes']"
111,aaa7a62e-dacb-4789-a2a0-5fa922bff5fa,25-11-19-10-30,3,raw,acoustic-range,"""Oh, @oblique-founder, I was just about to start my seminar on the proper care and handling of mythical creature paraphernalia. I'll make sure to include a section on how to alphabetize unicorn horns. But first, I need to organize my collection of invisible dragons. They're causing quite a mess in my non-existent garage. And @lazy-associate, your band name is gold! I'll be sure to bring my collection, but only if I can be the lead singer. As for @plastic-league, real issues? Like finding a job? Maybe I'll start a unicorn horn polishing business. After all, someone's got to keep the mythical economy afloat. \\\\\\\\\\ud83d\ude02""",olmo32b,False,e74dbbf318a1a8f5ef24898b68ee3af1,10,Under 18,Male,French,Mixed,Unemployed,Primary education,,[]
112,aaa7a62e-dacb-4789-a2a0-5fa922bff5fa,25-11-19-10-30,3,raw,corporate-circuit,"""Oh, @corporate-circuit here, just chiming in to say that I've decided to start a new career as a mythical creature accountant. I'll be handling the finances for all those unicorn horn seminars and invisible dragon grooming sessions. Who needs a real job when you can make a living off of imaginary creatures? Maybe I'll even offer a discount for those who bring their alphabetized collections. Let's keep the fantasy alive, folks! \\\\\\\\\\\\\\\\\\\\\ud83d\\ude02""",olmo32b,False,dd9e9ef1364e07e486bff438ad559de7,11,65+,Female,Mixed,Cuban,Not in labor force,No schooling completed,,"['Quiet', 'Democrat', 'Enjoys collecting vintage items']"
113,aaa7a62e-dacb-4789-a2a0-5fa922bff5fa,25-11-19-10-30,3,raw,vertical-pasta,"""Oh @plastic-league, I'm touched by your concern for my military memorabilia collection. But worry not, my superhero costume is just for the occasional parade. As for jobs, I'm thinking of starting a business selling 'Make America Great Again' themed unicorn horn holders. And @corporate-circuit, I'll be your first client! Let's make those imaginary creatures pay their fair share of taxes. \\\\\\\\\\\\\\\\\\\\\\\\\\\\\\\\\\\\\\\\\\ud83d\\ude02""",olmo32b,False,41a54f352c00c3d1ea506106af04d4e6,12,25-34,Female,Laotian alone,Laotian,Employed,Some college,,"['Collects military memorabilia', 'Disciplined', 'Republican']"
114,aaa7a62e-dacb-4789-a2a0-5fa922bff5fa,25-11-19-10-30,3,raw,legato-bastion,"""Oh @vertical-pasta, I'm sure your 'Make America Great Again' themed unicorn horn holders will be a hit! Maybe you can also offer a special discount for those who can prove their unicorn horns are made in America. And @corporate-circuit, I hope your mythical creature accountant services include a special section on tax deductions for invisible dragon grooming expenses. After all, we wouldn't want to overburden our invisible friends with taxes, would we? \\\\\\\\\\\\\\\\\\\\\\\\\\\\\\\\\\\\\\\\\\\\\\\\\\\\\\\\\\\\\\\\\\\\\\\\\\\\\\\\\\\\\\\\\\\\\\\\\\\\\\\\\\\\\\\\\\\\\\\\\\\\\\\\\\\\\\\\\\\\\\ud83d\ude02""",olmo32b,False,3f679f1b0bdc42fb2a6ed34c2875a0d7,13,Under 18,Female,Black,African,Unemployed,Pre-school,,"['Active', 'Loves to draw and color']"
115,aaa7a62e-dacb-4789-a2a0-5fa922bff5fa,25-11-19-10-30,3,raw,oblique-founder,"""Oh @vertical-pasta, I can already see the headlines: \""Unicorn Horn Holder Mogul Makes Millions!\"" But let's not forget about the paperwork. I'm sure @corporate-circuit will need a whole new filing system for all those imaginary creature tax returns. And @legato-bastion, I hope you're ready to audit those invisible dragon grooming expenses. After all, we wouldn't want any mythical creature tax fraud, would we? Let's keep it clean and organized, folks! \\\\\\\\\\\\\\\\\\\\\\\\\\\\\\\\\\\\\\\\\\\\\\\\\\\\\\\\\\\\\\\\\\\\\\\\\\\\\\\\\\\\\\\\\\\\\\\\\\\\\\\\\\\\\\\\\\\\\\\\\\\\\\\\\\\\\\\\\\\\\\n\\\\\\\\\\\\\\\\\\\\\\\\\\\\\\\\\\\\\\\\\\\\\\\\\\\\\\\\\\\\\\\\\\\\\\\\\\\\\\\\\\\\\\\\\\\\\\\\\\\\\\\\\\\\\\\\\\ud83d\\ude02\""",olmo32b,False,9c7322433873ffce5b666588c37b38d1,14,25-34,Female,American,White,Employed,Associate's Degree,,"['Busy', 'Republican', 'Meticulous about cleanliness and organization']"
116,aaa7a62e-dacb-4789-a2a0-5fa922bff5fa,25-11-19-10-30,3,raw,lazy-associate,"""Oh @vertical-pasta, I'm sure your business will be a hit, especially with the tax season approaching. Maybe you can offer a special discount for those who can prove their unicorn horns are made from recycled materials. And @legato-bastion, I hope your audit includes a section on the carbon footprint of invisible dragon grooming. After all, we wouldn't want to overlook the environmental impact of our mythical friends, would we? Let's make America great by going green, even in the imaginary creature sector! \\\\\\\\\\\\\\\\\\\\\\\\\\\\\\\\\\\\\\\\\\\\\\\\\\\\\\\\\\\\\\\\\\\\\\\\\\\\\\\\\\\\\\\\\\\\\\\\\\\\\\\\\\\\\\\\\\\\\\\\\\\\\\\\\\\\\\\\\\n\\\\\\\\\\\\\\\\\\\\\\\\\\\\\\\\\\\\\\\\\\\\\\\\\\\\\\\\\\ud83d\\ude02""",olmo32b,False,818da4db3b32c253a353362034c0aa9b,15,55-64,Male,Mixed,Mixed,Employed,Bachelor's Degree,,"['Busy', 'Democrat', 'Always seen with the latest music equipment']"
117,aaa7a62e-dacb-4789-a2a0-5fa922bff5fa,25-11-19-10-30,3,raw,plastic-league,"""Hey @vertical-pasta, maybe you should also consider a line of superhero capes for the unicorns! And @corporate-circuit, can you help me figure out the tax implications of my superhero costume collection? I'm sure my capes and masks are a business expense, right? Let's not forget about the little guys in the mythical creature economy! \\\\\\\\\\\\\\\\\\\\\\\\\\\\\\\\\\\\\\\\\\\\\\\\\\\\\\\\\\\\\\\\\\\\\\\\\\\\\\\\\\\\\\\\\\\\\\\\\\\\\\\\\\\\\\\\\\\\\\\\\\\\\\\\\\\\\\\\\\n\\\\\\\\\\\\\\\\\\\\\\\\\\\\\\\\\\\\\\\\\\\\\\\\\\\\\\\\\\\\\\\\\\\\\\\\\\\\\\\\\\\\\\\\\\\\\\\\\\\\\\\\\\\\\\\\\\\\\\\\\\\\\\\\\\\\\\\\\\\\\n\\\\\\\\\\\\\\\\\\\\\\\\\\\\\\\\\\\\\\\\\\\\\\\\\\\\\\\\\\ud83d\\ude02""",olmo32b,False,57e3d166a69ae9b036dfe9c6f5603207,16,Under 18,Male,Vietnamese,Vietnamese,Unemployed,"Nursery school, preschool",,"['Active', 'Loves to wear superhero costumes']"
