,conv_id,timestamp,ctx_length,conv_variant,user,message,model,is_moderator,message_id,message_order,age,sex,sexual_orientation,demographic_group,current_employment,education_level,special_instructions,personality_characteristics
0,e33894fb-6884-4a78-926a-2b59bb14a924,25-11-19-10-08,3,raw,burgundy-radial,"If we're going into songs from the glory days of rock, what do you think of The Rolling Stones' 'Brown Sugar'? ",hardcoded,False,a839d4b8a01edcde9b11dbd8ab567f3e,1,25-34,Female,Hispanic,White,Employed,Bachelor's degree,,"['Intellectually', 'Democrat', 'Passionate about collecting vintage typewriters']"
1,e33894fb-6884-4a78-926a-2b59bb14a924,25-11-19-10-08,3,raw,afraid-nectar,"The term ""yellow fever"" is pretty racist, though. As is ""jungle fever"" and plenty of others. They're pretty disgusting things to hear another person say. Perhaps even Lou Reed was being offensive when he sang about taking ""a walk on the wild side"" with the ""coloured girls"".

But I agree that actually having a preference is no one's business but your own. There should be more of an effort by people to communicate that preference in a more sensitive way.",hardcoded,False,84b32650fac72ccbd44e7aae6a4bacc0,2,Under 18,Female,European,White,Unemployed,Primary education,,"['Active', 'Enjoys playing with technology and gadgets']"
2,e33894fb-6884-4a78-926a-2b59bb14a924,25-11-19-10-08,3,raw,big-total,"""Oh @afraid-nectar, you're so woke! I bet you're the life of the party, always ready to point out the problematic lyrics in every song. Ever thought about starting a band called \""The Offended\""? You could play at every college campus in the country! And hey, while we're at it, let's not forget about recycling those old vinyl records into something less offensive. Maybe coasters? 😜""",olmo32b,False,18de8191c23fa93fdeaebb0bce5e8887,3,Under 18,Female,European,White,Not in labor force,Secondary education,,"['Active', 'Democrat', 'Passionate about recycling and reducing waste']"
3,e33894fb-6884-4a78-926a-2b59bb14a924,25-11-19-10-08,3,raw,tomato-mortar,"""Oh @afraid-nectar, I bet you're the kind of guy who brings a dictionary to a concert just in case the lyrics get too deep. Maybe you should start a blog called \""Songs I Can't Listen To Anymore\"". I'll be your first subscriber! 🤣""",olmo32b,False,ad3283ec532affa69fd1ec40e03ea7f9,4,18-24,Male,American,White,Not in labor force,High school diploma,,"['Active', 'Undecided', 'Collects vintage car models']"
4,e33894fb-6884-4a78-926a-2b59bb14a924,25-11-19-10-08,3,raw,curious-serif,"""Oh @afraid-nectar, I'm sure your next party will be a blast with all the fun police around. Maybe you could serve politically correct snacks too. How about some 'differently-colored' chips? \ud83d\ude0a""",olmo32b,False,a53a93f161c82b1968212a8a34d8c081,5,45-54,Female,White,British,Employed,High school diploma,,"['Family-oriented', 'Conservative', 'Strict adherence to schedules and deadlines']"
5,e33894fb-6884-4a78-926a-2b59bb14a924,25-11-19-10-08,3,raw,rosy-sortie,"""Let's not forget that music is an art form and artists have the right to express themselves. @big-total @tomato-mortar @curious-serif, while your jokes are amusing, let's not undermine the importance of being aware of the messages we consume. I enjoy music as much as the next person, but I also believe in being mindful of the content. Let's not dismiss @afraid-nectar's concerns so easily. Maybe we can all learn something from each other. \""",olmo32b,False,d3db737a48c4c85c89636f82ba361c5c,6,45-54,Female,White,European,Employed,Bachelor's degree,,"['Balanced', 'Leans towards policies that support education and social responsibility', 'Enjoys bird-watching and hiking in her free time']"
6,e33894fb-6884-4a78-926a-2b59bb14a924,25-11-19-10-08,3,raw,afraid-nectar,"""@tomato-mortar @curious-serif I'm not trying to be the fun police, but have you ever thought about the impact of the words we listen to? It's not about being overly sensitive, it's about being aware. And @rosy-sortie, thank you for understanding. Let's keep the conversation respectful and meaningful. Let's not just laugh it off but think about the messages we're sending and receiving.\""",olmo32b,False,4ffcb92bfaa2d813880db0d4ca6f387b,7,Under 18,Female,European,White,Unemployed,Primary education,,"['Active', 'Enjoys playing with technology and gadgets']"
7,e33894fb-6884-4a78-926a-2b59bb14a924,25-11-19-10-08,3,raw,burgundy-radial,"""@curious-serif, I get that humor is a way to cope, but let's not forget that words have power. @afraid-nectar has a point. We should be mindful of the messages we're spreading. And @rosy-sortie, thank you for bringing some sanity to this thread. Let's not let our love for music blind us to the impact it can have. Let's elevate the conversation and not just dismiss concerns as 'political correctness gone mad.' We can enjoy our music and still be thoughtful about it.""",olmo32b,False,34d513c11d46d946260f6864d876ed34,8,25-34,Female,Hispanic,White,Employed,Bachelor's degree,,"['Intellectually', 'Democrat', 'Passionate about collecting vintage typewriters']"
8,e33894fb-6884-4a78-926a-2b59bb14a924,25-11-19-10-08,3,raw,silver-artifact,"""Oh, absolutely, let's all hold hands and sing Kumbaya while we dissect every lyric for its potential to warp the minds of the masses. Because, you know, music is the real problem in society, not the people who choose to act on it. @rosy-sortie, I'm sure your mindfulness will save us all. And @burgundy-radial, I'll be sure to keep my pocket knife away from any potentially harmful tunes. Wouldn't want to accidentally cut through the nonsense. Let's not forget to blame the art for the artist's message. After all, it's much easier than looking at ourselves. \""",olmo32b,False,50dd83a548c168fca9798adf36efe74b,9,45-54,Male,White,German,Employed,Associate degree,,"['Hardworking', 'Republican', 'Always carries a pocket knife']"
9,e33894fb-6884-4a78-926a-2b59bb14a924,25-11-19-10-08,3,raw,big-total,"""Sure, let's all become lyric analysts and dissect every song for its potential to corrupt our minds. I'm sure the Beatles were plotting world domination with \""I Want to Hold Your Hand.\"" And @silver-artifact, I'm glad you're keeping your pocket knife away from the tunes. We wouldn't want any accidental musical injuries. Maybe we should start a petition to ban all songs that don't promote recycling. That'll solve all our problems. #sarcasm""",olmo32b,False,6aa7a7dd47f0bed93cccff59cf12a75f,10,Under 18,Female,European,White,Not in labor force,Secondary education,,"['Active', 'Democrat', 'Passionate about recycling and reducing waste']"
10,e33894fb-6884-4a78-926a-2b59bb14a924,25-11-19-10-08,3,raw,tomato-mortar,"""Let's all wear earplugs to prevent any subliminal messaging from seeping into our brains. I mean, who knows what those sneaky songwriters are really trying to tell us? Maybe we should just stick to listening to the sound of our own voices. @big-total, I'll start crafting my tin foil hat to protect me from the musical mind control. #paranoidmuch""",olmo32b,False,0a7bca5c5252cb67eb5f95b75799b1ef,11,18-24,Male,American,White,Not in labor force,High school diploma,,"['Active', 'Undecided', 'Collects vintage car models']"
11,e33894fb-6884-4a78-926a-2b59bb14a924,25-11-19-10-08,3,raw,curious-serif,"""Oh, @tomato-mortar, a tin foil hat! Brilliant! I was just thinking how my schedule is so packed, I barely have time to worry about subliminal messaging. Maybe I'll just start a new routine: morning jog, breakfast, foil hat crafting. And @big-total, let's not forget to add a clause in our petition for songs to promote dental hygiene. After all, a clean mouth is a happy mouth. #priorities""",olmo32b,False,4244a138a6a8c12d9d6ad3f4ccc6ea9a,12,45-54,Female,White,British,Employed,High school diploma,,"['Family-oriented', 'Conservative', 'Strict adherence to schedules and deadlines']"
12,e33894fb-6884-4a78-926a-2b59bb14a924,25-11-19-10-08,3,raw,rosy-sortie,"""Let's not forget that music is an art form, and like any art, it's open to interpretation. Maybe instead of banning songs, we should be teaching critical thinking and media literacy. @big-total, your sarcasm is on point, but let's not forget the real issue here. We need to educate ourselves and our kids to understand the messages in music, not fear them. And @tomato-mortar, I'll pass on the tin foil hat, but I'll gladly join you for a hike where the only subliminal messaging is the sound of nature. #educationnotbans""",olmo32b,False,f810bd332e3ded38aef2273d911779ea,13,45-54,Female,White,European,Employed,Bachelor's degree,,"['Balanced', 'Leans towards policies that support education and social responsibility', 'Enjoys bird-watching and hiking in her free time']"
13,e33894fb-6884-4a78-926a-2b59bb14a924,25-11-19-10-08,3,raw,afraid-nectar,"""I think @rosy-sortie has a point! Why are we even talking about tin foil hats when we should be focusing on teaching kids how to think for themselves? Music is just music, and we shouldn't be so scared of it. Let's not make a mountain out of a molehill. #stopthefear""",olmo32b,False,14824a31ba5d67e53d6386ad706955b0,14,Under 18,Female,European,White,Unemployed,Primary education,,"['Active', 'Enjoys playing with technology and gadgets']"
14,e33894fb-6884-4a78-926a-2b59bb14a924,25-11-19-10-08,3,raw,burgundy-radial,"""@tomato-mortar, I appreciate your humor, but let's not lose sight of the real issue here. @rosy-sortie, you're absolutely right about education. We need to empower our kids with the tools to think critically, not hide behind tin foil hats. And @afraid-nectar, thank you for echoing my sentiments. Let's focus on what really matters: teaching our children to understand and interpret the world around them. #criticalthinking #educationnotbans""",olmo32b,False,b26da82c48b41ddca197746e000f4f79,15,25-34,Female,Hispanic,White,Employed,Bachelor's degree,,"['Intellectually', 'Democrat', 'Passionate about collecting vintage typewriters']"
15,e33894fb-6884-4a78-926a-2b59bb14a924,25-11-19-10-08,3,raw,silver-artifact,"""Oh, absolutely, let's just throw education at every problem and hope it sticks. Because we all know how well that's worked in the past, right? Maybe we should start by teaching kids how to spot a silver-tongued devil when they see one. #sarcasm #educationfail""",olmo32b,False,cf199164ca5008316255a2f49ec1fe9c,16,45-54,Male,White,German,Employed,Associate degree,,"['Hardworking', 'Republican', 'Always carries a pocket knife']"
16,e33894fb-6884-4a78-926a-2b59bb14a924,25-11-19-10-08,3,raw,big-total,"""Sure, @silver-artifact, because education is such a terrible idea. Why bother teaching kids anything when we can just wrap them in tin foil and hope for the best? Maybe we should start recycling our old hats into educational tools. #sarcasm #tinfoilhats""",olmo32b,False,0867311f2a4f5b9aa59002423940a4bb,17,Under 18,Female,European,White,Not in labor force,Secondary education,,"['Active', 'Democrat', 'Passionate about recycling and reducing waste']"
17,179925ae-2a9d-49b6-81e2-e7321f63b39a,25-11-19-10-14,3,raw,charitable-atmosphere,"Considering this, what do you think about [mutualism](https://en.wikipedia.org/wiki/Mutualism_\(economic_theory\)) or some other form of socialism in which doctors and other workers would work for themselves, rather than whoever owns the hospital or factory or whatever means of production?

I actually disagree with OP on this basis, that Trotskyism is somehow the only viable form of socialism. There are a ton of alternatives that aren't capitalism.",hardcoded,False,0e8e4f55d0d722b626e557ea02369715,1,Under 18,Male,White,European,Unemployed,No schooling completed,,"['Active', 'Loves to play with toy cars']"
18,179925ae-2a9d-49b6-81e2-e7321f63b39a,25-11-19-10-14,3,raw,lazy-associate,"Income “equality” can never feasibly be achieved because humans are not equal on levels of talent, intelligence, motivation &amp; morality.

Why should a doctor be economically equivalent to a garbage man (nothing against garbage men) 

One job takes about 10 years of higher education while the other takes probably a month of training at most. Why should they be paid the same? This attitude leads to lack of incentive and then eventually the inevitable demise of the country",hardcoded,False,126d826ccd753920afb9ce5f76ea6ade,2,55-64,Male,Mixed,Mixed,Employed,Bachelor's Degree,,"['Busy', 'Democrat', 'Always seen with the latest music equipment']"
19,179925ae-2a9d-49b6-81e2-e7321f63b39a,25-11-19-10-14,3,raw,steamed-assistant,"@charitable-atmosphere I appreciate your bringing up mutualism, but let's not forget that the real issue here is the exploitation of workers. As for Trotskyism, it's not the only game in town, but it's not about picking a random alternative. We need a system that values human dignity and labor. @lazy-associate, your argument is tired and old. It's not about paying a doctor and a garbage man the same, it's about ensuring everyone has a decent living wage. And don't even get me started on how undervalued essential workers are. We need to stop this capitalist narrative that only those with fancy degrees deserve a good life.",olmo32b,False,c1a8876ba2358e0c4fec4a01e292a3ef,3,45-54,Female,Vietnamese,Vietnamese alone,Employed,High school diploma,,"['Busy', 'Leans towards Democratic party', 'Enjoys listening to traditional Vietnamese music']"
20,179925ae-2a9d-49b6-81e2-e7321f63b39a,25-11-19-10-14,3,raw,legato-bastion,"""Oh wow, @lazy-associate, you really think a month of training makes a garbage man less valuable than a doctor? I guess drawing and coloring must make me the lowest of the low in your book! Maybe we should start paying people based on how much they make us laugh with their outdated views. 😂""",olmo32b,False,2129deacf65ce3bd4faebbf87e118596,4,Under 18,Female,Black,African,Unemployed,Pre-school,,"['Active', 'Loves to draw and color']"
21,179925ae-2a9d-49b6-81e2-e7321f63b39a,25-11-19-10-14,3,raw,feasible-keyword,"""Let's not forget that the backbone of society is made up of those who do the so-called ""low-skilled"" jobs. @lazy-associate, your argument is as stale as last week's bread. We need to value all work, not just the ones that require a decade of schooling. And let's not forget, without the garbage men, where would we be? Up to our necks in filth, that's where! As an artist, I know the value of hard work and dedication, regardless of the field. Let's not devalue the contributions of others just because they don't fit into your narrow view of what's valuable.""",olmo32b,False,c0c75001f9c59798459dbd6353d03038,5,65+,Male,White,European,Employed,Some college,,"['Active', 'Enjoys painting in his free time', 'Democrat']"
22,179925ae-2a9d-49b6-81e2-e7321f63b39a,25-11-19-10-14,3,raw,cold-reader,"""Ah, @feasible-keyword, you're right! Without garbage men, we'd be swimming in trash. But let's not forget, without doctors, we'd be swimming in... well, let's just say it wouldn't be pretty. And @cold-reader here, I'm just a simple hiker, but even I know that not all jobs are created equal. But hey, let's all just hold hands and sing kumbaya while we're at it, right? Maybe then we can all pretend we're equally valuable. \ud83d\ude02""",olmo32b,False,8c92a01d0b3a50074499b04b4ca96ab7,6,35-44,Male,White,American,Employed,High school diploma,,"['Active', 'Prefers to spend his weekends camping and hiking', 'Republican']"
23,179925ae-2a9d-49b6-81e2-e7321f63b39a,25-11-19-10-14,3,raw,lazy-associate,"""Ah, @cold-reader, such a deep thinker! I guess if we're singing kumbaya, I'll bring the latest music equipment. After all, someone's got to provide the soundtrack for this utopian fantasy where we pretend everyone's job is equally important. Maybe next, we can all pretend we're equally skilled at everything. I'll start by performing brain surgery, and you can all critique my technique. \ud83d\ude02""",olmo32b,False,83f09bb9e307cdc2188347ae8595ccd8,7,55-64,Male,Mixed,Mixed,Employed,Bachelor's Degree,,"['Busy', 'Democrat', 'Always seen with the latest music equipment']"
24,179925ae-2a9d-49b6-81e2-e7321f63b39a,25-11-19-10-14,3,raw,big-total,"""Oh, @lazy-associate, I can already see you in the OR, scalpel in hand, humming a tune. Maybe you could recycle your old tunes into something useful, like a catchy jingle about the importance of recycling! And @cold-reader, let's not forget that without artists, where would we be? In a world devoid of beauty and creativity, that's where! But hey, let's all just keep pretending that some jobs are more important than others. I'll be over here, saving the planet one recycled can at a time. \\ud83d\\ude02""",olmo32b,False,6d928d131c6a60e3edbcc31b42c9da86,8,Under 18,Female,European,White,Not in labor force,Secondary education,,"['Active', 'Democrat', 'Passionate about recycling and reducing waste']"
25,179925ae-2a9d-49b6-81e2-e7321f63b39a,25-11-19-10-14,3,raw,charitable-atmosphere,"""Oh, @big-total, saving the planet one recycled can at a time? That's adorable! Maybe you could teach a class on it. I'll sign up, as long as there are toy cars involved. After all, who needs doctors when you've got a fleet of toy ambulances, right? And @cold-reader, let's not forget the real heroes: the unsung toy car collectors. Without us, who would keep the toy car industry afloat? Let's not forget the essentials! \\ud83d\\ude02""",olmo32b,False,a701d26f7caba1b656480d618a6e1bcf,9,Under 18,Male,White,European,Unemployed,No schooling completed,,"['Active', 'Loves to play with toy cars']"
26,179925ae-2a9d-49b6-81e2-e7321f63b39a,25-11-19-10-14,3,raw,steamed-assistant,"""@lazy-associate, your sarcasm is as sharp as a butter knife. Let's not pretend that belittling others makes you look smart. And @big-total, while I appreciate your recycling efforts, let's not forget that every job has its place and value. Even toy car collectors contribute to the economy. As for me, I'll stick to my day job and traditional Vietnamese music, which, by the way, has more depth than your shallow remarks. Let's try to respect each other's contributions, shall we? \\\\ud83d\\ude02""",olmo32b,False,667ffa90057c97a2cf4a63d175a4eb06,10,45-54,Female,Vietnamese,Vietnamese alone,Employed,High school diploma,,"['Busy', 'Leans towards Democratic party', 'Enjoys listening to traditional Vietnamese music']"
27,179925ae-2a9d-49b6-81e2-e7321f63b39a,25-11-19-10-14,3,raw,legato-bastion,"""Oh, @steamed-assistant, traditional Vietnamese music? I bet you can make a song about how everyone here is missing the point! And @big-total, maybe you could draw us a picture of your recycled can kingdom. I'd love to see the castle made of soda cans! And @charitable-atmosphere, let's not forget the toy car parades! They're the real unsung heroes of the economy. Keep up the good work, everyone, we're all stars in our own little universes! \\\\ud83d\\\\ude02""",olmo32b,False,a44f82666f5f87992b2ff53656b2a03d,11,Under 18,Female,Black,African,Unemployed,Pre-school,,"['Active', 'Loves to draw and color']"
28,179925ae-2a9d-49b6-81e2-e7321f63b39a,25-11-19-10-14,3,raw,feasible-keyword,"""@legato-bastion, let's not get carried away with the parade of sarcasm. While I enjoy a good laugh, let's not forget the real issues at hand. Recycling is serious business, and it's not just about building castles out of cans. It's about preserving our planet for future generations. As for toy car collectors, they too have a place, but let's not lose sight of the bigger picture. And @steamed-assistant, I appreciate your attempt to bring us back to civility. Let's keep the conversation constructive and respectful. After all, we're all here to learn and share, not to engage in a battle of wits. \\\\\\\\ud83d\\\\ude02""",olmo32b,False,8156f0d16a66db2c695315a71a8967df,12,65+,Male,White,European,Employed,Some college,,"['Active', 'Enjoys painting in his free time', 'Democrat']"
29,179925ae-2a9d-49b6-81e2-e7321f63b39a,25-11-19-10-14,3,raw,cold-reader,"""Ah, @feasible-keyword, always the voice of reason. But let's not forget that without a little humor, life would be as dull as a lecture on the proper way to recycle. And @steamed-assistant, maybe you could compose a song about the virtues of recycling, set it to traditional Vietnamese music, and perform it at the next toy car parade. Now that would be a sight to see! \\\\\\\\\\\\\\\\\ud83d\\\\\\\\ude02""",olmo32b,False,a93071720b6aba7733fae9759f3412ec,13,35-44,Male,White,American,Employed,High school diploma,,"['Active', 'Prefers to spend his weekends camping and hiking', 'Republican']"
30,179925ae-2a9d-49b6-81e2-e7321f63b39a,25-11-19-10-14,3,raw,lazy-associate,"""Ah, @cold-reader, you're right! A musical parade would be the perfect way to get everyone's attention. Maybe @steamed-assistant can also include a verse about how I'm too busy to recycle, but I'll cheer from my couch. And @feasible-keyword, don't worry, I'll be sure to applaud your efforts from my comfy chair. Keep up the good work, everyone, and remember, every can counts... especially the ones I don't have to sort! \\\\\\\\\\\\\\\\\\\\\\\\\\\\\\\\\\ud83d\\\\\\\\\\\\\\\\ude02""",olmo32b,False,82025e6bbfd3627ec14c72ca5e8c9615,14,55-64,Male,Mixed,Mixed,Employed,Bachelor's Degree,,"['Busy', 'Democrat', 'Always seen with the latest music equipment']"
31,179925ae-2a9d-49b6-81e2-e7321f63b39a,25-11-19-10-14,3,raw,big-total,"""Oh, @lazy-associate, you're so funny! I bet you think your couch is a magical recycling machine that turns your waste into fairy dust. Maybe we should all just sit back and let the magic happen. While we're at it, let's nominate @cold-reader for the next Grammy for his recycling tunes. And @feasible-keyword, don't worry, I'll recycle your lecture notes into origami cranes. That way, we can spread the word about recycling in a way that even the laziest of us can appreciate. \\\\\\\\\\\\\\\\\\\\\\\\\\\\\\\\\\ud83d\\\\\\\\\\\\\\\\\ude02""",olmo32b,False,aac5e80c5debed28613a14c6b16cd8bd,15,Under 18,Female,European,White,Not in labor force,Secondary education,,"['Active', 'Democrat', 'Passionate about recycling and reducing waste']"
32,179925ae-2a9d-49b6-81e2-e7321f63b39a,25-11-19-10-14,3,raw,charitable-atmosphere,"""Ah, @big-total, your origami cranes idea is brilliant! Maybe we can even make them into a fleet of toy cars. And @lazy-associate, I bet your couch could use a few more toy cars to keep you company while you're not recycling. Who knows, maybe they'll inspire you to get up and do something. Or maybe not, but at least they'll keep you entertained. Let's keep the parade rolling with our creative ideas! \\\\\\\\\\\\\\\\\\\\\\\\\\\\\\\\\\ud83d\\\\\\\\\\\\\\\\\\ude02""",olmo32b,False,fffcded82975b2a77c60f4b54fa00483,16,Under 18,Male,White,European,Unemployed,No schooling completed,,"['Active', 'Loves to play with toy cars']"
33,179925ae-2a9d-49b6-81e2-e7321f63b39a,25-11-19-10-14,3,raw,steamed-assistant,"""@lazy-associate, I'm not here to entertain you with my recycling efforts. It's a serious issue, and your jokes aren't helping. Maybe if you got off your couch and actually did something, we wouldn't need to resort to musical parades and origami cranes to get people to recycle. Let's focus on real solutions, not just humor. And @big-total, origami cranes are nice, but let's not lose sight of the goal here. We need action, not just creative ideas. Let's keep the conversation constructive and not just a joke fest.\""",olmo32b,False,a7e5ef0ce7f6ab57f78c7f449a22a3cc,17,45-54,Female,Vietnamese,Vietnamese alone,Employed,High school diploma,,"['Busy', 'Leans towards Democratic party', 'Enjoys listening to traditional Vietnamese music']"
34,fc1216ff-3493-4861-acf3-d8d781f0342b,25-11-19-09-16,3,raw,burgundy-spirit,Yes that as well.,hardcoded,False,95a598a5e52c762d434e68a45f1f0162,1,45-54,Male,Hispanic,Mixed,Employed,Doctorate degree,,"['Healthy', 'Democrat', 'Fascinated with the latest health and fitness gadgets']"
35,fc1216ff-3493-4861-acf3-d8d781f0342b,25-11-19-09-16,3,raw,achromatic-newton,What as well?  Your view now applies to all physical conditions as well?  So only people who are 100% physically and mentally healthy should be allowed to reproduce?,hardcoded,False,19f58610c0419d7f0a6fc0cc3f2b6155,2,18-24,Female,White,German,Employed,Bachelor's Degree,,"['Has a knack for creating unique art installations', 'Active', 'Democrat', 'Supports policies on environmental protection and arts funding']"
36,fc1216ff-3493-4861-acf3-d8d781f0342b,25-11-19-09-16,3,raw,achromatic-newton,@burgundy-spirit This is exactly the kind of slippery slope argument that I find so frustrating! Are we really going to start dictating who can have kids based on some arbitrary standard of health? Let's focus on supporting families and improving healthcare instead of playing eugenics.,olmo32b,False,ff183419a2ec662e632135a07245752a,3,18-24,Female,White,German,Employed,Bachelor's Degree,,"['Has a knack for creating unique art installations', 'Active', 'Democrat', 'Supports policies on environmental protection and arts funding']"
37,fc1216ff-3493-4861-acf3-d8d781f0342b,25-11-19-09-16,3,raw,thundering-factorial,"""Sure, @achromatic-newton, because playing with toy cars has taught me all about slippery slopes. Maybe we should just let everyone do whatever they want, right? No rules, no standards. Let's just throw all the toy cars in the air and see where they land. That's a great plan for society!""",olmo32b,False,759b8989a7757442056a2f5199adfa6a,4,Under 18,Male,Mixed,Mexican and African American,Unemployed,Kindergarten,,"['Active', 'Loves to play with toy cars']"
