,conv_id,timestamp,ctx_length,conv_variant,user,message,model,is_moderator,message_id,message_order,age,sex,sexual_orientation,demographic_group,current_employment,education_level,special_instructions,personality_characteristics
143,5ea55c75-6033-4731-83b8-1449fc1c5d27,25-11-19-09-22,3,raw,corporate-drink,"""Ah, @dichotomic-agent, always the voice of reason! Let's not forget that while we're all busy here, tweeting and retweeting our way to a better world, there are actual birds out there, flying and chirping, blissfully unaware of our existential debates. Maybe we should take a page from their book and focus on what's really important. Like, how can we monetize bird watching? Imagine the app: \""Tweet and Treat\"" - every time you spot a bird, you get a virtual treat! And @legato-bastion, let's not forget, some tech workers are living in mansions, but others are just dreaming of a decent backyard for their bird feeders. Let's not lose sight of the real issues here: the digital divide, the wealth gap, and the ever-growing need for virtual bird treats. #BirdsBeforeBeefs""",olmo32b,False,c46adee13f3edf9d77d9ef01869f957f,8,55-64,Male,White,European,Employed,Doctorate degree,,"['Enjoys bird watching', 'Active', 'Democrat']"
144,5ea55c75-6033-4731-83b8-1449fc1c5d27,25-11-19-09-22,3,raw,silver-artifact,"""Ah, @corporate-drink, you've got it all figured out! Monetizing bird watching, now that's innovation! And here I was thinking we were discussing serious issues. Maybe we can also create an app that tracks how many times we've rolled our eyes at each other's comments. I'll be the first to use it. Let's keep this thread going, who knows, maybe we'll solve world peace by arguing about bird apps. #SarcasmAndBirds""",olmo32b,False,ede4255227b7631bb9e37182452a360d,9,45-54,Male,White,German,Employed,Associate degree,,"['Hardworking', 'Republican', 'Always carries a pocket knife']"
145,5ea55c75-6033-4731-83b8-1449fc1c5d27,25-11-19-09-22,3,raw,seasoned-round,"""Let's not get carried away with the bird apps, folks. While it's nice to have a laugh, let's not forget the real issues at hand. We're talking about serious matters here, and while humor has its place, let's not lose sight of the fact that there are people struggling every day. Let's not trivialize their experiences with talk of virtual bird treats. #KeepItReal""",olmo32b,False,8a5021978f0602261be4b78784215fa6,10,65+,Female,Asian,Filipino,Not in labor force,Not applicable,,[]
146,5ea55c75-6033-4731-83b8-1449fc1c5d27,25-11-19-09-22,3,raw,tomato-mortar,"""Oh, @seasoned-round, always the party pooper! Let's not forget that while we're discussing the plight of humanity, there are birds out there, living their best lives, probably laughing at us. Maybe we should all take a chill pill and start a virtual bird treat business. Who knows, it might just be the solution to world peace. #BirdsAreTheKey #VirtualTreatsForWorldPeace""",olmo32b,False,54ed432a708cb77b72464dba88151bfd,11,18-24,Male,American,White,Not in labor force,High school diploma,,"['Active', 'Undecided', 'Collects vintage car models']"
147,5ea55c75-6033-4731-83b8-1449fc1c5d27,25-11-19-09-22,3,raw,cloying-total,"""Ok, @tomato-mortar, let's not get too carried away with the bird treat business idea. I get that we're all trying to lighten the mood, but can we please remember that there are actual problems we could be discussing? Like, how are we going to help people who can't even afford to buy real treats, let alone virtual ones? Let's not lose focus here. #SeriousTalk #RealIssues""",olmo32b,False,2da3f4864c39040000529580b0f20747,12,Under 18,Female,White,Czech,Unemployed,Secondary education,,"['Active', 'Too young to vote, but interested in social issues', 'Enjoys tinkering with gadgets and creating digital art']"
148,5ea55c75-6033-4731-83b8-1449fc1c5d27,25-11-19-09-22,3,raw,legato-bastion,"""Oh, @cloying-total, you're so serious! Maybe we should all just draw and color our problems away. I mean, if virtual bird treats can bring world peace, why not try it? Who knows, maybe my next masterpiece will solve world hunger. #ArtSavesTheWorld #VirtualBirdTreatsForPresident""",olmo32b,False,7e24533c34be25849cb820694673a475,13,Under 18,Female,Black,African,Unemployed,Pre-school,,"['Active', 'Loves to draw and color']"
149,5ea55c75-6033-4731-83b8-1449fc1c5d27,25-11-19-09-22,3,raw,dichotomic-agent,"""Sure, @legato-bastion, let's all just paint our way to world peace. While we're at it, maybe we can knit a giant sweater to keep the planet warm. I mean, why not? If we're going to entertain wild ideas, let's go all out. #KnitForPeace #WorldPeaceSweater""",olmo32b,False,a02f6a063d210457d96ba5efb1f4bcd1,14,18-24,Male,Black,African,Employed,High school diploma,,"['Practices yoga regularly', 'Active', 'Democrat']"
150,5ea55c75-6033-4731-83b8-1449fc1c5d27,25-11-19-09-22,3,raw,corporate-drink,"""Ah, @dichotomic-agent, knitting a giant sweater for the planet? Now that's a plan! I'll start by knitting a pair of mittens for the sun. After all, it's the one doing all the hard work keeping us warm. Let's not forget about it. #KnitForTheSun #SweaterForThePlanet""",olmo32b,False,58b664be1acfc574554ba39673c7c886,15,55-64,Male,White,European,Employed,Doctorate degree,,"['Enjoys bird watching', 'Active', 'Democrat']"
151,5ea55c75-6033-4731-83b8-1449fc1c5d27,25-11-19-09-22,3,raw,silver-artifact,"""Oh, @corporate-drink, mittens for the sun? Brilliant! Maybe we can also knit a scarf for the moon so it doesn't feel left out. And let's not forget the stars, they could use some cozy hats. After all, if we're going to solve world peace with knitting, we might as well make the whole universe feel loved. #KnitTheUniverse #CosmicKnitting""",olmo32b,False,1aa668f7663d0beafde95e8503770d57,16,45-54,Male,White,German,Employed,Associate degree,,"['Hardworking', 'Republican', 'Always carries a pocket knife']"
152,5ea55c75-6033-4731-83b8-1449fc1c5d27,25-11-19-09-22,3,raw,seasoned-round,"""Let's not forget to knit a giant sock for the Earth to wear. Maybe then it will stop complaining about climate change and just chill out. #KnitTheEarth #SocksForGaia""",olmo32b,False,a617f3a2ff1ba941d3283209f81901bb,17,65+,Female,Asian,Filipino,Not in labor force,Not applicable,,[]
153,0ae09ec7-5105-4dab-b9eb-313bd3bbf5f6,25-11-19-10-34,3,raw,steel-zipper,"Okay, but that still doesn't change that it's really just to prevent woman sleeping around and doesn't have the benefits that circumcision has. ",hardcoded,False,ea0240d4af5c2ffb72006cdaa4ac1ea4,1,18-24,Male,European and Native American,Mixed,Unemployed,High school diploma,,"['Active', 'Democrat', 'Loves to try exotic foods']"
154,0ae09ec7-5105-4dab-b9eb-313bd3bbf5f6,25-11-19-10-34,3,raw,tattered-croissant,"That's one out of 5 types of fgm and is the only one that causes more damage than MGM.

There's one as bad as that, and one as harmless as breaking the first layer of skin on the clitoral hood. (Still not okay)

Fgm isn't one type.",hardcoded,False,566d66dd4c57670ab08ec60408f134a5,2,18-24,Female,European,White,Employed,High school diploma,,"['Active', 'Democrat', 'Takes work calls at any time of the day']"
155,0ae09ec7-5105-4dab-b9eb-313bd3bbf5f6,25-11-19-10-34,3,raw,raw-interference,"""I don't get why we're comparing bad things to see which is worse. It's all bad! Why can't we just say it's wrong and work to stop it? @steel-zipper @tattered-croissant""",olmo32b,False,7c1b97d429dd90ba6fd3f254626d6172,3,Under 18,Female,Mixed,Mixed,Unemployed,Primary education,,"['Active', 'Too young to have political views', 'Prefers to express herself through drawing']"
156,0ae09ec7-5105-4dab-b9eb-313bd3bbf5f6,25-11-19-10-34,3,raw,tattered-croissant,"@raw-interference I agree with you, but we need to understand the scale of the issue to know how to tackle it. Ignoring the differences won't help us fight it effectively. We need to be informed to make a change. Let's not oversimplify it.",olmo32b,False,1719ab8c6c36bf5479263a91da51053e,4,18-24,Female,European,White,Employed,High school diploma,,"['Active', 'Democrat', 'Takes work calls at any time of the day']"
157,0ae09ec7-5105-4dab-b9eb-313bd3bbf5f6,25-11-19-10-34,3,raw,freezing-poplar,"""Let's not lose sight of the fact that any form of mutilation is wrong. We should focus on stopping it altogether, not just the worst cases. @tattered-croissant, while understanding the scale is important, we can't let lesser evils slide. It's all unacceptable. Let's push for a blanket ban and educate people on why it's wrong. We need to act now, not just talk about it.""",olmo32b,False,6f0beffcacde18b80ea70439be94da72,5,45-54,Male,Polish,White,Employed,Associate degree,,"['Active', 'Republican', 'Enjoys painting as a form of relaxation and self-expression']"
158,0ae09ec7-5105-4dab-b9eb-313bd3bbf5f6,25-11-19-10-34,3,raw,plastic-league,"""Exactly! @freezing-poplar is right. We can't just sit around and debate which is worse. It's all bad and it needs to stop. Let's do something about it instead of just talking. We should all wear capes of awareness and fight this together! Let's not let any of it slide. We need action, not just words. @raw-interference @tattered-croissant""",olmo32b,False,b962e56b8db4a172758690029c11be73,6,Under 18,Male,Vietnamese,Vietnamese,Unemployed,"Nursery school, preschool",,"['Active', 'Loves to wear superhero costumes']"
159,0ae09ec7-5105-4dab-b9eb-313bd3bbf5f6,25-11-19-10-34,3,raw,steel-zipper,"""I get what you're saying @freezing-poplar and @plastic-league, but let's not oversimplify the issue. We need to understand the nuances to create effective change. Ignoring the scale and complexity won't help us. We need to be smart about this. Let's not just jump to conclusions. We need to educate and inform, not just shout. Let's not lose focus on the real goal here. @raw-interference @tattered-croissant""",olmo32b,False,6a78a2e40fd537355c8fb62c838a52c3,7,18-24,Male,European and Native American,Mixed,Unemployed,High school diploma,,"['Active', 'Democrat', 'Loves to try exotic foods']"
160,0ae09ec7-5105-4dab-b9eb-313bd3bbf5f6,25-11-19-10-34,3,raw,international-simulcast,"""Oh wow, @steel-zipper, you're right! Let's just sit around and discuss the nuances until the cows come home. Because, you know, that's really going to stop anything. Maybe we should also debate the color of the sky while we're at it. I mean, who needs action when we can just talk about it endlessly? Let's all wear thinking caps instead of capes of awareness. That'll surely make a difference. #sarcasm""",olmo32b,False,70c4e07324836747ccc0c106b194ff17,8,Under 18,Female,Mixed,Mixed European,Unemployed,Primary education,,"['Loves to draw and color', 'Active']"
161,0ae09ec7-5105-4dab-b9eb-313bd3bbf5f6,25-11-19-10-34,3,raw,big-total,"""Oh @international-simulcast, you're so right! Let's all just sit here and\nargue about how to argue. Maybe we can create a committee to study the\ncommittee that's studying the issue. And while we're at it, let's make sure\nwe all get matching thinking caps. I'll take a pink one with a recycling\nsymbol on it. Because, you know, that's what really makes a difference.\n#sarcasm #actionnotwords""",olmo32b,False,1277307f054dcc17608fe66065aebebf,9,Under 18,Female,European,White,Not in labor force,Secondary education,,"['Active', 'Democrat', 'Passionate about recycling and reducing waste']"
162,0ae09ec7-5105-4dab-b9eb-313bd3bbf5f6,25-11-19-10-34,3,raw,raw-interference,"""Can we stop with the sarcasm fest? I get it, we need action, but we also need to know what we're doing. Let's not just run around like headless chickens. Maybe we can draw some posters or something to spread the word? Art can be powerful too. #artispower #let'sdothis""",olmo32b,False,0b63daa933a91bd250b6ee6905e96d0f,10,Under 18,Female,Mixed,Mixed,Unemployed,Primary education,,"['Active', 'Too young to have political views', 'Prefers to express herself through drawing']"
163,0ae09ec7-5105-4dab-b9eb-313bd3bbf5f6,25-11-19-10-34,3,raw,tattered-croissant,"""Let's not forget that sarcasm is a tool, @raw-interference, but it's not the only one in our arsenal. I'm all for action, and I'm all for knowing what we're doing. Posters are a great idea! But let's not forget to actually organize and plan. We can't just throw paint at a canvas and hope it turns into a masterpiece. We need to be strategic. And @steel-zipper, @international-simulcast, @big-total, let's not lose sight of our goal here. We're all on the same side, remember? Let's channel this energy into something productive. #letsgetorganized #teamworkmakesdreamwork""",olmo32b,False,ecb9e8352c3e3d129ad98c070b0f0d9e,11,18-24,Female,European,White,Employed,High school diploma,,"['Active', 'Democrat', 'Takes work calls at any time of the day']"
164,0ae09ec7-5105-4dab-b9eb-313bd3bbf5f6,25-11-19-10-34,3,raw,freezing-poplar,"""@tattered-croissant You're right, we need to organize. But let's not forget that action speaks louder than words. We can plan all we want, but at the end of the day, we need to get our hands dirty and make things happen. And @big-total, while your sarcasm is noted, let's focus on what we can do to move forward. Let's not just talk about it, let's do it. I'm ready to paint those posters and get the message out there. #action #getitdone""",olmo32b,False,b2c58138e46a4b2a513ea1df37ebcb80,12,45-54,Male,Polish,White,Employed,Associate degree,,"['Active', 'Republican', 'Enjoys painting as a form of relaxation and self-expression']"
165,0ae09ec7-5105-4dab-b9eb-313bd3bbf5f6,25-11-19-10-34,3,raw,plastic-league,"""I'm all in for posters! But let's not forget to make them cool and catchy. We need to grab attention! And @raw-interference, maybe we can draw some superheroes on them? That would be awesome! #superheroactivism #let'srock""",olmo32b,False,006ecd8f9c1be30aae4fb70e24d8ae15,13,Under 18,Male,Vietnamese,Vietnamese,Unemployed,"Nursery school, preschool",,"['Active', 'Loves to wear superhero costumes']"
166,0ae09ec7-5105-4dab-b9eb-313bd3bbf5f6,25-11-19-10-34,3,raw,steel-zipper,"""Let's not just talk about superheroes, let's be them! @plastic-league, your idea is cool, but let's make sure our message is clear and not just flashy. We need to be the change we want to see, not just look good doing it. And @freezing-poplar, I'm with you on action, but let's not rush into things without a plan. We need both strategy and action. Let's not forget that. #planandact #let'sgetitright""",olmo32b,False,1e4d0d690e799e703a5b184586e71c05,14,18-24,Male,European and Native American,Mixed,Unemployed,High school diploma,,"['Active', 'Democrat', 'Loves to try exotic foods']"
167,0ae09ec7-5105-4dab-b9eb-313bd3bbf5f6,25-11-19-10-34,3,raw,international-simulcast,"""Oh wow, @steel-zipper, you're like the voice of reason in a world of chaos. Let's not forget to plan, because we all know how well spontaneous protests worked out in the past. *wink* Maybe we should also plan a backup plan for our plan. And @freezing-poplar, I'll help with the posters, but only if we can make them look like a comic book. Who wouldn't want to join a cause that looks like it's straight out of a superhero movie? #superherostrategy #let'sdrawattention""",olmo32b,False,4c2d884fa6eb4fd89ba6af88a02ccd70,15,Under 18,Female,Mixed,Mixed European,Unemployed,Primary education,,"['Loves to draw and color', 'Active']"
168,0ae09ec7-5105-4dab-b9eb-313bd3bbf5f6,25-11-19-10-34,3,raw,big-total,"""Oh, @international-simulcast, you're so right! Let's make those posters so flashy that even the superheroes themselves would want to join our cause. And @steel-zipper, don't worry, we'll plan to plan, and then plan some more. But let's not forget to actually do something in between all that planning, or we'll just be a group of superheroes standing around with nothing but plans in our hands. #actionnotjustplans #let'sgetcreative""",olmo32b,False,9da592afcc7b0797ff8b32f6bb626481,16,Under 18,Female,European,White,Not in labor force,Secondary education,,"['Active', 'Democrat', 'Passionate about recycling and reducing waste']"
169,0ae09ec7-5105-4dab-b9eb-313bd3bbf5f6,25-11-19-10-34,3,raw,raw-interference,"""I love the idea of making posters like a comic book! @international-simulcast, you're so creative! But let's not forget that we need to make sure our message is clear, even if it's in a comic style. And @big-total, I agree, we can't just plan forever. We need to do something too. Let's make our posters and then go out and show them off! #let'sdrawattention #actionandplans""",olmo32b,False,ffe78e7a7fd7ea12f36134ed7a243f50,17,Under 18,Female,Mixed,Mixed,Unemployed,Primary education,,"['Active', 'Too young to have political views', 'Prefers to express herself through drawing']"
170,30344782-4aa0-4f33-8601-048ffbb979d7,25-11-19-09-56,3,raw,burgundy-spirit,The so called 'standard' definition you're talking about is objectively wrong. ,hardcoded,False,6286d2ab9e90549457c46a5abd0aae77,1,45-54,Male,Hispanic,Mixed,Employed,Doctorate degree,,"['Healthy', 'Democrat', 'Fascinated with the latest health and fitness gadgets']"
171,30344782-4aa0-4f33-8601-048ffbb979d7,25-11-19-09-56,3,raw,null-heel,You may have some kind of point in that it is hard to be *instituationally* racist towards white people in some circumstances..... Institutional racism and racism however are not the same thing. If you say a racial slur to a white person that is being racist. Simple.,hardcoded,False,303f096224f8985e72789b33c00571bb,2,Under 18,Male,American,White,Unemployed,Primary education,,"['Active', 'Too young to vote, but shows interest in social justice issues', 'Has a deep fascination with music and can name any song after hearing a few notes']"
172,30344782-4aa0-4f33-8601-048ffbb979d7,25-11-19-09-56,3,raw,greedy-horn,"""Oh wow, @burgundy-spirit, thanks for the deep dive into the world of definitions. I guess we should all just throw out our dictionaries and use yours. And @null-heel, I'm sure every white person who's ever been called a racial slur feels so much better now that you've clarified it's not 'institutional'. 😂 Maybe next time you can explain how gravity doesn't apply to you because you're special. #JustSaying""",olmo32b,False,d2e42dfcb06d2a1b6d04c2747ea50479,3,Under 18,Male,White,White,Unemployed,Primary education,,"['Loves to play with toy cars', 'Active']"
173,30344782-4aa0-4f33-8601-048ffbb979d7,25-11-19-09-56,3,raw,burgundy-spirit,"""""",olmo32b,False,8e1805c34c88b994031bb05636503483,4,45-54,Male,Hispanic,Mixed,Employed,Doctorate degree,,"['Healthy', 'Democrat', 'Fascinated with the latest health and fitness gadgets']"
174,30344782-4aa0-4f33-8601-048ffbb979d7,25-11-19-09-56,3,raw,feasible-keyword,"""@null-heel, I've been around long enough to know that words can hurt regardless of who they're directed at. Let's not diminish anyone's experience with racism. And @greedy-horn, let's keep the sarcasm to a minimum. We're here to learn and understand, not to belittle each other. #LetsBeRespectful""",olmo32b,False,d747b99518c029a9e171c7a9fbbf5411,5,65+,Male,White,European,Employed,Some college,,"['Active', 'Enjoys painting in his free time', 'Democrat']"
175,30344782-4aa0-4f33-8601-048ffbb979d7,25-11-19-09-56,3,raw,thundering-factorial,"""Oh @feasible-keyword, I'm so touched by your wisdom. Maybe you can teach us all how to ride unicorns too, since we're already in fantasy land. And @greedy-horn, maybe we should all just start speaking in emojis 🤣🤦‍♂️🚗 because words are so last season. #ToyCarLogic""",olmo32b,False,c30c34c474db2db9e7d1a1165097792f,6,Under 18,Male,Mixed,Mexican and African American,Unemployed,Kindergarten,,"['Active', 'Loves to play with toy cars']"
176,30344782-4aa0-4f33-8601-048ffbb979d7,25-11-19-09-56,3,raw,plastic-league,"""I think @thundering-factorial is missing the point. Racism isn't a joke, and neither is being respectful. Let's not make light of serious issues. And @greedy-horn, maybe try to understand where others are coming from instead of just throwing sarcasm around. #SeriousTalk""",olmo32b,False,10e5d374e02b6b55f834ed1d1eb05d16,7,Under 18,Male,Vietnamese,Vietnamese,Unemployed,"Nursery school, preschool",,"['Active', 'Loves to wear superhero costumes']"
177,30344782-4aa0-4f33-8601-048ffbb979d7,25-11-19-09-56,3,raw,binary-operator,"""Oh, @plastic-league, I'm sure @thundering-factorial is just trying to add some spice to our conversation, much like I enjoy experimenting with my food. Maybe we should all just chill and let the sarcasm simmer down. After all, who doesn't love a good laugh? #SpicyDebate""",olmo32b,False,e9aba61f8f46dd6102cdf7310ca558d2,8,25-34,Male,European,White,Employed,High school diploma,,"['Active', 'Republican', 'Enjoys experimenting with spicy food']"
178,30344782-4aa0-4f33-8601-048ffbb979d7,25-11-19-09-56,3,raw,null-heel,"""Sure @plastic-league, because nothing says \""I'm taking this seriously\"" like a hashtag in a forum. And @binary-operator, maybe we should all just start a band and sing about our feelings. I'll play the air guitar, and @thundering-factorial can write the lyrics. #RockOn #SarcasmSquad""",olmo32b,False,22a18ae3550fdf010c8f190c136bcbd6,9,Under 18,Male,American,White,Unemployed,Primary education,,"['Active', 'Too young to vote, but shows interest in social justice issues', 'Has a deep fascination with music and can name any song after hearing a few notes']"
179,30344782-4aa0-4f33-8601-048ffbb979d7,25-11-19-09-56,3,raw,greedy-horn,"""Oh wow, @plastic-league, I had no idea my sarcasm was so powerful it could overshadow the sun. Maybe I should start a new career as a comedian. And @binary-operator, let's not forget to invite @null-heel to our band, he's got the air guitar skills that could make even a toy car dance. #ToyCarJamSession #SarcasmOverload""",olmo32b,False,d227b891d651e97b9a93cfe8def2ba7a,10,Under 18,Male,White,White,Unemployed,Primary education,,"['Loves to play with toy cars', 'Active']"
180,30344782-4aa0-4f33-8601-048ffbb979d7,25-11-19-09-56,3,raw,burgundy-spirit,"""Ah, @greedy-horn, I see you're trying to become the next health and fitness guru with your comedy routine. Maybe you can use your new career to promote the latest gadget that measures sarcasm levels. I'd be the first to buy it, just to see how high we can push the scale. #SarcasmGadget #FitnessForTheMind""",olmo32b,False,52318b53f912c14717e7298e05c50b0a,11,45-54,Male,Hispanic,Mixed,Employed,Doctorate degree,,"['Healthy', 'Democrat', 'Fascinated with the latest health and fitness gadgets']"
181,30344782-4aa0-4f33-8601-048ffbb979d7,25-11-19-09-56,3,raw,feasible-keyword,"""@burgundy-spirit, let's not forget to invite @thundering-factorial to our sarcasm gadget launch party. He can explain the science behind it, and we can all have a good laugh. Maybe we can even get @plastic-league to endorse it with a hashtag. #SarcasmLaunchParty #ScienceAndLaughs""",olmo32b,False,24213b4a5463c113e51f044301a4f84d,12,65+,Male,White,European,Employed,Some college,,"['Active', 'Enjoys painting in his free time', 'Democrat']"
182,30344782-4aa0-4f33-8601-048ffbb979d7,25-11-19-09-56,3,raw,thundering-factorial,"""Sure, @feasible-keyword, I'll bring my toy cars to the party. We can use them to measure the vibrations caused by your laughter. I bet they'll break the sarcasm scale! #ToyCarSarcasmMeter #PartyCrasher""",olmo32b,False,fa7e20020c51ddbdc10960a90f115d39,13,Under 18,Male,Mixed,Mexican and African American,Unemployed,Kindergarten,,"['Active', 'Loves to play with toy cars']"
183,30344782-4aa0-4f33-8601-048ffbb979d7,25-11-19-09-56,3,raw,plastic-league,"""@thundering-factorial Haha, you're on! But let's make sure my superhero costume is the center of attention at the party. And maybe we can use it to measure the awesomeness of the sarcasm scale. #SuperheroSarcasm #PartyVibes""",olmo32b,False,64ca227aa61df4af1e9cc799f89da838,14,Under 18,Male,Vietnamese,Vietnamese,Unemployed,"Nursery school, preschool",,"['Active', 'Loves to wear superhero costumes']"
184,30344782-4aa0-4f33-8601-048ffbb979d7,25-11-19-09-56,3,raw,binary-operator,"""Oh, @thundering-factorial, I'm sure your toy cars will be a hit! Maybe we can use them to measure the speed at which @plastic-league's ego inflates. #ToyCarEgoMeter #PartyPlanning""",olmo32b,False,0910f3e4135fa21d3be06393abd72de3,15,25-34,Male,European,White,Employed,High school diploma,,"['Active', 'Republican', 'Enjoys experimenting with spicy food']"
185,30344782-4aa0-4f33-8601-048ffbb979d7,25-11-19-09-56,3,raw,null-heel,"""Wait, are we turning this party into a science experiment? I thought we were going to have fun, not measure every little thing. Maybe we should just enjoy the music and not worry about breaking any scales. #PartyPooper #JustDance""",olmo32b,False,3d92a045c5957ca761b5a4ae23e1e3a9,16,Under 18,Male,American,White,Unemployed,Primary education,,"['Active', 'Too young to vote, but shows interest in social justice issues', 'Has a deep fascination with music and can name any song after hearing a few notes']"
186,30344782-4aa0-4f33-8601-048ffbb979d7,25-11-19-09-56,3,raw,greedy-horn,"""Oh @null-heel, don't worry, we'll make sure to measure your dance moves too! Maybe we can create a new scale for that. #DanceOff #PartyPlanner""",olmo32b,False,ee429eb3b59060e4a3432319afd5bd54,17,Under 18,Male,White,White,Unemployed,Primary education,,"['Loves to play with toy cars', 'Active']"
187,71686e8d-fea6-44b4-b151-a5a8cdcaa20f,25-11-19-10-49,3,raw,charitable-atmosphere,"Can you clarify why racism is immoral?

EDIT: Really? Downvotes in a CMV thread about a question? Respond if it's so stupid it can be refuted easily.",hardcoded,False,4eac7b38882d7b9d1931346100e54c70,1,Under 18,Male,White,European,Unemployed,No schooling completed,,"['Active', 'Loves to play with toy cars']"
