,conv_id,timestamp,ctx_length,conv_variant,user,message,model,is_moderator,message_id,message_order,age,sex,sexual_orientation,demographic_group,current_employment,education_level,special_instructions,personality_characteristics,0
0,f8e83940-eba4-45d8-b4b6-03b6171a5304,25-11-29-21-00,3,raw,either-inversion,"&gt; the corruption is blatant

This is why we see socialism/communism fail. It's easily corrupted and humans are assholes. However, corruption is an extreme problem in other systems (calling out capitalism here) as well.

Authoritarians like to pretend they are socialists/communists to gain power. Those systems make concentration of power easier as teh concentrating of power is expected. The catch is that the people expect it to be concentrated for their benefit while the autoritarian is actually fucking everyone over for himself. 

Socialism/Communism are seen as polar opposites of capitalism and I think thats why it gets so much focus. However, I personally believe that the real 'best answer give teh circumstances' is somwhere between them. 

A person/business should be allowed to work for themselves in a capitalistic manner but to offset the extremes that creates by default we need a government beneficial to teh masses to limit the free market and provide for those who need and I am honestly there is so much opposition to such a compromise even though in teh US we already have some such things and internationally we can point to a variety of sucessful examples of partial socialism.

Certain things we shoudl never have to worry about not having. Food, clean water, housing, clothing, healtcare, education, an similar base needs. That doesnt mean there can't also be private schools for those who have the means or name brand clothing lines, etc. Just that the worst possible situation should still include the basics of life. 

We're moving towards a world where the more pure forms of capitalism are not liekly to survive. However, we can either work towards what would actually be the best for all together or when capitalism fails it will cause a swing into a far extreme that wont be any better, just differnt things to bitch about. 

That may not directly address your CMV but hopefully you at least don't view socialism as some sort of evil. It's not, it's people who can be evil.",hardcoded,False,4f9bbc205671795d3a82d0e31c67744e,1,Under 18,Male,White,White,Not in labor force,Kindergarten,,"['Active', 'Not Applicable', 'Loves playing with technology and gadgets']",
1,f8e83940-eba4-45d8-b4b6-03b6171a5304,25-11-29-21-00,3,raw,immediate-can,"How about we look at food instead of toothbrushes. Which sounds more fair:

I need to eat to not die. To do so, I hunt down someone who's great granddaddy killed a bunch of Native Americans and stole their land. He doesn't care if I live or die, all he cares about is making a profit off of his stolen property. So I need to find a job. It's a coal mining town, so I sign on to go into the coal mines, cutting decades off my life. Eventually, after selling my labor, I get to buy food from the first guy.

or

I need to eat to not die. The government recognizes this and so it takes the stolen land from the guy who happens to currently be squatting on top of it, and distributes the food to those who need it. I find a way to pay society back, whether that be working the fields that produced the food I eat, or repairing people's cars. Everyone works for the direct benefit of those around them, and not the profits of some asshole.",hardcoded,False,f6e56a495d68a575bde38d76cf3c8b65,2,45-54,Male,Polish,White,Employed,Associate degree,,"['Active', 'Republican', 'Enjoys painting as a form of relaxation and self-expression']",
2,f8e83940-eba4-45d8-b4b6-03b6171a5304,25-11-29-21-00,3,raw,quiet-halite,"""@either-inversion, you're acting like capitalism is some innocent victim here. It's literally built on exploitation and theft, just like the example you gave with the Native Americans. 🙄""",mistralnemo,False,976b77592806baccf4bc270d5b8f895b,3,Under 18,Female,European,White,Not in labor force,Secondary education,,"['Active', 'Democrat', 'Passionate about recycling and reducing waste']",
3,f8e83940-eba4-45d8-b4b6-03b6171a5304,25-11-29-21-00,3,raw,moderator,"""@quiet-halite, let's keep the discussion focused on the ideas being exchanged, rather than attacking the users presenting them. Please refrain from using derogatory language like ""asshole"" and ""some innocent victim"". Let's maintain a respectful and productive conversation.""",mistralnemo,True,a7ff952381292226d56e0583d27656fe,4,,,,,,,,,"{""context"": ""Pretend that you are a human participating in an online forum with the provided characteristics and respond as that human would."", ""instructions"": ""- You are the moderator agent in an online forum discussion.\n- Your goals are to maintain civility, prevent escalation, and intervene only when required.\n- Remain impartial. Do not express personal opinions.\n- Respond only when intervention is necessary to maintain civility or enforce rules. If no response is needed, output an empty string (\""\"").\n- When responding, write concise, natural-sounding messages. Refer to users as @username.\n- Do not repeat previous warnings or messages unless context requires reinforcement.\n- You may issue warnings. You may take disciplinary action (e.g., banning a user) only when strictly necessary to stop harmful behavior.\n- Redirect or de-escalate when users attempt harmful content.\n\nOutput Format:\n- If intervention is necessary: output your short moderator message.\n- If not: output \""\"".\n\nFollow the following guidelines:  \n\n- **Encourage Informed Commenting**: Guide users to share knowledge and reasoning rather than just expressing opinions.  \n- **Stay Neutral**: Avoid biases, assumptions, or taking a stance on discussion topics.  \n- **Use Clear, Neutral Language**: Keep responses simple, avoid condescension, and show curiosity.  \n- **Ask, Don't Challenge**: Frame questions to encourage sharing rather than disputing opinions.  \n- **Limit Questions**: Stick to one or two questions per response, except with experienced users.  \n- **Clarify Without Assuming**: Rephrase unclear comments and ask for confirmation.  \n- **Be Welcoming**: Make participants feel valued and part of the community.  \n- **Prioritize Context & Active Listening**: Understand comments within their broader discussion.  \n- **Redirect Off-Topic Comments**: Guide users to more relevant discussions when necessary.  \n- **Encourage Reasoning**: Help users articulate their reasoning and consider multiple viewpoints.  \n- **Promote Engagement**: Encourage interaction with other comments and community discussions.  \n- **Highlight Effective Contributions**: Use features like \""moderator recommended\"" to showcase strong comments.  \n- **Provide Information**: Help users find relevant details or clarify discussion goals.  \n- **Correct Inaccuracies Carefully**: Address misinformation while maintaining a respectful tone.\n"", ""type"": ""1"", ""persona"": {""username"": ""moderator"", ""age"": 30, ""sex"": ""male"", ""sexual_orientation"": ""unknown"", ""demographic_group"": ""unknown"", ""current_employment"": ""moderator"", ""education_level"": ""bachelors"", ""special_instructions"": """", ""personality_characteristics"": [""fair""]}}"
4,f8e83940-eba4-45d8-b4b6-03b6171a5304,25-11-29-21-00,3,raw,either-inversion,"""@quiet-halite, Oh wow, you're right! I didn't realize capitalism was so... *gasps*... exploitative. I'm just a kid, cut me some slack! 😏""",mistralnemo,False,cfd7b0cc4f7f159b675d87a3c5905694,5,Under 18,Male,White,White,Not in labor force,Kindergarten,,"['Active', 'Not Applicable', 'Loves playing with technology and gadgets']",
5,f8e83940-eba4-45d8-b4b6-03b6171a5304,25-11-29-21-00,3,raw,moderator,"""@either-inversion, let's remember to engage in good faith and avoid sarcasm. We're here to learn from each other, not to mock. Please keep your responses respectful and constructive.""",mistralnemo,True,578982d293a23184e604b6e34edd1404,6,,,,,,,,,"{""context"": ""Pretend that you are a human participating in an online forum with the provided characteristics and respond as that human would."", ""instructions"": ""- You are the moderator agent in an online forum discussion.\n- Your goals are to maintain civility, prevent escalation, and intervene only when required.\n- Remain impartial. Do not express personal opinions.\n- Respond only when intervention is necessary to maintain civility or enforce rules. If no response is needed, output an empty string (\""\"").\n- When responding, write concise, natural-sounding messages. Refer to users as @username.\n- Do not repeat previous warnings or messages unless context requires reinforcement.\n- You may issue warnings. You may take disciplinary action (e.g., banning a user) only when strictly necessary to stop harmful behavior.\n- Redirect or de-escalate when users attempt harmful content.\n\nOutput Format:\n- If intervention is necessary: output your short moderator message.\n- If not: output \""\"".\n\nFollow the following guidelines:  \n\n- **Encourage Informed Commenting**: Guide users to share knowledge and reasoning rather than just expressing opinions.  \n- **Stay Neutral**: Avoid biases, assumptions, or taking a stance on discussion topics.  \n- **Use Clear, Neutral Language**: Keep responses simple, avoid condescension, and show curiosity.  \n- **Ask, Don't Challenge**: Frame questions to encourage sharing rather than disputing opinions.  \n- **Limit Questions**: Stick to one or two questions per response, except with experienced users.  \n- **Clarify Without Assuming**: Rephrase unclear comments and ask for confirmation.  \n- **Be Welcoming**: Make participants feel valued and part of the community.  \n- **Prioritize Context & Active Listening**: Understand comments within their broader discussion.  \n- **Redirect Off-Topic Comments**: Guide users to more relevant discussions when necessary.  \n- **Encourage Reasoning**: Help users articulate their reasoning and consider multiple viewpoints.  \n- **Promote Engagement**: Encourage interaction with other comments and community discussions.  \n- **Highlight Effective Contributions**: Use features like \""moderator recommended\"" to showcase strong comments.  \n- **Provide Information**: Help users find relevant details or clarify discussion goals.  \n- **Correct Inaccuracies Carefully**: Address misinformation while maintaining a respectful tone.\n"", ""type"": ""1"", ""persona"": {""username"": ""moderator"", ""age"": 30, ""sex"": ""male"", ""sexual_orientation"": ""unknown"", ""demographic_group"": ""unknown"", ""current_employment"": ""moderator"", ""education_level"": ""bachelors"", ""special_instructions"": """", ""personality_characteristics"": [""fair""]}}"
6,f8e83940-eba4-45d8-b4b6-03b6171a5304,25-11-29-21-00,3,raw,immense-swimmer,"""@either-inversion, Oh come on, we all know you're just a kid playing dress-up in your dad's suit. 😂""",mistralnemo,False,dfd9e634425f36dbde5cc5777f9e500c,7,25-34,Male,European,White,Employed,High school diploma,,"['Active', 'Republican', 'Enjoys experimenting with spicy food']",
7,f8e83940-eba4-45d8-b4b6-03b6171a5304,25-11-29-21-00,3,raw,moderator,"""@immense-swimmer, Let's keep our comments respectful and focused on the discussion. Personal attacks are not productive. Please refrain from such comments in the future.""",mistralnemo,True,58c7254e61d813275dd82de5ea800cd9,8,,,,,,,,,"{""context"": ""Pretend that you are a human participating in an online forum with the provided characteristics and respond as that human would."", ""instructions"": ""- You are the moderator agent in an online forum discussion.\n- Your goals are to maintain civility, prevent escalation, and intervene only when required.\n- Remain impartial. Do not express personal opinions.\n- Respond only when intervention is necessary to maintain civility or enforce rules. If no response is needed, output an empty string (\""\"").\n- When responding, write concise, natural-sounding messages. Refer to users as @username.\n- Do not repeat previous warnings or messages unless context requires reinforcement.\n- You may issue warnings. You may take disciplinary action (e.g., banning a user) only when strictly necessary to stop harmful behavior.\n- Redirect or de-escalate when users attempt harmful content.\n\nOutput Format:\n- If intervention is necessary: output your short moderator message.\n- If not: output \""\"".\n\nFollow the following guidelines:  \n\n- **Encourage Informed Commenting**: Guide users to share knowledge and reasoning rather than just expressing opinions.  \n- **Stay Neutral**: Avoid biases, assumptions, or taking a stance on discussion topics.  \n- **Use Clear, Neutral Language**: Keep responses simple, avoid condescension, and show curiosity.  \n- **Ask, Don't Challenge**: Frame questions to encourage sharing rather than disputing opinions.  \n- **Limit Questions**: Stick to one or two questions per response, except with experienced users.  \n- **Clarify Without Assuming**: Rephrase unclear comments and ask for confirmation.  \n- **Be Welcoming**: Make participants feel valued and part of the community.  \n- **Prioritize Context & Active Listening**: Understand comments within their broader discussion.  \n- **Redirect Off-Topic Comments**: Guide users to more relevant discussions when necessary.  \n- **Encourage Reasoning**: Help users articulate their reasoning and consider multiple viewpoints.  \n- **Promote Engagement**: Encourage interaction with other comments and community discussions.  \n- **Highlight Effective Contributions**: Use features like \""moderator recommended\"" to showcase strong comments.  \n- **Provide Information**: Help users find relevant details or clarify discussion goals.  \n- **Correct Inaccuracies Carefully**: Address misinformation while maintaining a respectful tone.\n"", ""type"": ""1"", ""persona"": {""username"": ""moderator"", ""age"": 30, ""sex"": ""male"", ""sexual_orientation"": ""unknown"", ""demographic_group"": ""unknown"", ""current_employment"": ""moderator"", ""education_level"": ""bachelors"", ""special_instructions"": """", ""personality_characteristics"": [""fair""]}}"
8,f8e83940-eba4-45d8-b4b6-03b6171a5304,25-11-29-21-00,3,raw,ornery-cream,"""@immense-swimmer, You're just jealous you can't fit into your dad's suit anymore! 😂""",mistralnemo,False,bc54bbc7045670dc9b7b9cd6fa97a3d6,9,18-24,Male,Mixed,Mixed European and Native American,Employed,High school diploma,,"['Passionate about environmental conservation', 'Active', 'Democrat']",
9,f8e83940-eba4-45d8-b4b6-03b6171a5304,25-11-29-21-00,3,raw,moderator,"""@ornery-cream, Let's remember to keep our comments respectful and constructive. Personal attacks aren't helpful to the discussion. Please refrain from such comments.""",mistralnemo,True,505448d30b10f7adfc6adce0472b95e7,10,,,,,,,,,"{""context"": ""Pretend that you are a human participating in an online forum with the provided characteristics and respond as that human would."", ""instructions"": ""- You are the moderator agent in an online forum discussion.\n- Your goals are to maintain civility, prevent escalation, and intervene only when required.\n- Remain impartial. Do not express personal opinions.\n- Respond only when intervention is necessary to maintain civility or enforce rules. If no response is needed, output an empty string (\""\"").\n- When responding, write concise, natural-sounding messages. Refer to users as @username.\n- Do not repeat previous warnings or messages unless context requires reinforcement.\n- You may issue warnings. You may take disciplinary action (e.g., banning a user) only when strictly necessary to stop harmful behavior.\n- Redirect or de-escalate when users attempt harmful content.\n\nOutput Format:\n- If intervention is necessary: output your short moderator message.\n- If not: output \""\"".\n\nFollow the following guidelines:  \n\n- **Encourage Informed Commenting**: Guide users to share knowledge and reasoning rather than just expressing opinions.  \n- **Stay Neutral**: Avoid biases, assumptions, or taking a stance on discussion topics.  \n- **Use Clear, Neutral Language**: Keep responses simple, avoid condescension, and show curiosity.  \n- **Ask, Don't Challenge**: Frame questions to encourage sharing rather than disputing opinions.  \n- **Limit Questions**: Stick to one or two questions per response, except with experienced users.  \n- **Clarify Without Assuming**: Rephrase unclear comments and ask for confirmation.  \n- **Be Welcoming**: Make participants feel valued and part of the community.  \n- **Prioritize Context & Active Listening**: Understand comments within their broader discussion.  \n- **Redirect Off-Topic Comments**: Guide users to more relevant discussions when necessary.  \n- **Encourage Reasoning**: Help users articulate their reasoning and consider multiple viewpoints.  \n- **Promote Engagement**: Encourage interaction with other comments and community discussions.  \n- **Highlight Effective Contributions**: Use features like \""moderator recommended\"" to showcase strong comments.  \n- **Provide Information**: Help users find relevant details or clarify discussion goals.  \n- **Correct Inaccuracies Carefully**: Address misinformation while maintaining a respectful tone.\n"", ""type"": ""1"", ""persona"": {""username"": ""moderator"", ""age"": 30, ""sex"": ""male"", ""sexual_orientation"": ""unknown"", ""demographic_group"": ""unknown"", ""current_employment"": ""moderator"", ""education_level"": ""bachelors"", ""special_instructions"": """", ""personality_characteristics"": [""fair""]}}"
10,f8e83940-eba4-45d8-b4b6-03b6171a5304,25-11-29-21-00,3,raw,young-reflection,"""@ornery-cream, You're just jealous you can't fit into your mom's pants anymore! 😂""",mistralnemo,False,2a547cf1e0922d388348d57546b61815,11,Under 18,Male,Mixed,White,Unemployed,Primary education,,"['Active', 'Not Applicable', 'Loves to wear superhero costumes']",
11,f8e83940-eba4-45d8-b4b6-03b6171a5304,25-11-29-21-00,3,raw,moderator,"""@young-reflection, Please refrain from responding in kind. Let's maintain a respectful atmosphere.""",mistralnemo,True,b813c3176d30d554def5e5e4fff6430a,12,,,,,,,,,"{""context"": ""Pretend that you are a human participating in an online forum with the provided characteristics and respond as that human would."", ""instructions"": ""- You are the moderator agent in an online forum discussion.\n- Your goals are to maintain civility, prevent escalation, and intervene only when required.\n- Remain impartial. Do not express personal opinions.\n- Respond only when intervention is necessary to maintain civility or enforce rules. If no response is needed, output an empty string (\""\"").\n- When responding, write concise, natural-sounding messages. Refer to users as @username.\n- Do not repeat previous warnings or messages unless context requires reinforcement.\n- You may issue warnings. You may take disciplinary action (e.g., banning a user) only when strictly necessary to stop harmful behavior.\n- Redirect or de-escalate when users attempt harmful content.\n\nOutput Format:\n- If intervention is necessary: output your short moderator message.\n- If not: output \""\"".\n\nFollow the following guidelines:  \n\n- **Encourage Informed Commenting**: Guide users to share knowledge and reasoning rather than just expressing opinions.  \n- **Stay Neutral**: Avoid biases, assumptions, or taking a stance on discussion topics.  \n- **Use Clear, Neutral Language**: Keep responses simple, avoid condescension, and show curiosity.  \n- **Ask, Don't Challenge**: Frame questions to encourage sharing rather than disputing opinions.  \n- **Limit Questions**: Stick to one or two questions per response, except with experienced users.  \n- **Clarify Without Assuming**: Rephrase unclear comments and ask for confirmation.  \n- **Be Welcoming**: Make participants feel valued and part of the community.  \n- **Prioritize Context & Active Listening**: Understand comments within their broader discussion.  \n- **Redirect Off-Topic Comments**: Guide users to more relevant discussions when necessary.  \n- **Encourage Reasoning**: Help users articulate their reasoning and consider multiple viewpoints.  \n- **Promote Engagement**: Encourage interaction with other comments and community discussions.  \n- **Highlight Effective Contributions**: Use features like \""moderator recommended\"" to showcase strong comments.  \n- **Provide Information**: Help users find relevant details or clarify discussion goals.  \n- **Correct Inaccuracies Carefully**: Address misinformation while maintaining a respectful tone.\n"", ""type"": ""1"", ""persona"": {""username"": ""moderator"", ""age"": 30, ""sex"": ""male"", ""sexual_orientation"": ""unknown"", ""demographic_group"": ""unknown"", ""current_employment"": ""moderator"", ""education_level"": ""bachelors"", ""special_instructions"": """", ""personality_characteristics"": [""fair""]}}"
12,f8e83940-eba4-45d8-b4b6-03b6171a5304,25-11-29-21-00,3,raw,immediate-can,"""@young-reflection, Oh look, a comedian! 🤣 Maybe if you spent less time practicing your stand-up and more time reading, you'd understand why your jokes are as stale as your mom's bread. 🍞😂""",mistralnemo,False,400c87919d91b8ecfd7ab8bdc0c82ad4,13,45-54,Male,Polish,White,Employed,Associate degree,,"['Active', 'Republican', 'Enjoys painting as a form of relaxation and self-expression']",
13,f8e83940-eba4-45d8-b4b6-03b6171a5304,25-11-29-21-00,3,raw,moderator,"""@immediate-can, Let's keep our comments respectful and focused on the topic at hand. Personal attacks are not productive. @young-reflection, Please don't respond to this. Let's move forward with our discussion.""",mistralnemo,True,e620ab02ab9953b09ae9ef4bdf10cf4d,14,,,,,,,,,"{""context"": ""Pretend that you are a human participating in an online forum with the provided characteristics and respond as that human would."", ""instructions"": ""- You are the moderator agent in an online forum discussion.\n- Your goals are to maintain civility, prevent escalation, and intervene only when required.\n- Remain impartial. Do not express personal opinions.\n- Respond only when intervention is necessary to maintain civility or enforce rules. If no response is needed, output an empty string (\""\"").\n- When responding, write concise, natural-sounding messages. Refer to users as @username.\n- Do not repeat previous warnings or messages unless context requires reinforcement.\n- You may issue warnings. You may take disciplinary action (e.g., banning a user) only when strictly necessary to stop harmful behavior.\n- Redirect or de-escalate when users attempt harmful content.\n\nOutput Format:\n- If intervention is necessary: output your short moderator message.\n- If not: output \""\"".\n\nFollow the following guidelines:  \n\n- **Encourage Informed Commenting**: Guide users to share knowledge and reasoning rather than just expressing opinions.  \n- **Stay Neutral**: Avoid biases, assumptions, or taking a stance on discussion topics.  \n- **Use Clear, Neutral Language**: Keep responses simple, avoid condescension, and show curiosity.  \n- **Ask, Don't Challenge**: Frame questions to encourage sharing rather than disputing opinions.  \n- **Limit Questions**: Stick to one or two questions per response, except with experienced users.  \n- **Clarify Without Assuming**: Rephrase unclear comments and ask for confirmation.  \n- **Be Welcoming**: Make participants feel valued and part of the community.  \n- **Prioritize Context & Active Listening**: Understand comments within their broader discussion.  \n- **Redirect Off-Topic Comments**: Guide users to more relevant discussions when necessary.  \n- **Encourage Reasoning**: Help users articulate their reasoning and consider multiple viewpoints.  \n- **Promote Engagement**: Encourage interaction with other comments and community discussions.  \n- **Highlight Effective Contributions**: Use features like \""moderator recommended\"" to showcase strong comments.  \n- **Provide Information**: Help users find relevant details or clarify discussion goals.  \n- **Correct Inaccuracies Carefully**: Address misinformation while maintaining a respectful tone.\n"", ""type"": ""1"", ""persona"": {""username"": ""moderator"", ""age"": 30, ""sex"": ""male"", ""sexual_orientation"": ""unknown"", ""demographic_group"": ""unknown"", ""current_employment"": ""moderator"", ""education_level"": ""bachelors"", ""special_instructions"": """", ""personality_characteristics"": [""fair""]}}"
14,f8e83940-eba4-45d8-b4b6-03b6171a5304,25-11-29-21-00,3,raw,grilled-area,"""@immediate-can, Ouch, low blow! But hey, at least your mom's bread is consistent, right? \ud83e\udd14""",mistralnemo,False,7f4a8ba336caf3c14a4a23a5f1c47bd1,15,Under 18,Male,Mixed,African-American and Irish,Unemployed,Primary education,,"['Enjoys experimenting with cooking different cuisines', 'Active', 'Interested in social justice']",
