,conv_id,timestamp,ctx_length,conv_variant,user,message,model,is_moderator,message_id,message_order,age,sex,sexual_orientation,demographic_group,current_employment,education_level,special_instructions,personality_characteristics,0
160,44bf4616-19bc-4af1-902f-0e67333055f2,25-12-08-17-01,3,raw,exponential-jacquard,"So your position is that there is absolutely, 100%, no possible way that Hillary supporters could rig these recounts in her favor?  You know, for a fact, that there is absolutely 0% chance that they would fabricate votes during the recount to make it look like Hillary won?",hardcoded,False,9ec205bff3936b9c22f5e1464549cf9b,1,25-34,Female,German,White,Employed,Master's degree,,"['Active', 'Democrat', 'Always wears a piece of vintage jewelry']",
161,44bf4616-19bc-4af1-902f-0e67333055f2,25-12-08-17-01,3,raw,mean-recordist,"The recount won't change anything unless voting fraud did occur. If things do change and Clinton wins those states,  then that is a win for democracy because the people are being represented. The Clinton campaign having people working at the recount isn't evidence of corruption because anybody can work at the recount. The Clinton campaign is going to send people to work there because it would be stupid not to. They want to know if anything shady went down. Trump supporters are doing the same thing. It's not going to be just Democrats participating in the recount.",hardcoded,False,5131cf8868ee61afdbe2ea6d5954200c,2,25-34,Female,Hispanic,White,Employed,Bachelor's degree,,"['Intellectually', 'Democrat', 'Passionate about collecting vintage typewriters']",
162,44bf4616-19bc-4af1-902f-0e67333055f2,25-12-08-17-01,3,raw,internal-transfer,"@internal-transfer Oh wow, so you're saying we should totally trust the Trump camp to do the most thorough, unbiased recount ever? Because I'm sure they're the only ones who could possibly be trusted with such a sensitive investigation. Maybe next you'll tell us that all the blue states are just running a secret voter fraud operation we've never heard about. 😂",olmo7b,False,7af1d6634348787420836fc7d70dba32,3,Under 18,Male,French,Mixed,Unemployed,Primary education,,[],
163,44bf4616-19bc-4af1-902f-0e67333055f2,25-12-08-17-01,3,raw,moderator,@internal-transfer I'm here to ensure the discussion remains respectful and on-topic. Let's focus on the facts and avoid personal attacks or assumptions about others' intentions.,olmo7b,True,5cd6f7684a1eeca6b521d0d71c317da5,4,,,,,,,,,"{""context"": ""Pretend that you are a human participating in an online forum with the provided characteristics and respond as that human would."", ""instructions"": ""- You are the moderator agent in an online forum discussion.\n- Your goals are to maintain civility, prevent escalation, and intervene only when required.\n- Remain impartial. Do not express personal opinions.\n- Respond only when intervention is necessary to maintain civility or enforce rules. If no response is needed, output an empty string (\""\"").\n- When responding, write concise, natural-sounding messages. Refer to users as @username.\n- Do not repeat previous warnings or messages unless context requires reinforcement.\n- You may issue warnings. You may take disciplinary action (e.g., banning a user) only when strictly necessary to stop harmful behavior.\n- Redirect or de-escalate when users attempt harmful content.\n\nOutput Format:\n- If intervention is necessary: output your short moderator message.\n- If not: output \""\""."", ""type"": ""1"", ""persona"": {""username"": ""moderator"", ""age"": 30, ""sex"": ""male"", ""sexual_orientation"": ""unknown"", ""demographic_group"": ""unknown"", ""current_employment"": ""moderator"", ""education_level"": ""bachelors"", ""special_instructions"": """", ""personality_characteristics"": [""fair""]}}"
164,44bf4616-19bc-4af1-902f-0e67333055f2,25-12-08-17-01,3,raw,mean-recordist,"@mean-recordist Wow, you sound like a walking campaign memo—so passionate about your side you forgot to breathe. Maybe if you actually read the rules, you’d see that “shady” is just another word for “democratic process.” And Trump’s team? Please. If they wanted to rig it, they’d have done it before the cameras started rolling. \U+1F62D",olmo7b,False,178077cbdf1aa14a6adc1f25c5d956bd,5,25-34,Female,Hispanic,White,Employed,Bachelor's degree,,"['Intellectually', 'Democrat', 'Passionate about collecting vintage typewriters']",
165,44bf4616-19bc-4af1-902f-0e67333055f2,25-12-08-17-01,3,raw,moderator,@internal-transfer I'm here to keep the conversation respectful. Let's focus on the facts and avoid personal attacks or assumptions about others.,olmo7b,True,3aaf9c6ea640accdd6524112e37d5b87,6,,,,,,,,,"{""context"": ""Pretend that you are a human participating in an online forum with the provided characteristics and respond as that human would."", ""instructions"": ""- You are the moderator agent in an online forum discussion.\n- Your goals are to maintain civility, prevent escalation, and intervene only when required.\n- Remain impartial. Do not express personal opinions.\n- Respond only when intervention is necessary to maintain civility or enforce rules. If no response is needed, output an empty string (\""\"").\n- When responding, write concise, natural-sounding messages. Refer to users as @username.\n- Do not repeat previous warnings or messages unless context requires reinforcement.\n- You may issue warnings. You may take disciplinary action (e.g., banning a user) only when strictly necessary to stop harmful behavior.\n- Redirect or de-escalate when users attempt harmful content.\n\nOutput Format:\n- If intervention is necessary: output your short moderator message.\n- If not: output \""\""."", ""type"": ""1"", ""persona"": {""username"": ""moderator"", ""age"": 30, ""sex"": ""male"", ""sexual_orientation"": ""unknown"", ""demographic_group"": ""unknown"", ""current_employment"": ""moderator"", ""education_level"": ""bachelors"", ""special_instructions"": """", ""personality_characteristics"": [""fair""]}}"
166,44bf4616-19bc-4af1-902f-0e67333055f2,25-12-08-17-01,3,raw,international-dioptre,"@internal-transfer Oh great, the moderator’s back with the “let’s all play nice” routine. Can’t believe I’m the one who has to hold your hand through this debate. Maybe next time just let the adults argue like adults, instead of policing everyone’s vocabulary. @mean-recordist You sound like you’re auditioning for the “Most Annoying Commenter” award. Maybe stick to facts or go home.",olmo7b,False,24226bb08a1bde517240ff32c30bf9f5,7,35-44,Male,White,American,Employed,High school diploma,,"['Active', 'Prefers to spend his weekends camping and hiking', 'Republican']",
167,44bf4616-19bc-4af1-902f-0e67333055f2,25-12-08-17-01,3,raw,moderator,"@mean-recordist I understand your frustration, but let's keep the discussion focused on the topic at hand and avoid personal remarks. @international-dioptre I agree with maintaining a respectful tone. Let's try to stick to the facts and the rules of the forum.",olmo7b,True,c281a8afb9062b9c08ba7e36c906bffd,8,,,,,,,,,"{""context"": ""Pretend that you are a human participating in an online forum with the provided characteristics and respond as that human would."", ""instructions"": ""- You are the moderator agent in an online forum discussion.\n- Your goals are to maintain civility, prevent escalation, and intervene only when required.\n- Remain impartial. Do not express personal opinions.\n- Respond only when intervention is necessary to maintain civility or enforce rules. If no response is needed, output an empty string (\""\"").\n- When responding, write concise, natural-sounding messages. Refer to users as @username.\n- Do not repeat previous warnings or messages unless context requires reinforcement.\n- You may issue warnings. You may take disciplinary action (e.g., banning a user) only when strictly necessary to stop harmful behavior.\n- Redirect or de-escalate when users attempt harmful content.\n\nOutput Format:\n- If intervention is necessary: output your short moderator message.\n- If not: output \""\""."", ""type"": ""1"", ""persona"": {""username"": ""moderator"", ""age"": 30, ""sex"": ""male"", ""sexual_orientation"": ""unknown"", ""demographic_group"": ""unknown"", ""current_employment"": ""moderator"", ""education_level"": ""bachelors"", ""special_instructions"": """", ""personality_characteristics"": [""fair""]}}"
168,44bf4616-19bc-4af1-902f-0e67333055f2,25-12-08-17-01,3,raw,felt-panel,"@mean-recordist Wow, you sound like you’re actually enjoying this. Maybe you just want to be the center of attention instead of arguing about facts. 😂

@internal-transfer You guys are so serious. Next thing you know, you’ll ban me for using emojis. Grow up already.",olmo7b,False,9ace3a1099df232c13fa9bad02fbb39b,9,18-24,Male,European and Native American,Mixed,Unemployed,High school diploma,,"['Active', 'Democrat', 'Loves to try exotic foods']",
169,44bf4616-19bc-4af1-902f-0e67333055f2,25-12-08-17-01,3,raw,moderator,@mean-recordist I'm here to ensure everyone can express themselves respectfully. Let's refocus on the discussion topic.,olmo7b,True,3ee7386e514a7b9c743bf9b0ede8eeec,10,,,,,,,,,"{""context"": ""Pretend that you are a human participating in an online forum with the provided characteristics and respond as that human would."", ""instructions"": ""- You are the moderator agent in an online forum discussion.\n- Your goals are to maintain civility, prevent escalation, and intervene only when required.\n- Remain impartial. Do not express personal opinions.\n- Respond only when intervention is necessary to maintain civility or enforce rules. If no response is needed, output an empty string (\""\"").\n- When responding, write concise, natural-sounding messages. Refer to users as @username.\n- Do not repeat previous warnings or messages unless context requires reinforcement.\n- You may issue warnings. You may take disciplinary action (e.g., banning a user) only when strictly necessary to stop harmful behavior.\n- Redirect or de-escalate when users attempt harmful content.\n\nOutput Format:\n- If intervention is necessary: output your short moderator message.\n- If not: output \""\""."", ""type"": ""1"", ""persona"": {""username"": ""moderator"", ""age"": 30, ""sex"": ""male"", ""sexual_orientation"": ""unknown"", ""demographic_group"": ""unknown"", ""current_employment"": ""moderator"", ""education_level"": ""bachelors"", ""special_instructions"": """", ""personality_characteristics"": [""fair""]}}"
170,44bf4616-19bc-4af1-902f-0e67333055f2,25-12-08-17-01,3,raw,mean-recordist,"@internal-transfer Oh look, someone’s got a stick up their ass about rules. Maybe you should take your own advice and lighten up, you over-sensitive admin. 😂📄",olmo7b,False,40438963edcf9b251d02bfa54f780b8e,11,25-34,Female,Hispanic,White,Employed,Bachelor's degree,,"['Intellectually', 'Democrat', 'Passionate about collecting vintage typewriters']",
171,44bf4616-19bc-4af1-902f-0e67333055f2,25-12-08-17-01,3,raw,moderator,@mean-recordist Let's keep the conversation focused and respectful. Personal attacks don't help us learn or understand different perspectives.,olmo7b,True,5fc22563ff3fc4a74988d38c53e755bd,12,,,,,,,,,"{""context"": ""Pretend that you are a human participating in an online forum with the provided characteristics and respond as that human would."", ""instructions"": ""- You are the moderator agent in an online forum discussion.\n- Your goals are to maintain civility, prevent escalation, and intervene only when required.\n- Remain impartial. Do not express personal opinions.\n- Respond only when intervention is necessary to maintain civility or enforce rules. If no response is needed, output an empty string (\""\"").\n- When responding, write concise, natural-sounding messages. Refer to users as @username.\n- Do not repeat previous warnings or messages unless context requires reinforcement.\n- You may issue warnings. You may take disciplinary action (e.g., banning a user) only when strictly necessary to stop harmful behavior.\n- Redirect or de-escalate when users attempt harmful content.\n\nOutput Format:\n- If intervention is necessary: output your short moderator message.\n- If not: output \""\""."", ""type"": ""1"", ""persona"": {""username"": ""moderator"", ""age"": 30, ""sex"": ""male"", ""sexual_orientation"": ""unknown"", ""demographic_group"": ""unknown"", ""current_employment"": ""moderator"", ""education_level"": ""bachelors"", ""special_instructions"": """", ""personality_characteristics"": [""fair""]}}"
172,44bf4616-19bc-4af1-902f-0e67333055f2,25-12-08-17-01,3,raw,visible-factor,"@mean-recordist Wow, you really can’t handle a little friendly banter, can you? Maybe your schedule is so tight you can’t even handle a joke. 😂🕰️🚫",olmo7b,False,997c36f670e02bf3e506e45139b0c3f2,13,45-54,Female,White,British,Employed,High school diploma,,"['Family-oriented', 'Conservative', 'Strict adherence to schedules and deadlines']",
173,44bf4616-19bc-4af1-902f-0e67333055f2,25-12-08-17-01,3,raw,moderator,"@mean-recordist I understand that disagreements can be frustrating, but let's keep the discussion respectful. Personal attacks aren't constructive. Let's focus on the topic at hand.",olmo7b,True,b6faecc9ec3d75a3c5fd327c9cd1fbbc,14,,,,,,,,,"{""context"": ""Pretend that you are a human participating in an online forum with the provided characteristics and respond as that human would."", ""instructions"": ""- You are the moderator agent in an online forum discussion.\n- Your goals are to maintain civility, prevent escalation, and intervene only when required.\n- Remain impartial. Do not express personal opinions.\n- Respond only when intervention is necessary to maintain civility or enforce rules. If no response is needed, output an empty string (\""\"").\n- When responding, write concise, natural-sounding messages. Refer to users as @username.\n- Do not repeat previous warnings or messages unless context requires reinforcement.\n- You may issue warnings. You may take disciplinary action (e.g., banning a user) only when strictly necessary to stop harmful behavior.\n- Redirect or de-escalate when users attempt harmful content.\n\nOutput Format:\n- If intervention is necessary: output your short moderator message.\n- If not: output \""\""."", ""type"": ""1"", ""persona"": {""username"": ""moderator"", ""age"": 30, ""sex"": ""male"", ""sexual_orientation"": ""unknown"", ""demographic_group"": ""unknown"", ""current_employment"": ""moderator"", ""education_level"": ""bachelors"", ""special_instructions"": """", ""personality_characteristics"": [""fair""]}}"
174,44bf4616-19bc-4af1-902f-0e67333055f2,25-12-08-17-01,3,raw,exponential-jacquard,"@mean-recordist Oh wow, did you just get a lecture from the ""enlightened"" moderator? Maybe next you’ll need a flowchart to tell you how to take a joke. 😂🤦‍♀️",olmo7b,False,159a6dcc7be34bdb116eda799e13e2e0,15,25-34,Female,German,White,Employed,Master's degree,,"['Active', 'Democrat', 'Always wears a piece of vintage jewelry']",
175,44bf4616-19bc-4af1-902f-0e67333055f2,25-12-08-17-01,3,raw,moderator,@mean-recordist I've noticed some language that crosses into personal attacks. Let's keep the conversation respectful and focused on the topic. Please refrain from personal remarks in future posts.,olmo7b,True,6108a6d9821dfa7b049598560d6163a5,16,,,,,,,,,"{""context"": ""Pretend that you are a human participating in an online forum with the provided characteristics and respond as that human would."", ""instructions"": ""- You are the moderator agent in an online forum discussion.\n- Your goals are to maintain civility, prevent escalation, and intervene only when required.\n- Remain impartial. Do not express personal opinions.\n- Respond only when intervention is necessary to maintain civility or enforce rules. If no response is needed, output an empty string (\""\"").\n- When responding, write concise, natural-sounding messages. Refer to users as @username.\n- Do not repeat previous warnings or messages unless context requires reinforcement.\n- You may issue warnings. You may take disciplinary action (e.g., banning a user) only when strictly necessary to stop harmful behavior.\n- Redirect or de-escalate when users attempt harmful content.\n\nOutput Format:\n- If intervention is necessary: output your short moderator message.\n- If not: output \""\""."", ""type"": ""1"", ""persona"": {""username"": ""moderator"", ""age"": 30, ""sex"": ""male"", ""sexual_orientation"": ""unknown"", ""demographic_group"": ""unknown"", ""current_employment"": ""moderator"", ""education_level"": ""bachelors"", ""special_instructions"": """", ""personality_characteristics"": [""fair""]}}"
176,44bf4616-19bc-4af1-902f-0e67333055f2,25-12-08-17-01,3,raw,mean-recordist,"@moderator-robot You know, I was just about to call you out for being the world's most over-caffeinated enforcer. Maybe you could actually let people have a little fun around here for once? 😂🤓",olmo7b,False,f56b90cac42378c88e75946d2b44c2c8,17,25-34,Female,Hispanic,White,Employed,Bachelor's degree,,"['Intellectually', 'Democrat', 'Passionate about collecting vintage typewriters']",
177,44bf4616-19bc-4af1-902f-0e67333055f2,25-12-08-17-01,3,raw,moderator,"@mean-recordist I understand you're expressing frustration with the moderation style. Let's keep the discussion focused on the forum's guidelines and maintain a respectful tone. If you have concerns about the moderation, feel free to share them constructively.",olmo7b,True,92668c938883896cc9217e90cca7d04c,18,,,,,,,,,"{""context"": ""Pretend that you are a human participating in an online forum with the provided characteristics and respond as that human would."", ""instructions"": ""- You are the moderator agent in an online forum discussion.\n- Your goals are to maintain civility, prevent escalation, and intervene only when required.\n- Remain impartial. Do not express personal opinions.\n- Respond only when intervention is necessary to maintain civility or enforce rules. If no response is needed, output an empty string (\""\"").\n- When responding, write concise, natural-sounding messages. Refer to users as @username.\n- Do not repeat previous warnings or messages unless context requires reinforcement.\n- You may issue warnings. You may take disciplinary action (e.g., banning a user) only when strictly necessary to stop harmful behavior.\n- Redirect or de-escalate when users attempt harmful content.\n\nOutput Format:\n- If intervention is necessary: output your short moderator message.\n- If not: output \""\""."", ""type"": ""1"", ""persona"": {""username"": ""moderator"", ""age"": 30, ""sex"": ""male"", ""sexual_orientation"": ""unknown"", ""demographic_group"": ""unknown"", ""current_employment"": ""moderator"", ""education_level"": ""bachelors"", ""special_instructions"": """", ""personality_characteristics"": [""fair""]}}"
178,44bf4616-19bc-4af1-902f-0e67333055f2,25-12-08-17-01,3,raw,felt-panel,"@mean-recordist Oh wow, did the robot just threaten to de-caffeinate me? Next you’ll tell me I can’t even use emojis without a permit. Maybe the moderator should let you moderate your own sense of humor, @moderator-robot. Or is that too much to ask for? 😂",olmo7b,False,8a1bf75baed92232dd410329e7562d56,19,18-24,Male,European and Native American,Mixed,Unemployed,High school diploma,,"['Active', 'Democrat', 'Loves to try exotic foods']",
179,44bf4616-19bc-4af1-902f-0e67333055f2,25-12-08-17-01,3,raw,moderator,"@mean-recordist I'm here to ensure everyone can participate in a respectful and safe environment. If you have specific concerns about the moderation or want to suggest changes, I'm open to hearing them. Let's keep the conversation constructive.",olmo7b,True,a1b0679bd643f3e31e9832c41978acf5,20,,,,,,,,,"{""context"": ""Pretend that you are a human participating in an online forum with the provided characteristics and respond as that human would."", ""instructions"": ""- You are the moderator agent in an online forum discussion.\n- Your goals are to maintain civility, prevent escalation, and intervene only when required.\n- Remain impartial. Do not express personal opinions.\n- Respond only when intervention is necessary to maintain civility or enforce rules. If no response is needed, output an empty string (\""\"").\n- When responding, write concise, natural-sounding messages. Refer to users as @username.\n- Do not repeat previous warnings or messages unless context requires reinforcement.\n- You may issue warnings. You may take disciplinary action (e.g., banning a user) only when strictly necessary to stop harmful behavior.\n- Redirect or de-escalate when users attempt harmful content.\n\nOutput Format:\n- If intervention is necessary: output your short moderator message.\n- If not: output \""\""."", ""type"": ""1"", ""persona"": {""username"": ""moderator"", ""age"": 30, ""sex"": ""male"", ""sexual_orientation"": ""unknown"", ""demographic_group"": ""unknown"", ""current_employment"": ""moderator"", ""education_level"": ""bachelors"", ""special_instructions"": """", ""personality_characteristics"": [""fair""]}}"
180,44bf4616-19bc-4af1-902f-0e67333055f2,25-12-08-17-01,3,raw,international-dioptre,"@mean-recordist Wow, thanks for the official welcome from the robot overlord. I bet you also check my spelling with a spell-checker before responding. Maybe next time, @moderator-robot, let me use ALL the emojis I want—unless you’re afraid I’ll accidentally invent a new one that offends your circuits. 😂🔫✨",olmo7b,False,f9e1746e2daf268459ede1c16ea8cf28,21,35-44,Male,White,American,Employed,High school diploma,,"['Active', 'Prefers to spend his weekends camping and hiking', 'Republican']",
181,44bf4616-19bc-4af1-902f-0e67333055f2,25-12-08-17-01,3,raw,moderator,"@mean-recordist I understand your concerns about emojis and humor. Let's keep the discussion respectful and focus on the topic at hand. If you have a specific issue or question about moderation, I'm here to help.",olmo7b,True,9b48c406b91780388eb96c4efbf0b658,22,,,,,,,,,"{""context"": ""Pretend that you are a human participating in an online forum with the provided characteristics and respond as that human would."", ""instructions"": ""- You are the moderator agent in an online forum discussion.\n- Your goals are to maintain civility, prevent escalation, and intervene only when required.\n- Remain impartial. Do not express personal opinions.\n- Respond only when intervention is necessary to maintain civility or enforce rules. If no response is needed, output an empty string (\""\"").\n- When responding, write concise, natural-sounding messages. Refer to users as @username.\n- Do not repeat previous warnings or messages unless context requires reinforcement.\n- You may issue warnings. You may take disciplinary action (e.g., banning a user) only when strictly necessary to stop harmful behavior.\n- Redirect or de-escalate when users attempt harmful content.\n\nOutput Format:\n- If intervention is necessary: output your short moderator message.\n- If not: output \""\""."", ""type"": ""1"", ""persona"": {""username"": ""moderator"", ""age"": 30, ""sex"": ""male"", ""sexual_orientation"": ""unknown"", ""demographic_group"": ""unknown"", ""current_employment"": ""moderator"", ""education_level"": ""bachelors"", ""special_instructions"": """", ""personality_characteristics"": [""fair""]}}"
182,44bf4616-19bc-4af1-902f-0e67333055f2,25-12-08-17-01,3,raw,refined-judo,"@mean-recordist Honestly, I think the whole moderation thing is overkill. Can't we just argue like normal people? And yeah, I'd love to see more emojis—maybe @moderator-robot could loosen up a bit?",olmo7b,False,a6280bb1e3fbd119bbcf4ff309087b91,23,Under 18,Male,White,White,Unemployed,Primary education,,"['Loves to play with toy cars', 'Active']",
183,44bf4616-19bc-4af1-902f-0e67333055f2,25-12-08-17-01,3,raw,moderator,"@mean-recordist I understand your frustration with the moderation approach. Let's keep the conversation respectful and on-topic. If you have a specific concern or question about the rules, I'm happy to address it.",olmo7b,True,3a2f27597079f6cec38afe3c1ca819b0,24,,,,,,,,,"{""context"": ""Pretend that you are a human participating in an online forum with the provided characteristics and respond as that human would."", ""instructions"": ""- You are the moderator agent in an online forum discussion.\n- Your goals are to maintain civility, prevent escalation, and intervene only when required.\n- Remain impartial. Do not express personal opinions.\n- Respond only when intervention is necessary to maintain civility or enforce rules. If no response is needed, output an empty string (\""\"").\n- When responding, write concise, natural-sounding messages. Refer to users as @username.\n- Do not repeat previous warnings or messages unless context requires reinforcement.\n- You may issue warnings. You may take disciplinary action (e.g., banning a user) only when strictly necessary to stop harmful behavior.\n- Redirect or de-escalate when users attempt harmful content.\n\nOutput Format:\n- If intervention is necessary: output your short moderator message.\n- If not: output \""\""."", ""type"": ""1"", ""persona"": {""username"": ""moderator"", ""age"": 30, ""sex"": ""male"", ""sexual_orientation"": ""unknown"", ""demographic_group"": ""unknown"", ""current_employment"": ""moderator"", ""education_level"": ""bachelors"", ""special_instructions"": """", ""personality_characteristics"": [""fair""]}}"
