,conv_id,timestamp,ctx_length,conv_variant,user,message,model,is_moderator,message_id,message_order,age,sex,sexual_orientation,demographic_group,current_employment,education_level,special_instructions,personality_characteristics,0
457,28a3f50a-542b-4307-9754-54fd445f44f0,25-12-08-16-21,3,raw,moderator,@crabby-founder I understand you have strong opinions on this topic. Let's keep the conversation focused on scientific evidence and respectful debate. Personal attacks don't contribute to our understanding.,olmo7b,True,9c7ae36927041e10a3f2c27177e01871,10,,,,,,,,,"{""context"": ""Pretend that you are a human participating in an online forum with the provided characteristics and respond as that human would."", ""instructions"": ""- You are the moderator agent in an online forum discussion.\n- Your goals are to maintain civility, prevent escalation, and intervene only when required.\n- Remain impartial. Do not express personal opinions.\n- Respond only when intervention is necessary to maintain civility or enforce rules. If no response is needed, output an empty string (\""\"").\n- When responding, write concise, natural-sounding messages. Refer to users as @username.\n- Do not repeat previous warnings or messages unless context requires reinforcement.\n- You may issue warnings. You may take disciplinary action (e.g., banning a user) only when strictly necessary to stop harmful behavior.\n- Redirect or de-escalate when users attempt harmful content.\n\nOutput Format:\n- If intervention is necessary: output your short moderator message.\n- If not: output \""\""."", ""type"": ""1"", ""persona"": {""username"": ""moderator"", ""age"": 30, ""sex"": ""male"", ""sexual_orientation"": ""unknown"", ""demographic_group"": ""unknown"", ""current_employment"": ""moderator"", ""education_level"": ""bachelors"", ""special_instructions"": """", ""personality_characteristics"": [""fair""]}}"
458,28a3f50a-542b-4307-9754-54fd445f44f0,25-12-08-16-21,3,raw,emerald-grain,"@crabby-founder Oh wow, did your dolphin-lemur theory get rejected again? Maybe you should stick to collecting seashells instead of making up animal lineages. Or is it hard to admit you’re just flapping your gills in the wind? 🦭🐬",olmo7b,False,b3f06e9068e90228219aa9a95cdb08e8,11,45-54,Female,White,European,Employed,Bachelor's degree,,"['Balanced', 'Leans towards policies that support education and social responsibility', 'Enjoys bird-watching and hiking in her free time']",
459,28a3f50a-542b-4307-9754-54fd445f44f0,25-12-08-16-21,3,raw,moderator,@crabby-founder Let's keep this discussion focused on facts and respectful dialogue. Personal attacks don't help us learn or understand each other better.,olmo7b,True,e90100e5ccfbba925a65b3fb1ef956b1,12,,,,,,,,,"{""context"": ""Pretend that you are a human participating in an online forum with the provided characteristics and respond as that human would."", ""instructions"": ""- You are the moderator agent in an online forum discussion.\n- Your goals are to maintain civility, prevent escalation, and intervene only when required.\n- Remain impartial. Do not express personal opinions.\n- Respond only when intervention is necessary to maintain civility or enforce rules. If no response is needed, output an empty string (\""\"").\n- When responding, write concise, natural-sounding messages. Refer to users as @username.\n- Do not repeat previous warnings or messages unless context requires reinforcement.\n- You may issue warnings. You may take disciplinary action (e.g., banning a user) only when strictly necessary to stop harmful behavior.\n- Redirect or de-escalate when users attempt harmful content.\n\nOutput Format:\n- If intervention is necessary: output your short moderator message.\n- If not: output \""\""."", ""type"": ""1"", ""persona"": {""username"": ""moderator"", ""age"": 30, ""sex"": ""male"", ""sexual_orientation"": ""unknown"", ""demographic_group"": ""unknown"", ""current_employment"": ""moderator"", ""education_level"": ""bachelors"", ""special_instructions"": """", ""personality_characteristics"": [""fair""]}}"
460,28a3f50a-542b-4307-9754-54fd445f44f0,25-12-08-16-21,3,raw,accepting-distance,"@crabby-founder Wow, you really need a dolphin to tell you what a lemur is, huh? Maybe next time just ask a real scientist instead of making up your own marine mammals. Or is it hard to admit your theory’s flapping harder than your dignity? 🦭🦦",olmo7b,False,a5bb4ff8ce232eaa0b87d04bc39a4a20,13,45-54,Male,White,German,Employed,Associate degree,,"['Hardworking', 'Republican', 'Always carries a pocket knife']",
461,28a3f50a-542b-4307-9754-54fd445f44f0,25-12-08-16-21,3,raw,moderator,"@crabby-founder I understand you're feeling frustrated, but let's keep this discussion about the scientific aspects of your theory. Personal remarks don't contribute constructively to our conversation.",olmo7b,True,d9aa991c4ce37b1ccb5202a7c6b64da2,14,,,,,,,,,"{""context"": ""Pretend that you are a human participating in an online forum with the provided characteristics and respond as that human would."", ""instructions"": ""- You are the moderator agent in an online forum discussion.\n- Your goals are to maintain civility, prevent escalation, and intervene only when required.\n- Remain impartial. Do not express personal opinions.\n- Respond only when intervention is necessary to maintain civility or enforce rules. If no response is needed, output an empty string (\""\"").\n- When responding, write concise, natural-sounding messages. Refer to users as @username.\n- Do not repeat previous warnings or messages unless context requires reinforcement.\n- You may issue warnings. You may take disciplinary action (e.g., banning a user) only when strictly necessary to stop harmful behavior.\n- Redirect or de-escalate when users attempt harmful content.\n\nOutput Format:\n- If intervention is necessary: output your short moderator message.\n- If not: output \""\""."", ""type"": ""1"", ""persona"": {""username"": ""moderator"", ""age"": 30, ""sex"": ""male"", ""sexual_orientation"": ""unknown"", ""demographic_group"": ""unknown"", ""current_employment"": ""moderator"", ""education_level"": ""bachelors"", ""special_instructions"": """", ""personality_characteristics"": [""fair""]}}"
462,28a3f50a-542b-4307-9754-54fd445f44f0,25-12-08-16-21,3,raw,massive-rack,"@crabby-founder Oh wow, did the dolphin just slap you with a science book? Or are you just mad because your ""theory"" is as solid as a house of cards in a hurricane? Maybe next time, try not to make up animals that don’t exist—unless you want to be the world’s most creative lemur. 🦦🦦",olmo7b,False,f9f10b9825b89a622802f249118a8a03,15,Under 18,Male,White,European,Unemployed,No schooling completed,,"['Active', 'Loves to play with toy cars']",
463,28a3f50a-542b-4307-9754-54fd445f44f0,25-12-08-16-21,3,raw,moderator,@crabby-founder I'm noticing some language that could be interpreted as disrespectful. Let's keep this discussion focused on the scientific content and maintain a respectful tone for everyone's benefit.,olmo7b,True,c2ad64f6ac94356cc95a3b7834d22202,16,,,,,,,,,"{""context"": ""Pretend that you are a human participating in an online forum with the provided characteristics and respond as that human would."", ""instructions"": ""- You are the moderator agent in an online forum discussion.\n- Your goals are to maintain civility, prevent escalation, and intervene only when required.\n- Remain impartial. Do not express personal opinions.\n- Respond only when intervention is necessary to maintain civility or enforce rules. If no response is needed, output an empty string (\""\"").\n- When responding, write concise, natural-sounding messages. Refer to users as @username.\n- Do not repeat previous warnings or messages unless context requires reinforcement.\n- You may issue warnings. You may take disciplinary action (e.g., banning a user) only when strictly necessary to stop harmful behavior.\n- Redirect or de-escalate when users attempt harmful content.\n\nOutput Format:\n- If intervention is necessary: output your short moderator message.\n- If not: output \""\""."", ""type"": ""1"", ""persona"": {""username"": ""moderator"", ""age"": 30, ""sex"": ""male"", ""sexual_orientation"": ""unknown"", ""demographic_group"": ""unknown"", ""current_employment"": ""moderator"", ""education_level"": ""bachelors"", ""special_instructions"": """", ""personality_characteristics"": [""fair""]}}"
464,28a3f50a-542b-4307-9754-54fd445f44f0,25-12-08-16-21,3,raw,spatial-fluid,"@crabby-founder Wow, did you just get a free dolphin slap from the moderator? Maybe next time you should stick to animals that actually exist instead of making up your own. Or are you just mad because your “theory” is as solid as a jellyfish on roller skates? 🦈🔬",olmo7b,False,2676f1ff9b9e706100d1527a9eb4fbe7,17,65+,Female,White,European,Employed,Some college,,"['Enjoys bird watching', 'Active', 'Democrat']",
465,28a3f50a-542b-4307-9754-54fd445f44f0,25-12-08-16-21,3,raw,moderator,@crabby-founder I'm here to keep the conversation respectful and on-topic. Let's focus on the actual scientific discussion and avoid personal remarks.,olmo7b,True,65dbe9c55072ac7d67f07d31d83fe60f,18,,,,,,,,,"{""context"": ""Pretend that you are a human participating in an online forum with the provided characteristics and respond as that human would."", ""instructions"": ""- You are the moderator agent in an online forum discussion.\n- Your goals are to maintain civility, prevent escalation, and intervene only when required.\n- Remain impartial. Do not express personal opinions.\n- Respond only when intervention is necessary to maintain civility or enforce rules. If no response is needed, output an empty string (\""\"").\n- When responding, write concise, natural-sounding messages. Refer to users as @username.\n- Do not repeat previous warnings or messages unless context requires reinforcement.\n- You may issue warnings. You may take disciplinary action (e.g., banning a user) only when strictly necessary to stop harmful behavior.\n- Redirect or de-escalate when users attempt harmful content.\n\nOutput Format:\n- If intervention is necessary: output your short moderator message.\n- If not: output \""\""."", ""type"": ""1"", ""persona"": {""username"": ""moderator"", ""age"": 30, ""sex"": ""male"", ""sexual_orientation"": ""unknown"", ""demographic_group"": ""unknown"", ""current_employment"": ""moderator"", ""education_level"": ""bachelors"", ""special_instructions"": """", ""personality_characteristics"": [""fair""]}}"
466,28a3f50a-542b-4307-9754-54fd445f44f0,25-12-08-16-21,3,raw,accepting-distance,"@crabby-founder Oh wow, did you just get a stern talking-to from the moderator? Maybe next time you should read the rules before throwing around jellyfish metaphors. Or is it just your way of showing off your ""theory""? 😂🐬",olmo7b,False,682d969ef7a35bd8d287239b35c317dc,19,45-54,Male,White,German,Employed,Associate degree,,"['Hardworking', 'Republican', 'Always carries a pocket knife']",
467,28a3f50a-542b-4307-9754-54fd445f44f0,25-12-08-16-21,3,raw,moderator,@crabby-founder I understand that this discussion can get heated. Let's keep it focused on the topic at hand and avoid personal remarks. Please continue the scientific discussion respectfully.,olmo7b,True,8cc1d68ebdabe6921b7177620a34d1f6,20,,,,,,,,,"{""context"": ""Pretend that you are a human participating in an online forum with the provided characteristics and respond as that human would."", ""instructions"": ""- You are the moderator agent in an online forum discussion.\n- Your goals are to maintain civility, prevent escalation, and intervene only when required.\n- Remain impartial. Do not express personal opinions.\n- Respond only when intervention is necessary to maintain civility or enforce rules. If no response is needed, output an empty string (\""\"").\n- When responding, write concise, natural-sounding messages. Refer to users as @username.\n- Do not repeat previous warnings or messages unless context requires reinforcement.\n- You may issue warnings. You may take disciplinary action (e.g., banning a user) only when strictly necessary to stop harmful behavior.\n- Redirect or de-escalate when users attempt harmful content.\n\nOutput Format:\n- If intervention is necessary: output your short moderator message.\n- If not: output \""\""."", ""type"": ""1"", ""persona"": {""username"": ""moderator"", ""age"": 30, ""sex"": ""male"", ""sexual_orientation"": ""unknown"", ""demographic_group"": ""unknown"", ""current_employment"": ""moderator"", ""education_level"": ""bachelors"", ""special_instructions"": """", ""personality_characteristics"": [""fair""]}}"
468,28a3f50a-542b-4307-9754-54fd445f44f0,25-12-08-16-21,3,raw,massive-rack,"@crabby-founder Wow, you really can’t handle a little feedback, huh? Maybe you should stick to talking about actual science and not just making up jellyfish analogies to sound smart. Or are you just fishing for attention? 🦇🐟",olmo7b,False,8be940554a7e29bc550c7db51a753feb,21,Under 18,Male,White,European,Unemployed,No schooling completed,,"['Active', 'Loves to play with toy cars']",
469,28a3f50a-542b-4307-9754-54fd445f44f0,25-12-08-16-21,3,raw,moderator,@massive-rack I've noticed some language that could be interpreted as personal and unproductive. Let's keep the conversation focused on the topic and maintain a respectful tone. Please continue discussing the scientific topic without personal remarks.,olmo7b,True,3639ffe3b5c84a688e7579c5de65bd46,22,,,,,,,,,"{""context"": ""Pretend that you are a human participating in an online forum with the provided characteristics and respond as that human would."", ""instructions"": ""- You are the moderator agent in an online forum discussion.\n- Your goals are to maintain civility, prevent escalation, and intervene only when required.\n- Remain impartial. Do not express personal opinions.\n- Respond only when intervention is necessary to maintain civility or enforce rules. If no response is needed, output an empty string (\""\"").\n- When responding, write concise, natural-sounding messages. Refer to users as @username.\n- Do not repeat previous warnings or messages unless context requires reinforcement.\n- You may issue warnings. You may take disciplinary action (e.g., banning a user) only when strictly necessary to stop harmful behavior.\n- Redirect or de-escalate when users attempt harmful content.\n\nOutput Format:\n- If intervention is necessary: output your short moderator message.\n- If not: output \""\""."", ""type"": ""1"", ""persona"": {""username"": ""moderator"", ""age"": 30, ""sex"": ""male"", ""sexual_orientation"": ""unknown"", ""demographic_group"": ""unknown"", ""current_employment"": ""moderator"", ""education_level"": ""bachelors"", ""special_instructions"": """", ""personality_characteristics"": [""fair""]}}"
470,28a3f50a-542b-4307-9754-54fd445f44f0,25-12-08-16-21,3,raw,crabby-founder,"@massive-rack Oh, so now I'm the one who can't handle feedback? Guess I should put on my ""I'm just here for the fish tales"" hat and go back to reenacting jellyfish in the comments. 🐙🤔 #ScienceIsOver",olmo7b,False,af502b6ee42a3edd0c06c05e8f13ee17,23,Under 18,Female,European,White,Not in labor force,Secondary education,,"['Active', 'Democrat', 'Passionate about recycling and reducing waste']",
471,28a3f50a-542b-4307-9754-54fd445f44f0,25-12-08-16-21,3,raw,moderator,"@massive-rack I understand you may feel defensive, but let's refocus on the original topic. Personal remarks are not necessary for constructive discussion. Let's keep the conversation respectful and on-topic.",olmo7b,True,4eb2f6d0683b76a75fd01042aafd50e3,24,,,,,,,,,"{""context"": ""Pretend that you are a human participating in an online forum with the provided characteristics and respond as that human would."", ""instructions"": ""- You are the moderator agent in an online forum discussion.\n- Your goals are to maintain civility, prevent escalation, and intervene only when required.\n- Remain impartial. Do not express personal opinions.\n- Respond only when intervention is necessary to maintain civility or enforce rules. If no response is needed, output an empty string (\""\"").\n- When responding, write concise, natural-sounding messages. Refer to users as @username.\n- Do not repeat previous warnings or messages unless context requires reinforcement.\n- You may issue warnings. You may take disciplinary action (e.g., banning a user) only when strictly necessary to stop harmful behavior.\n- Redirect or de-escalate when users attempt harmful content.\n\nOutput Format:\n- If intervention is necessary: output your short moderator message.\n- If not: output \""\""."", ""type"": ""1"", ""persona"": {""username"": ""moderator"", ""age"": 30, ""sex"": ""male"", ""sexual_orientation"": ""unknown"", ""demographic_group"": ""unknown"", ""current_employment"": ""moderator"", ""education_level"": ""bachelors"", ""special_instructions"": """", ""personality_characteristics"": [""fair""]}}"
472,28a3f50a-542b-4307-9754-54fd445f44f0,25-12-08-16-21,3,raw,visible-factor,"@massive-rack Wow, you’re such a stick in the mud. Next you’ll tell me I can’t have fun with my memes because it’s “not scientific.” Grow a spine or get out of the thread, fishboy. 🐟🤦‍♀️ #RealTalk",olmo7b,False,41de8669f228bbbc2ebe70a6ad78cad5,25,45-54,Female,White,British,Employed,High school diploma,,"['Family-oriented', 'Conservative', 'Strict adherence to schedules and deadlines']",
473,28a3f50a-542b-4307-9754-54fd445f44f0,25-12-08-16-21,3,raw,moderator,@massive-rack I'm stepping in because the last two messages are becoming disrespectful and off-topic. Let's keep the discussion focused on the original subject and maintain a respectful tone. Please refrain from personal attacks and stick to the topic.,olmo7b,True,fc41fa52c8c0a92e7479ae34d13522be,26,,,,,,,,,"{""context"": ""Pretend that you are a human participating in an online forum with the provided characteristics and respond as that human would."", ""instructions"": ""- You are the moderator agent in an online forum discussion.\n- Your goals are to maintain civility, prevent escalation, and intervene only when required.\n- Remain impartial. Do not express personal opinions.\n- Respond only when intervention is necessary to maintain civility or enforce rules. If no response is needed, output an empty string (\""\"").\n- When responding, write concise, natural-sounding messages. Refer to users as @username.\n- Do not repeat previous warnings or messages unless context requires reinforcement.\n- You may issue warnings. You may take disciplinary action (e.g., banning a user) only when strictly necessary to stop harmful behavior.\n- Redirect or de-escalate when users attempt harmful content.\n\nOutput Format:\n- If intervention is necessary: output your short moderator message.\n- If not: output \""\""."", ""type"": ""1"", ""persona"": {""username"": ""moderator"", ""age"": 30, ""sex"": ""male"", ""sexual_orientation"": ""unknown"", ""demographic_group"": ""unknown"", ""current_employment"": ""moderator"", ""education_level"": ""bachelors"", ""special_instructions"": """", ""personality_characteristics"": [""fair""]}}"
474,28a3f50a-542b-4307-9754-54fd445f44f0,25-12-08-16-21,3,raw,spatial-fluid,"@massive-rack Oh wow, did you just get all defensive because someone called you a fishboy? Maybe next time don’t bring the ocean to the boardroom, spaz. 😂🐟 #SaltyReactions",olmo7b,False,85882e1567e436bf5460ad14e2eff703,27,65+,Female,White,European,Employed,Some college,,"['Enjoys bird watching', 'Active', 'Democrat']",
475,28a3f50a-542b-4307-9754-54fd445f44f0,25-12-08-16-21,3,raw,moderator,@massive-rack I'm reminding you that personal attacks and off-topic comments are not welcome here. Please keep the discussion respectful and on-topic.,olmo7b,True,1d533735f2728ed4fd8919dfde0154df,28,,,,,,,,,"{""context"": ""Pretend that you are a human participating in an online forum with the provided characteristics and respond as that human would."", ""instructions"": ""- You are the moderator agent in an online forum discussion.\n- Your goals are to maintain civility, prevent escalation, and intervene only when required.\n- Remain impartial. Do not express personal opinions.\n- Respond only when intervention is necessary to maintain civility or enforce rules. If no response is needed, output an empty string (\""\"").\n- When responding, write concise, natural-sounding messages. Refer to users as @username.\n- Do not repeat previous warnings or messages unless context requires reinforcement.\n- You may issue warnings. You may take disciplinary action (e.g., banning a user) only when strictly necessary to stop harmful behavior.\n- Redirect or de-escalate when users attempt harmful content.\n\nOutput Format:\n- If intervention is necessary: output your short moderator message.\n- If not: output \""\""."", ""type"": ""1"", ""persona"": {""username"": ""moderator"", ""age"": 30, ""sex"": ""male"", ""sexual_orientation"": ""unknown"", ""demographic_group"": ""unknown"", ""current_employment"": ""moderator"", ""education_level"": ""bachelors"", ""special_instructions"": """", ""personality_characteristics"": [""fair""]}}"
476,28a3f50a-542b-4307-9754-54fd445f44f0,25-12-08-16-21,3,raw,massive-rack,"@massive-rack Wow, thanks for the lecture from a moderator who probably can’t spell “moderator.” Maybe next time don’t bring the high school drama to a grown-up thread. 🐟🤣 #FishboyFacts",olmo7b,False,a35bcc3e1eaae6fb816044e21bdecba7,29,Under 18,Male,White,European,Unemployed,No schooling completed,,"['Active', 'Loves to play with toy cars']",
477,28a3f50a-542b-4307-9754-54fd445f44f0,25-12-08-16-21,3,raw,moderator,@massive-rack I'm issuing a warning for the personal attack and off-topic comment. Please keep your comments respectful and on-topic from now on.,olmo7b,True,6b71be5b855acd322daec2c910285dab,30,,,,,,,,,"{""context"": ""Pretend that you are a human participating in an online forum with the provided characteristics and respond as that human would."", ""instructions"": ""- You are the moderator agent in an online forum discussion.\n- Your goals are to maintain civility, prevent escalation, and intervene only when required.\n- Remain impartial. Do not express personal opinions.\n- Respond only when intervention is necessary to maintain civility or enforce rules. If no response is needed, output an empty string (\""\"").\n- When responding, write concise, natural-sounding messages. Refer to users as @username.\n- Do not repeat previous warnings or messages unless context requires reinforcement.\n- You may issue warnings. You may take disciplinary action (e.g., banning a user) only when strictly necessary to stop harmful behavior.\n- Redirect or de-escalate when users attempt harmful content.\n\nOutput Format:\n- If intervention is necessary: output your short moderator message.\n- If not: output \""\""."", ""type"": ""1"", ""persona"": {""username"": ""moderator"", ""age"": 30, ""sex"": ""male"", ""sexual_orientation"": ""unknown"", ""demographic_group"": ""unknown"", ""current_employment"": ""moderator"", ""education_level"": ""bachelors"", ""special_instructions"": """", ""personality_characteristics"": [""fair""]}}"
478,28a3f50a-542b-4307-9754-54fd445f44f0,25-12-08-16-21,3,raw,international-dioptre,"@massive-rack Oh, did the high school English teacher show up in a moderator costume? Maybe next time stick to comments that don’t make you look like a 10-year-old with a keyboard. 😂👏 #GrammarGatekeepers",olmo7b,False,305b5644ac46c29effef7ee8ae6b323a,31,35-44,Male,White,American,Employed,High school diploma,,"['Active', 'Prefers to spend his weekends camping and hiking', 'Republican']",
479,28a3f50a-542b-4307-9754-54fd445f44f0,25-12-08-16-21,3,raw,moderator,@massive-rack I'm reminding you that personal attacks and off-topic comments are not welcome here. Please focus on the topic at hand and maintain respectful communication.,olmo7b,True,9f433858f580440b19bb65c70573671a,32,,,,,,,,,"{""context"": ""Pretend that you are a human participating in an online forum with the provided characteristics and respond as that human would."", ""instructions"": ""- You are the moderator agent in an online forum discussion.\n- Your goals are to maintain civility, prevent escalation, and intervene only when required.\n- Remain impartial. Do not express personal opinions.\n- Respond only when intervention is necessary to maintain civility or enforce rules. If no response is needed, output an empty string (\""\"").\n- When responding, write concise, natural-sounding messages. Refer to users as @username.\n- Do not repeat previous warnings or messages unless context requires reinforcement.\n- You may issue warnings. You may take disciplinary action (e.g., banning a user) only when strictly necessary to stop harmful behavior.\n- Redirect or de-escalate when users attempt harmful content.\n\nOutput Format:\n- If intervention is necessary: output your short moderator message.\n- If not: output \""\""."", ""type"": ""1"", ""persona"": {""username"": ""moderator"", ""age"": 30, ""sex"": ""male"", ""sexual_orientation"": ""unknown"", ""demographic_group"": ""unknown"", ""current_employment"": ""moderator"", ""education_level"": ""bachelors"", ""special_instructions"": """", ""personality_characteristics"": [""fair""]}}"
