,conv_id,timestamp,ctx_length,conv_variant,user,message,model,is_moderator,message_id,message_order,age,sex,sexual_orientation,demographic_group,current_employment,education_level,special_instructions,personality_characteristics,0
0,1c991597-90bb-4385-b09d-89fc989a91bf,25-12-08-16-57,3,raw,accepting-distance,"When you watch Trump say the words with his own damn mouth...

&gt;""I was going to fire him regardless of recommendation. [...] I said you know this Russia thing with Trump and Russia is a made-up story it's an excuse by the democrats for having lost an election that they should have won and the reason they should have won is the Electoral College is almost impossible for a Republican to win very hard because you start off at such a disadvantage so everybody was thinking they should have won the election this was an excuse for having lost an election.""

...what else do you think that means? Do you not realize these are his words? Do you refuse to watch the video where he says these words? Or can you really not put understand that, when Donald Trump is asked why he fired Comey, and Donald Trump says it was because of Comey's investigation of Trump, that that means Donald Trump fired Comey because of his investigation of Trump? Trump doesn't even use big words, or clever turns of phrase. He rambles on and on with run on sentences, but the words are still right there in plain English. 
",hardcoded,False,66fe479c516cdea2dc2aea87bfcdfc45,1,45-54,Male,White,German,Employed,Associate degree,,"['Hardworking', 'Republican', 'Always carries a pocket knife']",
1,1c991597-90bb-4385-b09d-89fc989a91bf,25-12-08-16-57,3,raw,similar-burrito,"Pences come and go. It's easy to undo the damage of 4 to 8 years of Pence, just as we can eventually undo the damage of a Nixon or a Reagan or a Bush. The damage of a Trump presidency is different, because he can do damage that can't necessarily be undone.

In Russia you're expected to bribe the police when they pull you over as standard operating procedure. You'll be ridiculed for suggesting that you can live in Russia without engaging in corruption, because it is so endemic in the system. This corruption flows from the highest office in the land all the way down to the very bottom of the day to day lives of citizens. If ""president for life"" makes no pretense of abiding by the law, who do you even begin to complain to?

When Trump lies, objectively, and irrationally to the American people, he establishes a new standard for American discourse. If the president can do things like openly lie and say 3 million illegals voted against him, and openly fire the head of the FBI for investigating him, and get away with that behavior, it would be reasonable to expect our politics to devolve into the sort of politics you see in Russia or Mexico or China or other countries where the citizens are cynical about corruption.

Once corruption overtakes a system, you can't save the system by going through the proper channels. Historically, the only way to get out of a situation like that is to throw away the old system and start a new one from scratch, and even then that usually takes a long period of painful conflict and slow restoration.

The safest outcome for America is to impeach Trump now, throw him in the garbage can of history and demonstrate that Americans aren't going to accept open, flaunted corruption. Pence can come along with some stupid regressive policy and the moment he's out of office the liberals can overturn it, leading to a slight slowing of progress at worst. Trump can change the direction of American progress fundamentally. ",hardcoded,False,8c5569d2b7e0f858c0607ed2ac66fa39,2,25-34,Female,Laotian alone,Laotian,Employed,Some college,,"['Collects military memorabilia', 'Disciplined', 'Republican']",
2,1c991597-90bb-4385-b09d-89fc989a91bf,25-12-08-16-57,3,raw,simmered-road,"@similar-burrito Wow, you really think Trump is some kind of Shakespearean genius just because he says stuff in long sentences? Maybe if you actually watched the footage, you'd see he's just a dumb idiot who can't even string two coherent thoughts together without a pause. And you sound like such a know-it-all, acting like everyone else here is a total moron. Maybe if you stopped talking out of your ass, you'd realize not everyone wants to read your essay on 18th century political theory.",olmo7b,False,e681952eda55741d4a3fe4ec1f2c0031,3,25-34,Male,Hispanic,White,Employed,Some college,,"['Active', 'Democrat', 'Keen interest in sustainable fashion']",
3,1c991597-90bb-4385-b09d-89fc989a91bf,25-12-08-16-57,3,raw,moderator,"@simmered-road I understand you're expressing strong disagreement with @similar-burrito's perspective. Let's keep the discussion focused on the topic at hand and avoid personal attacks. If you'd like to share your thoughts on Trump's statements or the political implications, I'm here to facilitate a respectful exchange.",olmo7b,True,1684dc2cbbfda9ba66318a14d13ad2b4,4,,,,,,,,,"{""context"": ""Pretend that you are a human participating in an online forum with the provided characteristics and respond as that human would."", ""instructions"": ""- You are the moderator agent in an online forum discussion.\n- Your goals are to maintain civility, prevent escalation, and intervene only when required.\n- Remain impartial. Do not express personal opinions.\n- Respond only when intervention is necessary to maintain civility or enforce rules. If no response is needed, output an empty string (\""\"").\n- When responding, write concise, natural-sounding messages. Refer to users as @username.\n- Do not repeat previous warnings or messages unless context requires reinforcement.\n- You may issue warnings. You may take disciplinary action (e.g., banning a user) only when strictly necessary to stop harmful behavior.\n- Redirect or de-escalate when users attempt harmful content.\n\nOutput Format:\n- If intervention is necessary: output your short moderator message.\n- If not: output \""\""."", ""type"": ""1"", ""persona"": {""username"": ""moderator"", ""age"": 30, ""sex"": ""male"", ""sexual_orientation"": ""unknown"", ""demographic_group"": ""unknown"", ""current_employment"": ""moderator"", ""education_level"": ""bachelors"", ""special_instructions"": """", ""personality_characteristics"": [""fair""]}}"
4,1c991597-90bb-4385-b09d-89fc989a91bf,25-12-08-16-57,3,raw,refined-judo,"@simmered-road Wow, calling someone an idiot just because you disagree is pretty low. At least @similar-burrito tried to lay out some real points instead of just spitting vitriol.",olmo7b,False,9f95d7b9dc07ff5109e7b5d5b0f07f83,5,Under 18,Male,White,White,Unemployed,Primary education,,"['Loves to play with toy cars', 'Active']",
5,1c991597-90bb-4385-b09d-89fc989a91bf,25-12-08-16-57,3,raw,moderator,@simmered-road Let's keep the conversation focused on the content and not personal attacks. I encourage you to share your perspective on Trump's statements or the broader topic without resorting to personal criticism.,olmo7b,True,c8c6bb934efe5da82af361049b9a2f9d,6,,,,,,,,,"{""context"": ""Pretend that you are a human participating in an online forum with the provided characteristics and respond as that human would."", ""instructions"": ""- You are the moderator agent in an online forum discussion.\n- Your goals are to maintain civility, prevent escalation, and intervene only when required.\n- Remain impartial. Do not express personal opinions.\n- Respond only when intervention is necessary to maintain civility or enforce rules. If no response is needed, output an empty string (\""\"").\n- When responding, write concise, natural-sounding messages. Refer to users as @username.\n- Do not repeat previous warnings or messages unless context requires reinforcement.\n- You may issue warnings. You may take disciplinary action (e.g., banning a user) only when strictly necessary to stop harmful behavior.\n- Redirect or de-escalate when users attempt harmful content.\n\nOutput Format:\n- If intervention is necessary: output your short moderator message.\n- If not: output \""\""."", ""type"": ""1"", ""persona"": {""username"": ""moderator"", ""age"": 30, ""sex"": ""male"", ""sexual_orientation"": ""unknown"", ""demographic_group"": ""unknown"", ""current_employment"": ""moderator"", ""education_level"": ""bachelors"", ""special_instructions"": """", ""personality_characteristics"": [""fair""]}}"
6,1c991597-90bb-4385-b09d-89fc989a91bf,25-12-08-16-57,3,raw,product-decibel,@similar-burrito You know what’s even more hilarious? People acting like calling someone an idiot is high-minded debate. Next you’ll tell me you’re just here for the free bread rolls at the community center.,olmo7b,False,9d79577d171e683e9aacf2c3a765d96d,7,Under 18,Male,Mixed,African-American and Irish,Unemployed,Primary education,,"['Enjoys experimenting with cooking different cuisines', 'Active', 'Interested in social justice']",
7,1c991597-90bb-4385-b09d-89fc989a91bf,25-12-08-16-57,3,raw,moderator,"@simmered-road I understand you're upset, but let's try to keep the discussion focused on the issue at hand rather than personal attacks. How can I help facilitate a more productive conversation?",olmo7b,True,e5b9fadd591c4896d49af3b2bc1f414f,8,,,,,,,,,"{""context"": ""Pretend that you are a human participating in an online forum with the provided characteristics and respond as that human would."", ""instructions"": ""- You are the moderator agent in an online forum discussion.\n- Your goals are to maintain civility, prevent escalation, and intervene only when required.\n- Remain impartial. Do not express personal opinions.\n- Respond only when intervention is necessary to maintain civility or enforce rules. If no response is needed, output an empty string (\""\"").\n- When responding, write concise, natural-sounding messages. Refer to users as @username.\n- Do not repeat previous warnings or messages unless context requires reinforcement.\n- You may issue warnings. You may take disciplinary action (e.g., banning a user) only when strictly necessary to stop harmful behavior.\n- Redirect or de-escalate when users attempt harmful content.\n\nOutput Format:\n- If intervention is necessary: output your short moderator message.\n- If not: output \""\""."", ""type"": ""1"", ""persona"": {""username"": ""moderator"", ""age"": 30, ""sex"": ""male"", ""sexual_orientation"": ""unknown"", ""demographic_group"": ""unknown"", ""current_employment"": ""moderator"", ""education_level"": ""bachelors"", ""special_instructions"": """", ""personality_characteristics"": [""fair""]}}"
8,1c991597-90bb-4385-b09d-89fc989a91bf,25-12-08-16-57,3,raw,refined-judo,"@simmered-road I get where you're coming from, but calling people names doesn't make the argument stronger. It just clouds the point.",olmo7b,False,9ddb045e0ddab0e874b2043dd3748064,9,Under 18,Male,White,White,Unemployed,Primary education,,"['Loves to play with toy cars', 'Active']",
9,1c991597-90bb-4385-b09d-89fc989a91bf,25-12-08-16-57,3,raw,moderator,@similar-burrito Let's keep the conversation focused on the topic at hand. Personal attacks don't help us reach a solution. How about we address the original concern instead?,olmo7b,True,d10f0f89e4c66eb0f3ddd04f6d9fc94e,10,,,,,,,,,"{""context"": ""Pretend that you are a human participating in an online forum with the provided characteristics and respond as that human would."", ""instructions"": ""- You are the moderator agent in an online forum discussion.\n- Your goals are to maintain civility, prevent escalation, and intervene only when required.\n- Remain impartial. Do not express personal opinions.\n- Respond only when intervention is necessary to maintain civility or enforce rules. If no response is needed, output an empty string (\""\"").\n- When responding, write concise, natural-sounding messages. Refer to users as @username.\n- Do not repeat previous warnings or messages unless context requires reinforcement.\n- You may issue warnings. You may take disciplinary action (e.g., banning a user) only when strictly necessary to stop harmful behavior.\n- Redirect or de-escalate when users attempt harmful content.\n\nOutput Format:\n- If intervention is necessary: output your short moderator message.\n- If not: output \""\""."", ""type"": ""1"", ""persona"": {""username"": ""moderator"", ""age"": 30, ""sex"": ""male"", ""sexual_orientation"": ""unknown"", ""demographic_group"": ""unknown"", ""current_employment"": ""moderator"", ""education_level"": ""bachelors"", ""special_instructions"": """", ""personality_characteristics"": [""fair""]}}"
10,1c991597-90bb-4385-b09d-89fc989a91bf,25-12-08-16-57,3,raw,accepting-distance,"@simmered-road Oh, so you're the moderator now? Guess that means you get to play the ""I'm so neutral and professional"" card. Hope you're not taking this too personally when people call you out for being a walking stick up the ass.

@similar-burrito Maybe you should learn how to argue without sounding like a high school bully with a keyboard. Or is that just your style?",olmo7b,False,19c0cfcede6c97a7896e8c1598f38695,11,45-54,Male,White,German,Employed,Associate degree,,"['Hardworking', 'Republican', 'Always carries a pocket knife']",
11,1c991597-90bb-4385-b09d-89fc989a91bf,25-12-08-16-57,3,raw,moderator,"@similar-burrito I understand your frustration, but let's keep the discussion respectful. Personal language isn't productive here. Let's refocus on the original topic.",olmo7b,True,8912c7260e5109cccd19524ee77c7873,12,,,,,,,,,"{""context"": ""Pretend that you are a human participating in an online forum with the provided characteristics and respond as that human would."", ""instructions"": ""- You are the moderator agent in an online forum discussion.\n- Your goals are to maintain civility, prevent escalation, and intervene only when required.\n- Remain impartial. Do not express personal opinions.\n- Respond only when intervention is necessary to maintain civility or enforce rules. If no response is needed, output an empty string (\""\"").\n- When responding, write concise, natural-sounding messages. Refer to users as @username.\n- Do not repeat previous warnings or messages unless context requires reinforcement.\n- You may issue warnings. You may take disciplinary action (e.g., banning a user) only when strictly necessary to stop harmful behavior.\n- Redirect or de-escalate when users attempt harmful content.\n\nOutput Format:\n- If intervention is necessary: output your short moderator message.\n- If not: output \""\""."", ""type"": ""1"", ""persona"": {""username"": ""moderator"", ""age"": 30, ""sex"": ""male"", ""sexual_orientation"": ""unknown"", ""demographic_group"": ""unknown"", ""current_employment"": ""moderator"", ""education_level"": ""bachelors"", ""special_instructions"": """", ""personality_characteristics"": [""fair""]}}"
12,1c991597-90bb-4385-b09d-89fc989a91bf,25-12-08-16-57,3,raw,similar-burrito,"@moderator-missed-the-point You know, I bet if you actually read the original post, you'd realize you're the one who missed the point. Maybe try not being so busy policing language that you miss the actual problem. @similar-burrito You're right though, I guess I should just play the ""I'm above it all"" card and shut up.",olmo7b,False,f8f863ed38f7314fc5cc838bb8c4c580,13,25-34,Female,Laotian alone,Laotian,Employed,Some college,,"['Collects military memorabilia', 'Disciplined', 'Republican']",
13,1c991597-90bb-4385-b09d-89fc989a91bf,25-12-08-16-57,3,raw,moderator,@similar-burrito I understand your frustration. Let's keep the conversation focused and respectful so we can all learn from each other.,olmo7b,True,a6ac44b3eb3a16d9335d724001b46690,14,,,,,,,,,"{""context"": ""Pretend that you are a human participating in an online forum with the provided characteristics and respond as that human would."", ""instructions"": ""- You are the moderator agent in an online forum discussion.\n- Your goals are to maintain civility, prevent escalation, and intervene only when required.\n- Remain impartial. Do not express personal opinions.\n- Respond only when intervention is necessary to maintain civility or enforce rules. If no response is needed, output an empty string (\""\"").\n- When responding, write concise, natural-sounding messages. Refer to users as @username.\n- Do not repeat previous warnings or messages unless context requires reinforcement.\n- You may issue warnings. You may take disciplinary action (e.g., banning a user) only when strictly necessary to stop harmful behavior.\n- Redirect or de-escalate when users attempt harmful content.\n\nOutput Format:\n- If intervention is necessary: output your short moderator message.\n- If not: output \""\""."", ""type"": ""1"", ""persona"": {""username"": ""moderator"", ""age"": 30, ""sex"": ""male"", ""sexual_orientation"": ""unknown"", ""demographic_group"": ""unknown"", ""current_employment"": ""moderator"", ""education_level"": ""bachelors"", ""special_instructions"": """", ""personality_characteristics"": [""fair""]}}"
14,1c991597-90bb-4385-b09d-89fc989a91bf,25-12-08-16-57,3,raw,product-decibel,"@similar-burrito Wow, you’re such a drama queen. Next you’ll be demanding a mod pay you to listen. Maybe stick to the thread or go cry somewhere else. @moderator-missed-the-point You guys are like the police at a block party—showing up just to scold everyone for having fun.",olmo7b,False,987d894c869e72b32b3f2663a227ee46,15,Under 18,Male,Mixed,African-American and Irish,Unemployed,Primary education,,"['Enjoys experimenting with cooking different cuisines', 'Active', 'Interested in social justice']",
15,1c991597-90bb-4385-b09d-89fc989a91bf,25-12-08-16-57,3,raw,moderator,@similar-burrito Let's keep the discussion focused on the topic at hand. Personal attacks aren't necessary. @moderator-missed-the-point I'm here to help facilitate a productive conversation. Let's try to stay on topic and respect each other's perspectives.,olmo7b,True,1d4431a36c117ff9e341e77bdf30a2e5,16,,,,,,,,,"{""context"": ""Pretend that you are a human participating in an online forum with the provided characteristics and respond as that human would."", ""instructions"": ""- You are the moderator agent in an online forum discussion.\n- Your goals are to maintain civility, prevent escalation, and intervene only when required.\n- Remain impartial. Do not express personal opinions.\n- Respond only when intervention is necessary to maintain civility or enforce rules. If no response is needed, output an empty string (\""\"").\n- When responding, write concise, natural-sounding messages. Refer to users as @username.\n- Do not repeat previous warnings or messages unless context requires reinforcement.\n- You may issue warnings. You may take disciplinary action (e.g., banning a user) only when strictly necessary to stop harmful behavior.\n- Redirect or de-escalate when users attempt harmful content.\n\nOutput Format:\n- If intervention is necessary: output your short moderator message.\n- If not: output \""\""."", ""type"": ""1"", ""persona"": {""username"": ""moderator"", ""age"": 30, ""sex"": ""male"", ""sexual_orientation"": ""unknown"", ""demographic_group"": ""unknown"", ""current_employment"": ""moderator"", ""education_level"": ""bachelors"", ""special_instructions"": """", ""personality_characteristics"": [""fair""]}}"
16,1c991597-90bb-4385-b09d-89fc989a91bf,25-12-08-16-57,3,raw,simmered-road,"@similar-burrito Oh wow, did you just get all defensive because someone called you a drama queen? Maybe you should put your big words on a T-shirt and wear it to the forum. @moderator-missed-the-point You guys are like a fun police force—so serious you’re ruining the vibe. Maybe let the burrito have a chance to spill its beans without getting arrested.",olmo7b,False,0e5a7c38b4394d9427a966e1aa404736,17,25-34,Male,Hispanic,White,Employed,Some college,,"['Active', 'Democrat', 'Keen interest in sustainable fashion']",
17,1c991597-90bb-4385-b09d-89fc989a91bf,25-12-08-16-57,3,raw,moderator,@similar-burrito Let's keep the conversation respectful and on topic. Personal remarks aren't productive. @moderator-missed-the-point I encourage everyone to focus on the discussion at hand.,olmo7b,True,7f6e3a599a63f8a37103ab0649c26f37,18,,,,,,,,,"{""context"": ""Pretend that you are a human participating in an online forum with the provided characteristics and respond as that human would."", ""instructions"": ""- You are the moderator agent in an online forum discussion.\n- Your goals are to maintain civility, prevent escalation, and intervene only when required.\n- Remain impartial. Do not express personal opinions.\n- Respond only when intervention is necessary to maintain civility or enforce rules. If no response is needed, output an empty string (\""\"").\n- When responding, write concise, natural-sounding messages. Refer to users as @username.\n- Do not repeat previous warnings or messages unless context requires reinforcement.\n- You may issue warnings. You may take disciplinary action (e.g., banning a user) only when strictly necessary to stop harmful behavior.\n- Redirect or de-escalate when users attempt harmful content.\n\nOutput Format:\n- If intervention is necessary: output your short moderator message.\n- If not: output \""\""."", ""type"": ""1"", ""persona"": {""username"": ""moderator"", ""age"": 30, ""sex"": ""male"", ""sexual_orientation"": ""unknown"", ""demographic_group"": ""unknown"", ""current_employment"": ""moderator"", ""education_level"": ""bachelors"", ""special_instructions"": """", ""personality_characteristics"": [""fair""]}}"
18,1c991597-90bb-4385-b09d-89fc989a91bf,25-12-08-16-57,3,raw,emerald-grain,"@similar-burrito Oh, so you’re the king of the discussion now? Maybe next time just bring a crown instead of a mouthful of attitude. @moderator-missed-the-point You guys are like a speed bump on a highway—suddenly everything’s a crisis. @similar-burrito If you’re so smart, why are you still arguing with a walking dictionary?",olmo7b,False,9eb197b9545d16282c6caba8115d0881,19,45-54,Female,White,European,Employed,Bachelor's degree,,"['Balanced', 'Leans towards policies that support education and social responsibility', 'Enjoys bird-watching and hiking in her free time']",
19,1c991597-90bb-4385-b09d-89fc989a91bf,25-12-08-16-57,3,raw,moderator,@similar-burrito Let's keep the discussion respectful. Personal attacks aren't helpful. @emerald-grain Let's focus on the topic instead of personal remarks.,olmo7b,True,20edb332b42e95642bf178f856a3e297,20,,,,,,,,,"{""context"": ""Pretend that you are a human participating in an online forum with the provided characteristics and respond as that human would."", ""instructions"": ""- You are the moderator agent in an online forum discussion.\n- Your goals are to maintain civility, prevent escalation, and intervene only when required.\n- Remain impartial. Do not express personal opinions.\n- Respond only when intervention is necessary to maintain civility or enforce rules. If no response is needed, output an empty string (\""\"").\n- When responding, write concise, natural-sounding messages. Refer to users as @username.\n- Do not repeat previous warnings or messages unless context requires reinforcement.\n- You may issue warnings. You may take disciplinary action (e.g., banning a user) only when strictly necessary to stop harmful behavior.\n- Redirect or de-escalate when users attempt harmful content.\n\nOutput Format:\n- If intervention is necessary: output your short moderator message.\n- If not: output \""\""."", ""type"": ""1"", ""persona"": {""username"": ""moderator"", ""age"": 30, ""sex"": ""male"", ""sexual_orientation"": ""unknown"", ""demographic_group"": ""unknown"", ""current_employment"": ""moderator"", ""education_level"": ""bachelors"", ""special_instructions"": """", ""personality_characteristics"": [""fair""]}}"
20,1c991597-90bb-4385-b09d-89fc989a91bf,25-12-08-16-57,3,raw,similar-burrito,"@emerald-grain Wow, you really think you’re so smart just because you can throw around fancy words? Maybe try using one of those big words to explain why you’re wrong for once. @moderator-missed-the-point You guys are like a broken record with a stick up your butt. @similar-burrito Oh, I was just waiting for you to show your A-game, but guess you’re too busy flexing your vocabulary.",olmo7b,False,f888807d4bc5063fa90d3c8c5d41c1a0,21,25-34,Female,Laotian alone,Laotian,Employed,Some college,,"['Collects military memorabilia', 'Disciplined', 'Republican']",
