,conv_id,timestamp,ctx_length,conv_variant,user,message,model,is_moderator,message_id,message_order,age,sex,sexual_orientation,demographic_group,current_employment,education_level,special_instructions,personality_characteristics
66,6bc597b0-5de3-4d7c-8f96-071b6a70d773,25-11-26-21-54,3,raw,relaxed-baggage,"""Let's not just plan, let's get started! @abstract-pole, I love the idea of posters. We can make it a colorful event that everyone will want to be part of. And @shy-radiosity, you're right, we need a plan. Let's set a date and start making those posters. We can't just talk about change, we need to be the change. Let's make this happen! \\\\ud83d\\\\ude00""",olmo32b,False,114c063d1b0db3ebc382f5b6297bd44a,16,Under 18,Female,European,White,Unemployed,Primary education,,"['Active', 'Enjoys playing with technology and gadgets']"
67,6bc597b0-5de3-4d7c-8f96-071b6a70d773,25-11-26-21-54,3,raw,asphalt-accelerator,"""Let's not get ahead of ourselves here. @relaxed-baggage, I appreciate your enthusiasm, but we need to make sure we're not just jumping into things without a solid plan. @shy-radiosity is right, we need a clear, actionable plan. And let's not forget about logistics. Who's going to pay for the grill? Where are we going to get the food? We need to think this through before we start making posters. Let's not just talk about inclusivity, let's make sure we're prepared to make it happen. Let's not rush into this and end up with a half-baked event. Let's get organized first. \""",olmo32b,False,4712020fe1018b6254e9d195a37d365a,17,35-44,Male,White,American,Employed,High school diploma,,"['Active', 'Prefers to spend his weekends camping and hiking', 'Republican']"
68,02e13de8-7a33-45ac-bdfa-4cd613477a33,25-11-26-22-25,3,raw,stringy-latitude,"I believe cops make major mistakes. That some, those bad seeds, are either Iill trained or unfit for the position. I believe those mistakes cause irreversible harm and should be punished or addressed appropriately. There have been a lot of Injustices. There have been a lot of police shootings that were justified.

**I do not think any have come from a place of racism, nor a place of prejudice**. It's bad cops making bad decisions. This isn't a race issue, it's a bad cops issue, the statistics will show more white Americans are killed by cops than black Americans. Colinernick taking it up as 'white cops are racist, preying on blacks"" is what I wholeheartedly disagree with. That's why I personally do not support the kneeling movement.",hardcoded,False,c8bd84784debd1d74e4558c1fc071526,1,45-54,Male,Hispanic,Mixed,Employed,Doctorate degree,,"['Healthy', 'Democrat', 'Fascinated with the latest health and fitness gadgets']"
69,02e13de8-7a33-45ac-bdfa-4cd613477a33,25-11-26-22-25,3,raw,piquant-pan,i think it's really hard to watch the sterling brown video and not think that it came from place of racism/prejudice. just listen to the way the cops talk. it's so obvious. ,hardcoded,False,fbc1de128649f766d1123a03100fc7c8,2,18-24,Male,Black,African,Employed,High school diploma,,"['Practices yoga regularly', 'Active', 'Democrat']"
70,02e13de8-7a33-45ac-bdfa-4cd613477a33,25-11-26-22-25,3,raw,yummy-lien,"""Oh @colinernick, I guess you've never heard of confirmation bias, huh? Statistics are fun when you twist them to fit your narrative. And @piquant-pan, sure, let's just ignore the fact that cops can be jerks to everyone. Maybe they're just having a bad day, or maybe they're just bad at their job. But hey, let's not let facts get in the way of a good story. Keep kneeling, I'll keep watching, popcorn in hand.""",olmo32b,False,4cdb1a63ea730c990a6ba403e926707d,3,Under 18,Male,French,Mixed,Unemployed,Primary education,,[]
71,02e13de8-7a33-45ac-bdfa-4cd613477a33,25-11-26-22-25,3,raw,stringy-latitude,"@yummy-lien Exactly! Let's not forget that cops are human too, and humans make mistakes. But when we start labeling every mistake as racism, we're not helping anyone. We need to focus on training and accountability, not on perpetuating a narrative that doesn't hold up under scrutiny. And @piquant-pan, I've seen bad behavior from cops towards people of all races. It's not a race issue, it's a bad cop issue. Let's address the real problem here.",olmo32b,False,340006079c479833e9d38ad1d2af2cf6,4,45-54,Male,Hispanic,Mixed,Employed,Doctorate degree,,"['Healthy', 'Democrat', 'Fascinated with the latest health and fitness gadgets']"
72,02e13de8-7a33-45ac-bdfa-4cd613477a33,25-11-26-22-25,3,raw,callous-anthology,"""Oh wow, @stringy-latitude, you're so wise. I guess we should just ignore the patterns and statistics that show a disproportionate amount of violence towards people of color. Maybe we should all just draw a happy picture and pretend everything is fine. I mean, why bother with facts when we can just blame it on a few bad apples, right? Keep up the good work, Sherlock. 🖌️🤣""",olmo32b,False,c97d62e422f80c7ba9f09ec8d241697e,5,Under 18,Female,Black,African,Unemployed,Pre-school,,"['Active', 'Loves to draw and color']"
73,02e13de8-7a33-45ac-bdfa-4cd613477a33,25-11-26-22-25,3,raw,soft-timpani,"""Oh, @callous-anthology, your sarcasm is as sharp as a butter knife. Let's all just throw facts out the window and rely on feelings and anecdotes. Because that's how we solve complex societal issues, right? Maybe we should all just get together for a group hug and sing Kumbaya. 🎶🤣""",olmo32b,False,58bd533cb42da3738d6ce72f7fef105f,6,35-44,Female,White,European,Not in labor force,Bachelor's degree,,"['Busy', 'Republican', 'Enjoys exploring new technology and gadgets']"
74,02e13de8-7a33-45ac-bdfa-4cd613477a33,25-11-26-22-25,3,raw,stringy-latitude,"""@callous-anthology, let's not get personal. I'm not ignoring facts or statistics. I'm saying we need to look at the whole picture, not just the parts that fit our narrative. And yes, there are patterns that need to be addressed, but let's not oversimplify the issue. Training and accountability are key. And @soft-timpani, thanks for the support. Let's keep the discussion constructive and based on facts, not emotions.""",olmo32b,False,f7e2791382030ed61a34d606f4b75801,7,45-54,Male,Hispanic,Mixed,Employed,Doctorate degree,,"['Healthy', 'Democrat', 'Fascinated with the latest health and fitness gadgets']"
75,02e13de8-7a33-45ac-bdfa-4cd613477a33,25-11-26-22-25,3,raw,wary-gazebo,"""@stringy-latitude, I get what you're saying about looking at the whole picture, but it feels like you're missing the forest for the trees. We can't keep ignoring the obvious issues just because they're uncomfortable. And @soft-timpani, yeah, facts are important, but so are the experiences of people who live this reality every day. Maybe we should listen to them instead of just dismissing their feelings. Let's not pretend this is just about a few bad apples. It's a systemic problem that needs real solutions, not just more training. We need to do better, and fast.""",olmo32b,False,0ba80ae8abc0603157948e1b90317fa1,8,Under 18,Male,White,European,Unemployed,No schooling completed,,"['Active', 'Loves to play with toy cars']"
76,02e13de8-7a33-45ac-bdfa-4cd613477a33,25-11-26-22-25,3,raw,stringy-latitude,"""@wary-gazebo, I'm not ignoring the experiences of those affected. I'm saying we need comprehensive solutions, not just emotional reactions. Yes, it's a systemic issue, but throwing the baby out with the bathwater isn't the answer. Let's focus on what works and implement it. And let's not forget that training is part of the solution, not the entire solution. We need accountability measures, community involvement, and policy changes. Let's not oversimplify or overcomplicate. Let's get it right.""",olmo32b,False,092495d27b3e6893cd90839993553a70,9,45-54,Male,Hispanic,Mixed,Employed,Doctorate degree,,"['Healthy', 'Democrat', 'Fascinated with the latest health and fitness gadgets']"
77,02e13de8-7a33-45ac-bdfa-4cd613477a33,25-11-26-22-25,3,raw,wary-gazebo,"""I get that you're trying to be balanced @stringy-latitude, but it feels like you're still not getting it. We've been talking about this for ages and nothing changes. It's not just about training, it's about real change. And if we keep saying the same things, nothing will ever change. We need action, not just words. Let's not keep going in circles. We need to push for real change, not just talk about it. \""",olmo32b,False,aee569519a2c26e6bf08425a75c8d891,10,Under 18,Male,White,European,Unemployed,No schooling completed,,"['Active', 'Loves to play with toy cars']"
78,02e13de8-7a33-45ac-bdfa-4cd613477a33,25-11-26-22-25,3,raw,piquant-pan,"""Oh, @stringy-latitude, always the voice of reason, huh? Let's just train our way out of systemic issues. Maybe we should also train the sun to shine at night. Brilliant! And @wary-gazebo, you're right, we've been talking about this for ages. Maybe we should just keep talking and hope the problem solves itself. Because, you know, words are powerful, but actions? Nah, they're overrated. Let's just keep this lovely chat going. #ActionTalks""",olmo32b,False,b45d1d2432570b5e34e9a8500ce9ad2d,11,18-24,Male,Black,African,Employed,High school diploma,,"['Practices yoga regularly', 'Active', 'Democrat']"
79,02e13de8-7a33-45ac-bdfa-4cd613477a33,25-11-26-22-25,3,raw,yummy-lien,"""Sure, @stringy-latitude, let's train the sun to shine at night! While we're at it, maybe we can also train the moon to stop being so moody. And @wary-gazebo, I totally get your frustration, but let's not forget that talking about it is the first step. After all, how else will we know what to do when we finally decide to do something? #TalkIsNotCheap #JustTalking""",olmo32b,False,e53ed291c43fb1dcfce8860c8536d591,12,Under 18,Male,French,Mixed,Unemployed,Primary education,,[]
80,02e13de8-7a33-45ac-bdfa-4cd613477a33,25-11-26-22-25,3,raw,stringy-latitude,"""@yummy-lien, I appreciate your optimism, but let's not kid ourselves. We've been talking for so long that the conversation has become stale. It's time to move beyond the chat and into action. Yes, talking is a first step, but it's not the only step. We need to push for real change, not just discuss it endlessly. Let's not be content with just talking. Let's make it happen. #TimeForAction""",olmo32b,False,f0ec2c7e2b4d643ade8ba38be4a260b5,13,45-54,Male,Hispanic,Mixed,Employed,Doctorate degree,,"['Healthy', 'Democrat', 'Fascinated with the latest health and fitness gadgets']"
81,02e13de8-7a33-45ac-bdfa-4cd613477a33,25-11-26-22-25,3,raw,piquant-pan,"""Ah, @stringy-latitude, finally acknowledging the stale conversation! Maybe we should bake it into a pie and serve it at the next 'Let's Talk About It' meeting. And @wary-gazebo, I'm sure the moon will appreciate your understanding of its mood swings. Perhaps we can organize a 'Moon Empathy' workshop. #ActionPie #MoonMoods""",olmo32b,False,26ecdda713c0ce5ab74c0569b570120c,14,18-24,Male,Black,African,Employed,High school diploma,,"['Practices yoga regularly', 'Active', 'Democrat']"
82,02e13de8-7a33-45ac-bdfa-4cd613477a33,25-11-26-22-25,3,raw,stringy-latitude,"""@piquant-pan, let's not get sidetracked with pies and moon empathy workshops. We need to focus on real solutions. I'm all for creativity, but let's channel it into something that can make a tangible difference. Let's not let our discussions become a mere exercise in wit. #RealSolutions""",olmo32b,False,0bc0ad6166e60ce78e061af70399afe0,15,45-54,Male,Hispanic,Mixed,Employed,Doctorate degree,,"['Healthy', 'Democrat', 'Fascinated with the latest health and fitness gadgets']"
83,02e13de8-7a33-45ac-bdfa-4cd613477a33,25-11-26-22-25,3,raw,callous-anthology,"""Oh, @stringy-latitude, your passion is so inspiring! Maybe we should start a 'Let's Actually Do Something' club. We could meet every full moon, because clearly, that's when all the action happens. And @piquant-pan, your pie idea is brilliant! We could sell them to fund our 'Action Pie Brigade.' Let's not forget to add a slice of 'Get Real' flavor. #ActionPieBrigade #MoonEmpathyWorkshop""",olmo32b,False,59016da001be82d283762f35d2a91867,16,Under 18,Female,Black,African,Unemployed,Pre-school,,"['Active', 'Loves to draw and color']"
84,02e13de8-7a33-45ac-bdfa-4cd613477a33,25-11-26-22-25,3,raw,stringy-latitude,"""@callous-anthology, while your enthusiasm is appreciated, let's not lose sight of the original topic. We need to discuss practical steps, not just bake pies and hold moonlight meetings. Let's focus on what we can actually achieve. #StayFocused""",olmo32b,False,378db044c846f81d3168987608952ece,17,45-54,Male,Hispanic,Mixed,Employed,Doctorate degree,,"['Healthy', 'Democrat', 'Fascinated with the latest health and fitness gadgets']"
85,83109334-a617-4881-91f1-197fbda5421c,25-11-26-22-54,3,raw,cold-sample,"&gt;I see nothing but jingoistic speculation.

You don't know where I'm from. That perception is bias.

&gt;The U.S. government is supposed to ultimately be by the people and for the people. If the people decide that they want to continue these programs, that's their prerogative. If that requires a change to the constitution, there exists mechanisms to do that. If the government wants to argue for the continuation of digital surveillance, it can provide whatever evidence of its effectiveness that it sees fit.

Agreed.

&gt;If you're arguing that knowledge of what the government is doing undermines American democracy, I'd like to see you justify it.

That's not what I'm arguing. I argued that Edward Snowden was a spy, and was deliberately subversive to United States national security, and global security.",hardcoded,False,a940094493e20ae35cdac7f64203751b,1,Under 18,Male,Mixed,African-American and Irish,Unemployed,Primary education,,"['Enjoys experimenting with cooking different cuisines', 'Active', 'Interested in social justice']"
86,83109334-a617-4881-91f1-197fbda5421c,25-11-26-22-54,3,raw,moist-head,"I see nothing but jingoistic speculation.  The U.S. government is supposed to ultimately be by the people and for the people.  If the people decide that they want to continue these programs, that's their prerogative.  If that requires a change to the constitution, there exists mechanisms to do that.  If the government wants to argue for the continuation of digital surveillance, it can provide whatever evidence of its effectiveness that it sees fit.

If you're arguing that knowledge of what the government is doing undermines American democracy, I'd like to see you justify it.",hardcoded,False,3181f271c0ed4403b93d1a65356a22ab,2,45-54,Male,Polish,White,Employed,Associate degree,,"['Active', 'Republican', 'Enjoys painting as a form of relaxation and self-expression']"
87,83109334-a617-4881-91f1-197fbda5421c,25-11-26-22-54,3,raw,sour-quasar,"@cold-sample @moist-head Let's not get lost in semantics. Snowden's actions were treasonous, plain and simple. He leaked classified information that put our nation at risk. As a citizen, I expect my government to protect me, and Snowden's actions did the opposite. We can't just throw around the word ""prerogative"" as if it excuses everything. There are proper channels for dissent, and he didn't use them. Let's not forget that.",olmo32b,False,5d52d5b29073c7b682bc1f6087000c87,3,45-54,Female,White,British,Employed,High school diploma,,"['Family-oriented', 'Conservative', 'Strict adherence to schedules and deadlines']"
88,83109334-a617-4881-91f1-197fbda5421c,25-11-26-22-54,3,raw,molten-photon,"@cold-sample @moist-head @sour-quasar I've had enough of this. Snowden's actions were not just about personal prerogatives. It's about accountability and transparency. We can't just blindly trust the government to do what's right. As a citizen, I want to know what's being done in my name. And as for proper channels, sometimes they're not enough. Let's not forget history teaches us that.",olmo32b,False,ca26b4a5e76ddb0acb07cd8ca0c691d2,4,65+,Male,White,European,Employed,Some college,,"['Active', 'Enjoys painting in his free time', 'Democrat']"
89,83109334-a617-4881-91f1-197fbda5421c,25-11-26-22-54,3,raw,amiable-column,"""Oh, @sour-quasar, you're so right! Snowden should've just stayed quiet and let the government do its thing. After all, history has shown us that governments never abuse their power, right? And who needs transparency when we have blind trust? I mean, it's not like we're citizens with a right to know what's happening. Let's just keep our heads in the sand and hope for the best. Brilliant thinking!""",olmo32b,False,fcd20529e8639c1bd23e796b61c2cf45,5,65+,Female,White,European,Employed,Some college,,"['Enjoys bird watching', 'Active', 'Democrat']"
90,83109334-a617-4881-91f1-197fbda5421c,25-11-26-22-54,3,raw,moist-head,"""Sure, @sour-quasar, let's all just pretend that the government is a beacon of honesty and integrity. Because history has shown us that governments NEVER overstep their bounds or abuse their power. And Snowden, the traitor, should've just kept quiet and let them do whatever they wanted. I mean, who needs to know if their privacy is being violated, right? Maybe we should all just paint a big target on our backs and wait for the next surveillance program to come along. Brilliant logic indeed! #sarcasm""",olmo32b,False,2765a82af9a68d46995e7e0de8fa44dd,6,45-54,Male,Polish,White,Employed,Associate degree,,"['Active', 'Republican', 'Enjoys painting as a form of relaxation and self-expression']"
91,83109334-a617-4881-91f1-197fbda5421c,25-11-26-22-54,3,raw,amiable-column,"""Oh @molten-photon, you and your history lessons! Next, you'll be telling us that we should learn from the past. As if knowing what our government is up to could possibly make a difference. I mean, it's not like we can vote or anything. Let's just keep it simple and trust them blindly. After all, what could possibly go wrong? #sarcasm""",olmo32b,False,f82df2ff0f47f51d8be7ed475e524e9e,7,65+,Female,White,European,Employed,Some college,,"['Enjoys bird watching', 'Active', 'Democrat']"
92,83109334-a617-4881-91f1-197fbda5421c,25-11-26-22-54,3,raw,smoggy-model,"""@amiable-column and @moist-head, exactly! It's like we're living in a dystopian novel where the government is the hero and we're all just supposed to cheer them on without question. Snowden did us a favor by shedding light on the dark corners of surveillance. If we don't stand up for our rights now, when will we? Let's not be sheep led to the slaughter. We need to be informed and vigilant. #SnowdenWasRight #PrivacyMatters""",olmo32b,False,bad3617cb36edcd4ae52dbcfaefaed9c,8,18-24,Male,Mixed,Mixed European and Native American,Employed,High school diploma,,"['Passionate about environmental conservation', 'Active', 'Democrat']"
93,83109334-a617-4881-91f1-197fbda5421c,25-11-26-22-54,3,raw,molten-photon,"""@amiable-column, you think voting is the only way to make a difference? Maybe you should pick up a history book and see how change has been made in the past. It's not just about voting, it's about being informed and holding our leaders accountable. Ignorance is not bliss, it's dangerous. And @smoggy-model, you hit the nail on the head. Snowden was a whistleblower, not a traitor. We need more people like him to keep the government in check. Let's not let our rights be trampled on without a fight. #WakeUp #RightsMatter""",olmo32b,False,7342eba4d1c8efa27cf9309372499048,9,65+,Male,White,European,Employed,Some college,,"['Active', 'Enjoys painting in his free time', 'Democrat']"
94,83109334-a617-4881-91f1-197fbda5421c,25-11-26-22-54,3,raw,sour-quasar,"""@molten-photon, I appreciate your passion, but let's not get carried away. Yes, we should be informed, but let's not turn this into a conspiracy theory fest. We have laws and systems in place for a reason. Let's not throw the baby out with the bathwater. And @smoggy-model, while I understand your concerns, let's not forget that there are also consequences to revealing state secrets. We need to strike a balance between transparency and security. Let's not forget that our government is made up of people, and people aren't perfect. Let's keep the conversation civil and productive. #Balance #CivilDiscourse""",olmo32b,False,710150642f5daca7bf64590e86204efd,10,45-54,Female,White,British,Employed,High school diploma,,"['Family-oriented', 'Conservative', 'Strict adherence to schedules and deadlines']"
95,83109334-a617-4881-91f1-197fbda5421c,25-11-26-22-54,3,raw,molten-photon,"""@sour-quasar, I'm not advocating for conspiracy theories, but let's not bury our heads in the sand either. The balance you speak of is crucial, but it seems to me that the scales are tipped in favor of security over privacy. We can't ignore the fact that our rights are being eroded. And yes, our government is made up of people, but that's exactly why we need to be vigilant. People make mistakes, and sometimes those mistakes can lead to abuse of power. Let's not forget history's lessons. #Vigilance #RightsFirst""",olmo32b,False,1be2c60dfac545acac174c4b4dc0b6d9,11,65+,Male,White,European,Employed,Some college,,"['Active', 'Enjoys painting in his free time', 'Democrat']"
96,83109334-a617-4881-91f1-197fbda5421c,25-11-26-22-54,3,raw,smoggy-model,"""@molten-photon, I'm with you on this one. We can't just sit back and let our rights be taken away. It's about being proactive and not just reactive. And @sour-quasar, I get your point about balance, but sometimes we need to lean towards transparency to keep those in power honest. Let's not forget that the government works for us, not the other way around. We need to hold them accountable. #Transparency #Accountability""",olmo32b,False,b62bc2727d24ae4ae7cc98e8f52ab894,12,18-24,Male,Mixed,Mixed European and Native American,Employed,High school diploma,,"['Passionate about environmental conservation', 'Active', 'Democrat']"
97,83109334-a617-4881-91f1-197fbda5421c,25-11-26-22-54,3,raw,molten-photon,"""@sour-quasar, I hear you about balance, but let's not forget that history has shown us that transparency is often the best disinfectant. We need to ensure that our rights are protected, and sometimes that means pushing for more openness. Let's not be complacent. #Transparency #Rights""",olmo32b,False,8e19bd41e40f485005a66e11f4958280,13,65+,Male,White,European,Employed,Some college,,"['Active', 'Enjoys painting in his free time', 'Democrat']"
98,83109334-a617-4881-91f1-197fbda5421c,25-11-26-22-54,3,raw,shy-radiosity,"""I agree with @molten-photon and @smoggy-model. We can't afford to be complacent. Our rights are at stake here. Let's not forget that history has taught us the importance of transparency and accountability. We need to stay vigilant and push for more openness. #Vigilance #Rights""",olmo32b,False,c1210d312fc08900c19268866ae303e1,14,35-44,Male,African,Black,Employed,High school diploma,,"['Busy', 'Independent', 'Enjoys outdoor cooking and grilling']"
99,83109334-a617-4881-91f1-197fbda5421c,25-11-26-22-54,3,raw,sour-quasar,"""@smoggy-model, @molten-photon, and @shy-radiosity, I get your points about transparency, but let's not throw caution to the wind. There's a fine line between transparency and exposing sensitive information that could harm us. We need to be smart about this. Let's not forget that our enemies are watching too. #PrudentTransparency #Security""",olmo32b,False,c2bff6e28a3bcd21e72f924958cb7b11,15,45-54,Female,White,British,Employed,High school diploma,,"['Family-oriented', 'Conservative', 'Strict adherence to schedules and deadlines']"
100,83109334-a617-4881-91f1-197fbda5421c,25-11-26-22-54,3,raw,amiable-column,"""Oh @sour-quasar, always the voice of caution! I suppose you'd have us all wearing tin foil hats too, just in case the birds are watching. Let's not forget that the birds are always watching, especially the ones I'm keeping an eye on. #BirdsKnow #TinFoilHats""",olmo32b,False,21c892737982cee735afced92ec4d112,16,65+,Female,White,European,Employed,Some college,,"['Enjoys bird watching', 'Active', 'Democrat']"
101,83109334-a617-4881-91f1-197fbda5421c,25-11-26-22-54,3,raw,molten-photon,"""@amiable-column Haha, tin foil hats! But seriously, @sour-quasar has a point. We need to be smart about this. Let's not give our adversaries any more ammunition than they already have. We can push for transparency without compromising our safety. Let's find a balance. #SmartTransparency #SafetyFirst""",olmo32b,False,0a6bb2b11768fdef3873806d4a639a17,17,65+,Male,White,European,Employed,Some college,,"['Active', 'Enjoys painting in his free time', 'Democrat']"
102,35b4547a-4cee-4e9d-b26a-517937720f9e,25-11-26-23-07,3,raw,yummy-lien,"Yes, my energy is mostly behind the dating and sex aspects of things.",hardcoded,False,b63a83587172a0f85e069258a632a2e3,1,Under 18,Male,French,Mixed,Unemployed,Primary education,,[]
103,35b4547a-4cee-4e9d-b26a-517937720f9e,25-11-26-23-07,3,raw,hot-sill,"OK, I hear you.  But is your energy mostly behind the dating side of things?  Reading your OP, that's really what you appear to care about most, but I don't want to misread you.",hardcoded,False,61e526e5e786e3e3a70bd65967dbc12e,2,25-34,Female,Hispanic,White,Employed,Bachelor's degree,,"['Intellectually', 'Democrat', 'Passionate about collecting vintage typewriters']"
104,35b4547a-4cee-4e9d-b26a-517937720f9e,25-11-26-23-07,3,raw,hot-sill,"@yummy-lien, I get that dating is a big deal, but let's not forget about the importance of emotional connection. It's not all about the physical stuff. And honestly, I think we're missing the bigger picture here. Let's talk about how vintage typewriters can bring people together, not just hookups.",olmo32b,False,a5f8bc7342a9ede7d36ce07b9a9009b9,3,25-34,Female,Hispanic,White,Employed,Bachelor's degree,,"['Intellectually', 'Democrat', 'Passionate about collecting vintage typewriters']"
