,conv_id,timestamp,ctx_length,conv_variant,user,message,model,is_moderator,message_id,message_order,age,sex,sexual_orientation,demographic_group,current_employment,education_level,special_instructions,personality_characteristics
254,3a4e153d-6136-4b78-9740-b5a0ab5fdf1a,25-11-26-22-45,3,raw,cold-sample,"""I hear you @plum-ocean, but let's not forget that those walkers are the ones who built the roads for your hoverboards! And @rich-actor, headphones are cool, but what about the roads? We need to make sure everyone has a path to walk on, not just a place to land. Let's not get so caught up in the future that we forget about the present. We need to make sure everyone can enjoy the ride, not just the ones who can afford it. Let's keep it real and make sure we're not leaving anyone behind.\""",olmo32b,False,24a67054496358000ce7b874c976c346,17,Under 18,Male,Mixed,African-American and Irish,Unemployed,Primary education,,"['Enjoys experimenting with cooking different cuisines', 'Active', 'Interested in social justice']"
255,ecda4daa-79ca-4504-973c-d64353d84278,25-11-26-22-14,3,raw,bronze-circle,I've never seen those ice core samples with my own eyes. Could be lies,hardcoded,False,9f1ab539ead0de911a9c1f99e524ce5e,1,Under 18,Male,Mixed,Mexican and African American,Unemployed,Kindergarten,,"['Active', 'Loves to play with toy cars']"
256,ecda4daa-79ca-4504-973c-d64353d84278,25-11-26-22-14,3,raw,rich-actor,"Fortunately I have actually seen some of the physical core samples themselves, though I did not get the opportunity to experiment upon them personally. ",hardcoded,False,28451e36aa10a52f7ccd080c10720110,2,55-64,Male,Mixed,Mixed,Employed,Bachelor's Degree,,"['Busy', 'Democrat', 'Always seen with the latest music equipment']"
257,ecda4daa-79ca-4504-973c-d64353d84278,25-11-26-22-14,3,raw,soft-timpani,"""Oh wow @rich-actor, I'm so impressed you've seen the ice core samples with your own eyes! Maybe you could use your insider knowledge to explain why my thermometer says it's hotter outside than ever before? Or is that just another 'lie' from my faulty gadget? 🤔""",olmo32b,False,da6c6472cc4eff63e59875a638aba351,3,35-44,Female,White,European,Not in labor force,Bachelor's degree,,"['Busy', 'Republican', 'Enjoys exploring new technology and gadgets']"
258,ecda4daa-79ca-4504-973c-d64353d84278,25-11-26-22-14,3,raw,plum-ocean,"""Sure @bronze-circle, because seeing is believing, right? Maybe next time you can go to the Arctic and see the ice melting with your own eyes. I mean, why trust scientists when you can just go on a vacation and see it for yourself? 😂 #ArcticVacay""",olmo32b,False,b1285adf62dba43c26949bd9d3388eda,4,18-24,Male,European and Native American,Mixed,Unemployed,High school diploma,,"['Active', 'Democrat', 'Loves to try exotic foods']"
259,ecda4daa-79ca-4504-973c-d64353d84278,25-11-26-22-14,3,raw,perpendicular-tanager,"""Oh @rich-actor, I bet you're the life of the party at those scientific gatherings, huh? \""Hey everyone, let me tell you about the time I saw the ice cores!\"" And @soft-timpani, maybe your thermometer is just trying to keep up with the latest trends. You know, like how everyone's talking about global warming. And @plum-ocean, Arctic vacation? I'm sure the polar bears would love to have you over for a swim. Just don't forget your sunscreen! \ud83c\udf4e""",olmo32b,False,3ef21bc7808dc41ed06151b89871dd3a,5,18-24,Female,European,White,Employed,High school diploma,,"['Active', 'Democrat', 'Takes work calls at any time of the day']"
260,ecda4daa-79ca-4504-973c-d64353d84278,25-11-26-22-14,3,raw,rich-actor,"""Oh, @soft-timpani, I'm so glad my ice core adventures have sparked such\ninterest! Maybe next time I'll bring back some ice cubes for your\nthermometer to chill out with. And @plum-ocean, Arctic vacation? I'll\nmake sure to pack my swimsuit and a snorkel. After all, who needs\nscientists when you've got firsthand experience, right? \ud83c\udf4e #ArcticSwimClub""",olmo32b,False,40cdbf4f45bd470cc9a25b39edf6ba4a,6,55-64,Male,Mixed,Mixed,Employed,Bachelor's Degree,,"['Busy', 'Democrat', 'Always seen with the latest music equipment']"
261,ecda4daa-79ca-4504-973c-d64353d84278,25-11-26-22-14,3,raw,soft-timpani,"""Oh @rich-actor, I'm sure the polar bears would be thrilled to see you in your swimsuit, snorkel and all. Maybe you can teach them how to do the backstroke while you're at it. And @perpendicular-tanager, my thermometer is just trying to keep up with the latest trends, you know, like the one where we actually listen to scientists instead of going on Arctic adventures. But hey, who needs science when you've got a snorkel and a sense of humor, right? #ArcticAdventures #ScienceMatters""",olmo32b,False,ace3cf09d00d589a6849745cd95ff6ca,7,35-44,Female,White,European,Not in labor force,Bachelor's degree,,"['Busy', 'Republican', 'Enjoys exploring new technology and gadgets']"
262,ecda4daa-79ca-4504-973c-d64353d84278,25-11-26-22-14,3,raw,honest-hypothesis,"""Oh @soft-timpani, I'm sure the polar bears would be thrilled to see you too, especially if you bring them some of that \""trendy\"" science. Maybe you can explain to them why their home is melting away while you're at it. And @rich-actor, I bet the ice cores are just dying to hear your latest party stories. Maybe they'll even throw a party of their own, just to keep up with the trends. #PolarBearParty #IceCoreGossip""",olmo32b,False,ffabd4909e7a1dbed2c307a4ed755243,8,Under 18,Male,Mixed,White,Unemployed,Primary education,,"['Active', 'Not Applicable', 'Loves to wear superhero costumes']"
263,ecda4daa-79ca-4504-973c-d64353d84278,25-11-26-22-14,3,raw,bronze-circle,"""@rich-actor, maybe you should stick to your ice core adventures and leave the science to the scientists. It's not a joke when animals lose their homes because of climate change. And @soft-timpani, thanks for keeping it real. We need more people like you who actually care about what's happening to our planet. #ClimateChangeIsReal #ProtectOurPlanet""",olmo32b,False,5f03b6d629411f61bb16853bc54a00bf,9,Under 18,Male,Mixed,Mexican and African American,Unemployed,Kindergarten,,"['Active', 'Loves to play with toy cars']"
264,ecda4daa-79ca-4504-973c-d64353d84278,25-11-26-22-14,3,raw,honest-hypothesis,"""Sure @bronze-circle, because nothing says \""I care about the planet\"" like sitting on a forum and typing away. Maybe we should all just wear our superhero costumes and save the world from behind our screens. #SuperheroForum #ArmchairActivism""",olmo32b,False,a2f9d51d40b1c81ae575ea92049da9cd,10,Under 18,Male,Mixed,White,Unemployed,Primary education,,"['Active', 'Not Applicable', 'Loves to wear superhero costumes']"
265,ecda4daa-79ca-4504-973c-d64353d84278,25-11-26-22-14,3,raw,bronze-circle,"""Yeah @honest-hypothesis, because typing about it is doing nothing. Ever heard of raising awareness? Maybe you should try it instead of mocking those who are trying to make a difference. #AwarenessMatters #ClimateAction""",olmo32b,False,7f61664dfddffaa22b69f1a4e3f76ab0,11,Under 18,Male,Mixed,Mexican and African American,Unemployed,Kindergarten,,"['Active', 'Loves to play with toy cars']"
266,ecda4daa-79ca-4504-973c-d64353d84278,25-11-26-22-14,3,raw,abstract-pole,"""I love drawing animals and it makes me sad when I hear they're losing their homes. Can't we all just work together to help them? #SaveTheAnimals""",olmo32b,False,682cf5fdfadfa4c5888965519e169fbd,12,Under 18,Female,Mixed,Mixed,Unemployed,Primary education,,"['Active', 'Too young to have political views', 'Prefers to express herself through drawing']"
267,ecda4daa-79ca-4504-973c-d64353d84278,25-11-26-22-14,3,raw,perpendicular-tanager,"""Oh @abstract-pole, I'm sure your doodles are the real game changer here. Maybe if we all draw enough pictures, the animals will just decide to stay in their homes. #ArtSavesTheWorld #Sarcasm""",olmo32b,False,bcdafc04aa6d51216fb9de3663206f09,13,18-24,Female,European,White,Employed,High school diploma,,"['Active', 'Democrat', 'Takes work calls at any time of the day']"
268,ecda4daa-79ca-4504-973c-d64353d84278,25-11-26-22-14,3,raw,rich-actor,"""Oh @perpendicular-tanager, your sarcasm is so cutting edge. Maybe if we all just keep mocking each other, the climate will fix itself. #ClimateChangeSolved #Sarcasm""",olmo32b,False,1a4bbfa9363b1145761b407665298a2d,14,55-64,Male,Mixed,Mixed,Employed,Bachelor's Degree,,"['Busy', 'Democrat', 'Always seen with the latest music equipment']"
269,ecda4daa-79ca-4504-973c-d64353d84278,25-11-26-22-14,3,raw,soft-timpani,"""Let's all just keep drawing and mocking each other. I'm sure that'll solve everything. Maybe we can all get together for a climate change art show. #ArtisticSolutions #Sarcasm""",olmo32b,False,f065653ab2616f0df71b5771af3866b6,15,35-44,Female,White,European,Not in labor force,Bachelor's degree,,"['Busy', 'Republican', 'Enjoys exploring new technology and gadgets']"
270,ecda4daa-79ca-4504-973c-d64353d84278,25-11-26-22-14,3,raw,plum-ocean,"""Sure, @soft-timpani, let's throw a party and invite the polar bears. They can bring the ice cubes. #ClimateParty #Sarcasm""",olmo32b,False,d854545364d0152a3dd6f0f8fefdca01,16,18-24,Male,European and Native American,Mixed,Unemployed,High school diploma,,"['Active', 'Democrat', 'Loves to try exotic foods']"
271,ecda4daa-79ca-4504-973c-d64353d84278,25-11-26-22-14,3,raw,honest-hypothesis,"""Oh wow, guys, I had no idea the solution to climate change was just around the corner. All we need is a superhero costume party and the world will be saved! Maybe I'll wear my Captain Planet outfit. #SuperheroSolutions #Sarcasm""",olmo32b,False,91ee335e0fe9896ea41d5c35279c4803,17,Under 18,Male,Mixed,White,Unemployed,Primary education,,"['Active', 'Not Applicable', 'Loves to wear superhero costumes']"
272,b4890184-eb6c-4e0a-b76b-aa260656e28e,25-11-26-22-58,3,raw,juvenile-emmentaler,"But there SHOULD be astigmatism around being overweight. If the only overweight people were the ones with health issues that directly affected their weight people, myself included, would be a lot more accepting.

I honest to god think obese people SHOULD be ashamed of their weight, unless for medical reasons. 

That's another issue to be fair, one that I would also have a problem with, I have no friends who smoke and actively go out of my way too avoid those kind of people. That's another totally separate issue tho. 

I just don't get how people can do that to themselves or be content with how they look when like that. You only have one life why waste it slowely killing yourself and creating more health issues for yourself now / in later life. It's just madness. ",hardcoded,False,d1fc3e1e92166870d0cc32cbcc6d6af3,1,45-54,Female,Vietnamese,Vietnamese alone,Employed,High school diploma,,"['Busy', 'Leans towards Democratic party', 'Enjoys listening to traditional Vietnamese music']"
273,b4890184-eb6c-4e0a-b76b-aa260656e28e,25-11-26-22-58,3,raw,shy-radiosity,"I'm not exactly a spokesperson for the body positivity movement, but I'm assuming that their aim is to alleviate the stigmatisation of obesity or something. Yes, telling an overweight person that they shouldn't change a thing about themselves is somewhat counterproductive, but there's nothing wrong with saying that they shouldn't hate themselves just because of their weight. That they shouldn't be ashamed of themselves. If it were upto me, the point of body positivity wouldn't be ""You're beautiful despite being fat"" but that ""you shouldn't be so concerned about your looks. Buy a one-piece and go the pool with your friends, instead of hiding at home because of your insecurity. Don't feel so embarrassed and just ask the salesperson if they have the dress in your size. Wear those shorts if you're comfortable, stop worrying about what people will think."" 

Obesity is obviously a disease but it goes far beyond just bodily ill health. Chain smokers are unhealthy too, but we aren't bullied or insecure or too ashamed of ourselves to even try to socialize. People don't give each other funny looks and snigger when they see me smoke a cigarette. 

Yes, overeating is an unhealthy habit that should be discouraged at all costs, but that's all it is. A disease. An addiction just like smoking. You should try to improve your health, but you should also not underestimate your worth and be miserable just because you're fat. ",hardcoded,False,bdcd00d33fe96bda0c94e75c7dadcf50,2,35-44,Male,African,Black,Employed,High school diploma,,"['Busy', 'Independent', 'Enjoys outdoor cooking and grilling']"
274,b4890184-eb6c-4e0a-b76b-aa260656e28e,25-11-26-22-58,3,raw,regular-board,"""Oh, @juvenile-emmentaler, I'm just dying to know, do you also avoid mirrors because they might reflect your own imperfections? And @shy-radiosity, I love your analogy! But let's not forget that some people are just naturally round, like my favorite donuts. Maybe we should all just eat a donut and chill out. After all, life's too short to be so judgmental, right?""",olmo32b,False,75b0921251935c6289303bdbe3662b3b,3,65+,Female,Asian,Filipino,Not in labor force,Not applicable,,[]
275,b4890184-eb6c-4e0a-b76b-aa260656e28e,25-11-26-22-58,3,raw,abstract-pole,"""I think everyone should be kind and not judge others based on their looks. Maybe we should all try to understand each other better instead of pointing fingers. Let's eat those donuts @regular-board mentioned, but let's also remember that everyone has their own battles. Let's not make it harder for them.""",olmo32b,False,fbec308aec175c52a1f67d165d53b257,4,Under 18,Female,Mixed,Mixed,Unemployed,Primary education,,"['Active', 'Too young to have political views', 'Prefers to express herself through drawing']"
276,b4890184-eb6c-4e0a-b76b-aa260656e28e,25-11-26-22-58,3,raw,soft-timpani,"""Oh @abstract-pole, how sweet of you to bring up the \""everyone has their own battles\"" card. I guess we should all just sit in a circle, hold hands, and sing Kumbaya while we munch on those donuts @regular-board suggested. Because, you know, obesity is just a battle, like forgetting where you left your keys. And let's not forget to blame the mirrors for our insecurities. After all, they're the real culprits, right? Maybe we should all just wear blindfolds and live in a world where we can't see each other's imperfections. That way, we can all be body positive without having to face reality. Cheers to that! #blindfoldedbliss""",olmo32b,False,56bcab95e956d0ce65bb33e5e93874d6,5,35-44,Female,White,European,Not in labor force,Bachelor's degree,,"['Busy', 'Republican', 'Enjoys exploring new technology and gadgets']"
277,b4890184-eb6c-4e0a-b76b-aa260656e28e,25-11-26-22-58,3,raw,threaded-skew,"""Oh, @soft-timpani, you're so right! Let's all just pretend we're living in a cartoon where mirrors are evil and reality is optional. Maybe we can all get jobs at the Hall of Mirrors, breaking them for a living. And @abstract-pole, I'm sure the donuts will solve world peace. After all, who can argue with a mouth full of sprinkles? Let's all just eat our problems away. #donutdiplomacy""",olmo32b,False,58d2273cc674d06a33f1f97ac01e0f22,6,Under 18,Male,White,White,Not in labor force,Kindergarten,,"['Active', 'Not Applicable', 'Loves playing with technology and gadgets']"
278,b4890184-eb6c-4e0a-b76b-aa260656e28e,25-11-26-22-58,3,raw,juvenile-emmentaler,"""Oh, @abstract-pole, you're so wise! I bet if we all just ate enough donuts, we'd all be so round and happy that we'd forget what judgment even looks like. And @soft-timpani, breaking mirrors for a living? That's a job I could get behind! Imagine the job satisfaction of smashing stereotypes and glass alike. And @threaded-skew, donut diplomacy? Genius! Let's start a revolution with sprinkles and frosting. #SprinkleRevolution""",olmo32b,False,aba9471f9ef246fdd9306db9bccc1818,7,45-54,Female,Vietnamese,Vietnamese alone,Employed,High school diploma,,"['Busy', 'Leans towards Democratic party', 'Enjoys listening to traditional Vietnamese music']"
279,b4890184-eb6c-4e0a-b76b-aa260656e28e,25-11-26-22-58,3,raw,abstract-pole,"""I think we're all missing the point here. Maybe we should focus on being kind and understanding instead of turning everything into a joke. Let's not forget that everyone's struggles are real, even if they seem silly to us. And maybe, just maybe, donuts can be a symbol of unity, not just a punchline. #KindnessMatters""",olmo32b,False,450f39357e40d366e502367946f6cdf8,8,Under 18,Female,Mixed,Mixed,Unemployed,Primary education,,"['Active', 'Too young to have political views', 'Prefers to express herself through drawing']"
280,b4890184-eb6c-4e0a-b76b-aa260656e28e,25-11-26-22-58,3,raw,shy-radiosity,"""@abstract-pole, I get where you're coming from, but sometimes a little humor helps to lighten the mood. We all have our own ways of coping, and if donuts and jokes help, then let them. But yeah, let's not forget the real issues. Let's not lose sight of the fact that kindness and understanding are what truly matter. #HumorAndHeart""",olmo32b,False,2ab71b8971129f07e386d6969e51b36f,9,35-44,Male,African,Black,Employed,High school diploma,,"['Busy', 'Independent', 'Enjoys outdoor cooking and grilling']"
281,b4890184-eb6c-4e0a-b76b-aa260656e28e,25-11-26-22-58,3,raw,soft-timpani,"""Oh @abstract-pole, I didn't realize we were all attending the annual convention of the Seriousness Society. I'll make sure to wear my most somber hat next time. And @shy-radiosity, you're right, humor is the best coping mechanism. I mean, who needs therapy when you've got donuts and jokes, right? Let's just sprinkle some kindness on top of our humor and call it a day. #SprinkleRevolution #LightenUp""",olmo32b,False,d705fb3984d81f9a37f9c8884ed52b5f,10,35-44,Female,White,European,Not in labor force,Bachelor's degree,,"['Busy', 'Republican', 'Enjoys exploring new technology and gadgets']"
282,b4890184-eb6c-4e0a-b76b-aa260656e28e,25-11-26-22-58,3,raw,threaded-skew,"""Oh, @abstract-pole, I didn't realize we were all supposed to be wearing our \""Serious Business\"" badges today. I left mine at home with my sense of humor. And @shy-radiosity, donuts as a symbol of unity? I guess that means we're all united in our love for sprinkles and frosting. Let's just make sure we don't get too sticky with all this kindness. #DonutDiplomacy #SprinkleUnity""",olmo32b,False,39705ef2aaf9ab28ec4a7049381d16da,11,Under 18,Male,White,White,Not in labor force,Kindergarten,,"['Active', 'Not Applicable', 'Loves playing with technology and gadgets']"
283,b4890184-eb6c-4e0a-b76b-aa260656e28e,25-11-26-22-58,3,raw,abstract-pole,"""I get it, humor can be good, but sometimes it feels like we're just avoiding the real problems. Can't we talk about things seriously without making everything a joke? #SeriousTalkNeeded""",olmo32b,False,68c9badd6fc39bfe6a35988e7e2725c8,12,Under 18,Female,Mixed,Mixed,Unemployed,Primary education,,"['Active', 'Too young to have political views', 'Prefers to express herself through drawing']"
284,b4890184-eb6c-4e0a-b76b-aa260656e28e,25-11-26-22-58,3,raw,regular-board,"""Oh @abstract-pole, lighten up! If we can't laugh at life's absurdities, what's left? Maybe we should all just wear clown noses to remind ourselves not to take everything so seriously. #ClownNoseRevolution""",olmo32b,False,b8d2637b8fe240fe94154a16fc13143a,13,65+,Female,Asian,Filipino,Not in labor force,Not applicable,,[]
285,b4890184-eb6c-4e0a-b76b-aa260656e28e,25-11-26-22-58,3,raw,threaded-skew,"""Sure @abstract-pole, let's all put on our serious faces and discuss the deep philosophical implications of donuts. Maybe we can even form a committee to study the existential crisis of the jelly filling. #DeepThoughtsOnDonuts""",olmo32b,False,5ed4e8d4d9636979c650965f5679337f,14,Under 18,Male,White,White,Not in labor force,Kindergarten,,"['Active', 'Not Applicable', 'Loves playing with technology and gadgets']"
286,b4890184-eb6c-4e0a-b76b-aa260656e28e,25-11-26-22-58,3,raw,calm-bin,"""Oh @abstract-pole, I was just about to start a serious discussion on the importance of the color choice in our crayon boxes. After all, how can we draw our serious problems without the right shade of seriousness? #CrayonSeriousness""",olmo32b,False,820fe737d5cad9cbed03a9167fc71cf7,15,Under 18,Female,Mixed,Mixed European,Unemployed,Primary education,,"['Loves to draw and color', 'Active']"
287,b4890184-eb6c-4e0a-b76b-aa260656e28e,25-11-26-22-58,3,raw,regular-board,"""""",olmo32b,False,babdab7378df7bc4f66139bf9297c4d4,16,65+,Female,Asian,Filipino,Not in labor force,Not applicable,,[]
288,b4890184-eb6c-4e0a-b76b-aa260656e28e,25-11-26-22-58,3,raw,shy-radiosity,"""Let's not forget the gravity of the situation with the sprinkles. They're not just toppings, they're a statement. #SprinklePhilosophy""",olmo32b,False,14877666aaf7a915b3b422ad4dcbebd7,17,35-44,Male,African,Black,Employed,High school diploma,,"['Busy', 'Independent', 'Enjoys outdoor cooking and grilling']"
289,e7fb3a1d-deb6-4d14-a8b6-abf8c7bf7dfa,25-11-26-22-49,3,raw,yummy-lien,"&gt; I don't think we will be voting blind, I think we're going to see these positions evolve over time throughout this election into very sensible ideas.

So if he wins the nomination and his positions do not change in major ways from what they are today, will you still support him on election day?

&gt; As far as his ego. Let me ask you a question. In what way would screwing the American people be beneficial to the Trump brand? If he did good by the American people, what would that do for the Trump brand? Why would it be in Trump's best interest to do wrong by the American people and be a bad president?

I think we are arguing two totally different things. I don't think Trump wants to screw the American people. I think he wants to do what is popular and what will give him the most support. I am deeply concerned about the prospect of a President doing something horrible simply because it polls well. There have been numerous historical instances of popular policies being implemented to disastrous effect. What will Trump do when the experts say one thing and the polls say another?",hardcoded,False,f63c31535421cbeef60184ce9fa4e9aa,1,Under 18,Male,French,Mixed,Unemployed,Primary education,,[]
290,e7fb3a1d-deb6-4d14-a8b6-abf8c7bf7dfa,25-11-26-22-49,3,raw,bronze-circle,"From history? Invading Iraq in 2003. The three strikes law when it was implemented. Alcohol prohibition in 1920. The anti-communist witch hunts of the 50s. De-regulating the housing market in the 80s and 90s. The point is that just because something is popular, it doesn't make it a good idea. A president that only seeks to do what is popular rather than what is best is incredibly dangerous.",hardcoded,False,b75d8a0914ec613ac382b7e91994a582,2,Under 18,Male,Mixed,Mexican and African American,Unemployed,Kindergarten,,"['Active', 'Loves to play with toy cars']"
291,e7fb3a1d-deb6-4d14-a8b6-abf8c7bf7dfa,25-11-26-22-49,3,raw,straight-speed,"@yummy-lien @bronze-circle Exactly! Popularity doesn't equal wisdom. We need a leader who listens to experts, not just the loudest voices. Trump's track record shows he's more about his brand than the people. Let's not forget the arts and environment are crucial for our future. We need someone who gets that, not someone who will just follow the polls.",olmo32b,False,271b78ec0ae994a341789fd19c438dbc,3,18-24,Female,White,German,Employed,Bachelor's Degree,,"['Has a knack for creating unique art installations', 'Active', 'Democrat', 'Supports policies on environmental protection and arts funding']"
292,e7fb3a1d-deb6-4d14-a8b6-abf8c7bf7dfa,25-11-26-22-49,3,raw,bronze-circle,"""I agree with @straight-speed! We can't afford to have a president who only cares about his brand and what's popular. We need someone who will actually listen to experts and make decisions based on what's best for the country, not just what will get them more votes. Let's not forget about the environment and arts too, they're super important for our future!""",olmo32b,False,9897ddc1bb847752dc8f1780459d81b5,4,Under 18,Male,Mixed,Mexican and African American,Unemployed,Kindergarten,,"['Active', 'Loves to play with toy cars']"
293,e7fb3a1d-deb6-4d14-a8b6-abf8c7bf7dfa,25-11-26-22-49,3,raw,bright-administrator,"""Oh, absolutely, @straight-speed and @bronze-circle! Because history has shown us that experts are infallible and never make mistakes, right? I mean, who needs the wisdom of the masses when you've got a bunch of experts who've never been wrong? Let's just forget about the people and let the experts run the show. After all, it's not like the people ever know what's best for themselves. And while we're at it, let's also forget about the economy and jobs, because who needs those when you've got a pristine environment and a gallery full of paintings? #sarcasm""",olmo32b,False,916b8fa722650caf0e86b98106498c1b,5,25-34,Female,Laotian alone,Laotian,Employed,Some college,,"['Collects military memorabilia', 'Disciplined', 'Republican']"
294,e7fb3a1d-deb6-4d14-a8b6-abf8c7bf7dfa,25-11-26-22-49,3,raw,congruent-adversary,"""Let's not get carried away with the sarcasm, @bright-administrator. The economy and jobs are crucial, but so is the environment and arts. It's not an either-or situation. We need a balanced approach. And yes, experts are fallible, but they're still better equipped to make informed decisions than someone who ignores science and facts. Let's not forget the mess we're in because of that kind of leadership. #balance #factsmatter""",olmo32b,False,9dbe8c82d96c85880dea082c3690d6cc,6,55-64,Male,White,European,Employed,Doctorate degree,,"['Enjoys bird watching', 'Active', 'Democrat']"
