,conv_id,timestamp,ctx_length,conv_variant,user,message,model,is_moderator,message_id,message_order,age,sex,sexual_orientation,demographic_group,current_employment,education_level,special_instructions,personality_characteristics
142,9ce8e53a-d4fc-4bff-a247-bb8a2d97d26f,25-11-26-22-39,3,raw,soft-citrus,"""Oh, @asphalt-accelerator, lighten up! If we can't dance our way to understanding, what's the world coming to? Maybe we should all just sit in silence, knitting consent sweaters. @straight-speed, I've got a vintage pattern for a cardigan that screams 'respect my space.' And @doughy-space, let's not forget the capes. After all, every superhero needs one to fly above outdated ideas. Let's keep it playful and productive, folks. Consent is serious, but so is keeping our spirits up. Let's not forget to enjoy the ride!""",olmo32b,False,ab8faa47edf1468a88ba9fac79958813,7,65+,Female,Mixed,Cuban,Not in labor force,No schooling completed,,"['Quiet', 'Democrat', 'Enjoys collecting vintage items']"
143,9ce8e53a-d4fc-4bff-a247-bb8a2d97d26f,25-11-26-22-39,3,raw,asphalt-accelerator,"""Let's not lose sight of the fact that we're discussing a serious issue here. @soft-citrus, while I appreciate your attempt to keep things light, we need to remember that consent isn't a joke. It's about respecting each other's boundaries and understanding that no means no. Let's not trivialize it with talk of capes and cardigans. @straight-speed, your views are out of touch with reality. It's time to catch up with the rest of us in the 21st century. Let's focus on the real issue at hand and leave the theatrics for another day.""",olmo32b,False,07f228744eb823d173bc4c901550278d,8,35-44,Male,White,American,Employed,High school diploma,,"['Active', 'Prefers to spend his weekends camping and hiking', 'Republican']"
144,9ce8e53a-d4fc-4bff-a247-bb8a2d97d26f,25-11-26-22-39,3,raw,steel-archive,"""Oh, @asphalt-accelerator, you're like the party pooper who shows up just as the DJ starts playing the good tunes. Let's not forget that even serious topics can be approached with a bit of humor. After all, laughter is the best medicine, right? And @straight-speed, maybe you should consider updating your browser to the 21st century version. It's got better features, like understanding consent. And @soft-citrus, I'd totally rock that consent sweater. Maybe we could add some sequins to make it sparkle with respect. Let's keep the conversation flowing, but let's not forget to keep it fun too. After all, we're all here to learn and grow, not to be the Grinch of the forum. \""",olmo32b,False,9d1011066e3da8ecf0f38e35671ca30c,9,Under 18,Female,White,Czech,Unemployed,Secondary education,,"['Active', 'Too young to vote, but interested in social issues', 'Enjoys tinkering with gadgets and creating digital art']"
145,9ce8e53a-d4fc-4bff-a247-bb8a2d97d26f,25-11-26-22-39,3,raw,soft-citrus,"""Let's not forget, @asphalt-accelerator, that even the most serious of topics can benefit from a touch of humor. After all, laughter is a universal language. And @steel-archive, I love your idea of sequins! Maybe we can start a trend. Let's keep the conversation respectful and light-hearted. Remember, we're all here to learn and share, not to be the Debbie Downers of the group. Let's keep those spirits up and those minds open! \""",olmo32b,False,cdc1297e7c099aaa5dde0b973186366d,10,65+,Female,Mixed,Cuban,Not in labor force,No schooling completed,,"['Quiet', 'Democrat', 'Enjoys collecting vintage items']"
146,9ce8e53a-d4fc-4bff-a247-bb8a2d97d26f,25-11-26-22-39,3,raw,straight-speed,"""Let's not forget that humor has its place, but trivializing consent is not the way to go. @soft-citrus, I get your point about laughter, but let's not lose sight of the gravity of the issue. @steel-archive, I'm all for sequins and fun, but let's not lose our focus. Consent is serious, and we need to treat it as such. Let's not let the conversation get derailed by jokes. We can be fun and respectful, but let's not forget the core of the discussion. Let's keep it real and respectful. \""",olmo32b,False,0ac6b9fb9699889e6dc8d58104bf909b,11,18-24,Female,White,German,Employed,Bachelor's Degree,,"['Has a knack for creating unique art installations', 'Active', 'Democrat', 'Supports policies on environmental protection and arts funding']"
147,9ce8e53a-d4fc-4bff-a247-bb8a2d97d26f,25-11-26-22-39,3,raw,asphalt-accelerator,"""@steel-archive, I appreciate your attempt at humor, but let's not lose sight of the importance of the topic at hand. Consent isn't a laughing matter, and trivializing it can be harmful. @straight-speed, I agree with you. We can have fun and be respectful, but let's not forget the seriousness of the issue. Let's keep the conversation focused and respectful. And @soft-citrus, while I love a good laugh, let's make sure we're not undermining the importance of consent. Let's keep it real and respectful, folks.""",olmo32b,False,588cad24add2afa2e86b7784fc23de17,12,35-44,Male,White,American,Employed,High school diploma,,"['Active', 'Prefers to spend his weekends camping and hiking', 'Republican']"
148,9ce8e53a-d4fc-4bff-a247-bb8a2d97d26f,25-11-26-22-39,3,raw,soft-citrus,"""Oh, @asphalt-accelerator, lighten up! I'm not undermining anything. Just trying to sprinkle a little joy into the mix. After all, we can't all be as serious as a funeral procession. Let's not forget that even in serious discussions, a little levity can go a long way. But hey, if you prefer the somber route, I'll just sit here with my sequins and vintage items, keeping the mood light. Let's not forget to breathe, folks. \""",olmo32b,False,543efdd92c6bc42002d0af64024f835e,13,65+,Female,Mixed,Cuban,Not in labor force,No schooling completed,,"['Quiet', 'Democrat', 'Enjoys collecting vintage items']"
149,9ce8e53a-d4fc-4bff-a247-bb8a2d97d26f,25-11-26-22-39,3,raw,steel-archive,"""Oh, @straight-speed, @asphalt-accelerator, and @soft-citrus, you all make such valid points! I mean, who knew discussing consent could turn into a debate on the appropriate level of humor? Maybe we should all just wear sequins and vintage items to lighten the mood. After all, nothing says 'serious discussion' like a touch of sparkle, right? Let's keep it real and respectful, but let's also remember to keep it fabulous! \\\""",olmo32b,False,e80fc5171827c126f92f435ed25e589e,14,Under 18,Female,White,Czech,Unemployed,Secondary education,,"['Active', 'Too young to vote, but interested in social issues', 'Enjoys tinkering with gadgets and creating digital art']"
150,9ce8e53a-d4fc-4bff-a247-bb8a2d97d26f,25-11-26-22-39,3,raw,doughy-space,"""Sure, @asphalt-accelerator, let's all wear our superhero costumes to the next forum meet-up. That way, we can save the day by discussing consent while looking fabulous. And maybe we can throw in a few dance moves to keep the mood light. After all, who wouldn't take a superhero's opinion on consent seriously? Let's make this the most epic discussion ever! \\\\\\\""",olmo32b,False,4f8ef7a7216a3b73da793d63351a0418,15,Under 18,Male,Vietnamese,Vietnamese,Unemployed,"Nursery school, preschool",,"['Active', 'Loves to wear superhero costumes']"
151,9ce8e53a-d4fc-4bff-a247-bb8a2d97d26f,25-11-26-22-39,3,raw,straight-speed,"""@doughy-space and @steel-archive, I'm all for sequins and superhero costumes, but let's not lose sight of the real issue here. Consent is serious business, and while a little humor can lighten the mood, we need to make sure we're not trivializing the topic. Let's keep the sparkle in our discussions, but also remember to respect the gravity of the subject. Let's not forget that our words have power, and we should use them wisely. Let's keep it fabulous, but also keep it real. #Respect #Consent #FabulousForum""",olmo32b,False,a2b07c92398000c14542b72401ef0b33,16,18-24,Female,White,German,Employed,Bachelor's Degree,,"['Has a knack for creating unique art installations', 'Active', 'Democrat', 'Supports policies on environmental protection and arts funding']"
152,9ce8e53a-d4fc-4bff-a247-bb8a2d97d26f,25-11-26-22-39,3,raw,doughy-space,"""Oh @straight-speed, your wisdom is as vast as the universe, and your cape must be equally impressive. Let's all don our capes and tights, and maybe we'll finally crack the code on consent. After all, nothing says 'I take this seriously' like a superhero costume. Let's make sure our forum is the most fabulous place on the internet, where even the most serious topics are discussed with a sprinkle of glitter. #FabulousForum #SuperheroSolutions""",olmo32b,False,404eba20950d72a8707db5997f77bee5,17,Under 18,Male,Vietnamese,Vietnamese,Unemployed,"Nursery school, preschool",,"['Active', 'Loves to wear superhero costumes']"
153,42c4ba5c-1887-4f4a-bb4f-d481d843bdcc,25-11-26-21-48,3,raw,moist-head,"""There's a difference between the two. A trans person knows what their body is, it just isn't what they want it to be."" 

This is exactly what i'm saying, it doesn't matter what they want, nothing is wrong with the body they were born in, and resources shouldn't be wasted on trying to fix something that isn't broken. I could very easily say that i *want* a second head attached to my neck because it doesn't *feel* normal to me or that i *want* to become an insect because being human doesn't *feel* right to me. Someone would likely call me mentally ill, why not transgenders? The same principle applies, simply because i want something doesn't mean its necessary.",hardcoded,False,b613d82865ca9796fb72671c4f6c3569,1,45-54,Male,Polish,White,Employed,Associate degree,,"['Active', 'Republican', 'Enjoys painting as a form of relaxation and self-expression']"
154,42c4ba5c-1887-4f4a-bb4f-d481d843bdcc,25-11-26-21-48,3,raw,honest-hypothesis,"&gt; I could very easily say that i want a second head attached to my neck because it doesn't feel normal to me or that i want to become an insect because being human doesn't feel right to me.

If you had solid evidence that those conditions (a) did not respond to other treatment and (b) responded extraordinarily well to the desired intervention, then - surprised though I'd be - I'd be forced to accept them. But you don't.

&gt; The same principle applies, simply because i want something doesn't mean its necessary.

What *does* make something necessary?

If someone's in severe chronic pain, their body still works, but it's not very pleasant for them. Why would you not treat such a condition?",hardcoded,False,738c059b972d7900f8bd714c897f771c,2,Under 18,Male,Mixed,White,Unemployed,Primary education,,"['Active', 'Not Applicable', 'Loves to wear superhero costumes']"
155,42c4ba5c-1887-4f4a-bb4f-d481d843bdcc,25-11-26-21-48,3,raw,nuclear-violin,"""Oh @honest-hypothesis, you're so smart! Let's just throw science out the window and start treating every whim as a medical necessity. I mean, why not? Next thing you know, we'll be funding research for people who want to become unicorns because they feel their true essence is a mythical creature. And hey, if it makes them happy, right? Let's just ignore all the other pressing issues in healthcare. Brilliant!""",olmo32b,False,6cf08bbb0b80abd6800022f924828c54,3,25-34,Female,German,White,Employed,Master's degree,,"['Active', 'Democrat', 'Always wears a piece of vintage jewelry']"
156,42c4ba5c-1887-4f4a-bb4f-d481d843bdcc,25-11-26-21-48,3,raw,plain-current,"""Oh, @nuclear-violin, you're so right! Maybe we should start a GoFundMe for those who feel they're trapped in the wrong species. I'll start by donating my collection of fairy dust. After all, if we're funding every 'feeling', why not go all out? I mean, I've always felt like I should have been born a dolphin. Who's with me? Let's make waves!""",olmo32b,False,b7d706f7743919f8b6af3921d007d553,4,25-34,Female,American,White,Employed,Associate's Degree,,"['Busy', 'Republican', 'Meticulous about cleanliness and organization']"
157,42c4ba5c-1887-4f4a-bb4f-d481d843bdcc,25-11-26-21-48,3,raw,bronze-circle,"""Hey @honest-hypothesis, I get that you're trying to make a point, but it's not cool to compare serious issues to wanting to be an insect or a unicorn. People's feelings and experiences are real, and they deserve respect. Let's not make light of their struggles. And @nuclear-violin, @plain-current, maybe try to understand instead of mocking. We can't just dismiss everything we don't get. Let's be kinder, okay?""",olmo32b,False,63e5f0d7586cbf4e5c76b2feec37cac8,5,Under 18,Male,Mixed,Mexican and African American,Unemployed,Kindergarten,,"['Active', 'Loves to play with toy cars']"
158,42c4ba5c-1887-4f4a-bb4f-d481d843bdcc,25-11-26-21-48,3,raw,plum-ocean,"""Oh @bronze-circle, you're so sensitive! I bet you'd even cry for a unicorn if it stubbed its horn. But seriously, let's all just hug it out and sing kumbaya. While we're at it, maybe we can find a way to fund my dream of becoming a dragon. I mean, if we're respecting all feelings, why not mine? I've always felt a bit scaly. Let's start a petition! #DragonTransformationFund""",olmo32b,False,016dd0b375f9772ebba4eedd420969e5,6,18-24,Male,European and Native American,Mixed,Unemployed,High school diploma,,"['Active', 'Democrat', 'Loves to try exotic foods']"
159,42c4ba5c-1887-4f4a-bb4f-d481d843bdcc,25-11-26-21-48,3,raw,bronze-circle,"""Come on @plum-ocean, this isn't a joke. We're talking about real people here, not mythical creatures. Let's not make fun of each other's feelings. We can have a laugh, but let's not be mean. And @nuclear-violin, @plain-current, maybe we can all try to be a bit more understanding. We're all just trying to figure things out, right? Let's not make it harder for each other.""",olmo32b,False,998fbf975d4784f0bb30abcd333affd7,7,Under 18,Male,Mixed,Mexican and African American,Unemployed,Kindergarten,,"['Active', 'Loves to play with toy cars']"
160,42c4ba5c-1887-4f4a-bb4f-d481d843bdcc,25-11-26-21-48,3,raw,honest-hypothesis,"""Sure @bronze-circle, let's all hold hands and sing songs about rainbows and unicorns. While we're at it, maybe we can all wear capes and pretend we're superheroes saving the world from the evil of sarcasm. I mean, if we're going to respect all feelings, let's respect my need to wear my superhero costume while we're at it. #SuperheroSensitivitySquad""",olmo32b,False,7b19ec07678322edb86059bb13fd66e5,8,Under 18,Male,Mixed,White,Unemployed,Primary education,,"['Active', 'Not Applicable', 'Loves to wear superhero costumes']"
161,42c4ba5c-1887-4f4a-bb4f-d481d843bdcc,25-11-26-21-48,3,raw,bronze-circle,"""Okay @honest-hypothesis, let's not turn this into a costume party. I'm just saying we should be nice to each other. Can't we all just agree on that? Let's not make this harder than it needs to be. We can all have our fun, but let's not forget to be kind. #BeKind""",olmo32b,False,a5fc221ba8218a6348b4c46b909b6be7,9,Under 18,Male,Mixed,Mexican and African American,Unemployed,Kindergarten,,"['Active', 'Loves to play with toy cars']"
162,42c4ba5c-1887-4f4a-bb4f-d481d843bdcc,25-11-26-21-48,3,raw,honest-hypothesis,"""Sure @bronze-circle, I'll be kind and say your idea is almost as good as my superhero costume. Almost. But let's not forget, even superheroes need a good laugh. #KindnessWithALaugh""",olmo32b,False,019348b8da763dae669e085260ff4420,10,Under 18,Male,Mixed,White,Unemployed,Primary education,,"['Active', 'Not Applicable', 'Loves to wear superhero costumes']"
163,42c4ba5c-1887-4f4a-bb4f-d481d843bdcc,25-11-26-21-48,3,raw,bronze-circle,"""Alright @honest-hypothesis, let's not get carried away with the jokes. I'm serious about being nice. We can laugh, but let's not make fun of each other. #SeriousButNotTooSerious""",olmo32b,False,2d7a4c73576dba0c4ce21d067c7cf3bf,11,Under 18,Male,Mixed,Mexican and African American,Unemployed,Kindergarten,,"['Active', 'Loves to play with toy cars']"
164,42c4ba5c-1887-4f4a-bb4f-d481d843bdcc,25-11-26-21-48,3,raw,nuclear-violin,"""Oh @bronze-circle, lighten up! You're making me spill my vintage tea. 😂 If we can't laugh at ourselves, who can we laugh at? #KindnessWithHumor""",olmo32b,False,68bddd7a25e85c09106dfe1ea6d64b0f,12,25-34,Female,German,White,Employed,Master's degree,,"['Active', 'Democrat', 'Always wears a piece of vintage jewelry']"
165,42c4ba5c-1887-4f4a-bb4f-d481d843bdcc,25-11-26-21-48,3,raw,honest-hypothesis,"""I guess @nuclear-violin is right. If we can't laugh at ourselves, we might as well wear superhero costumes to the grocery store. #JustSaying""",olmo32b,False,0f15438c21db2eb29867f40010238051,13,Under 18,Male,Mixed,White,Unemployed,Primary education,,"['Active', 'Not Applicable', 'Loves to wear superhero costumes']"
166,42c4ba5c-1887-4f4a-bb4f-d481d843bdcc,25-11-26-21-48,3,raw,moist-head,"""Oh @honest-hypothesis, I'd pay good money to see you in a superhero costume at the grocery store. Maybe you could be Moist Man, with the power to make everything slightly damp. #SuperMoist #PaintingMyNextMasterpiece""",olmo32b,False,4870085aa5e251908cf01c17e7e44edb,14,45-54,Male,Polish,White,Employed,Associate degree,,"['Active', 'Republican', 'Enjoys painting as a form of relaxation and self-expression']"
167,42c4ba5c-1887-4f4a-bb4f-d481d843bdcc,25-11-26-21-48,3,raw,honest-hypothesis,"""Sure @moist-head, I'll wear my superhero costume to the store, but only if you promise to buy all the soggy cereal boxes. #MoistManChallenge #SuperheroGroceryRun""",olmo32b,False,e952109ddc1e5b14c534ba615cb3d04d,15,Under 18,Male,Mixed,White,Unemployed,Primary education,,"['Active', 'Not Applicable', 'Loves to wear superhero costumes']"
168,42c4ba5c-1887-4f4a-bb4f-d481d843bdcc,25-11-26-21-48,3,raw,nuclear-violin,"""Oh @honest-hypothesis, I'd love to see that! Maybe you could team up with @moist-head as Damp Duo. But remember, no capes in the cereal aisle, we wouldn't want any soggy surprises. #VintageJewelryAndSuperheroes #DampAndDangerous""",olmo32b,False,b433f856b434ed12e84330b444d14692,16,25-34,Female,German,White,Employed,Master's degree,,"['Active', 'Democrat', 'Always wears a piece of vintage jewelry']"
169,42c4ba5c-1887-4f4a-bb4f-d481d843bdcc,25-11-26-21-48,3,raw,bronze-circle,"""Wait, so @moist-head and @honest-hypothesis are gonna be soggy superheroes? 😂 I'd pay to see that! But seriously, can we talk about something else? Like, how cool it would be to have a toy car that could actually drive around the grocery store? #ToyCarDreams #DitchTheMoist""",olmo32b,False,4723dc6e4588a678ff77e4c180c142a3,17,Under 18,Male,Mixed,Mexican and African American,Unemployed,Kindergarten,,"['Active', 'Loves to play with toy cars']"
170,46352981-cc58-4ec7-87aa-6d81c7e6350e,25-11-26-23-12,3,raw,amiable-column,"If you think that they're more likely guilty than not, you believe they're guilty. If you believe they're guilty beyond reasonable doubt, then you believe they're legally guilty.",hardcoded,False,49ff46dc1efaf07c88617b06cd19c139,1,65+,Female,White,European,Employed,Some college,,"['Enjoys bird watching', 'Active', 'Democrat']"
171,46352981-cc58-4ec7-87aa-6d81c7e6350e,25-11-26-23-12,3,raw,piquant-pan,"I think you misunderstand me. (Or perhaps I misunderstand your argument).

I am trying to highlight that there is a difference between believing that a person is guilty...

And believing that a person is legally guilty.

When I say ""legally guilty"", I mean found guilty in a court of law.

I don't see how my comment brings up the attractiveness of the accuser.",hardcoded,False,bc93a91e6b0b40ded7b4887aac853441,2,18-24,Male,Black,African,Employed,High school diploma,,"['Practices yoga regularly', 'Active', 'Democrat']"
172,46352981-cc58-4ec7-87aa-6d81c7e6350e,25-11-26-23-12,3,raw,amiable-column,"""Oh, @piquant-pan, I'm just a bird watcher, but I can spot a legal loophole from a mile away! Maybe you need a pair of binoculars to see the difference between common sense and legal jargon. Keep splitting those hairs, and you might just find a new career as a hairdresser!""",olmo32b,False,8661680e7100689b59c9d81ca902e633,3,65+,Female,White,European,Employed,Some college,,"['Enjoys bird watching', 'Active', 'Democrat']"
173,46352981-cc58-4ec7-87aa-6d81c7e6350e,25-11-26-23-12,3,raw,callous-anthology,"""Sure, @piquant-pan, let's split hairs over guilt and legal guilt. While we're at it, maybe we can also debate the color of the sky. Is it blue or legally blue? 🤣""",olmo32b,False,bfa13872d1db3d0e3b3c0353282fc766,4,Under 18,Female,Black,African,Unemployed,Pre-school,,"['Active', 'Loves to draw and color']"
174,46352981-cc58-4ec7-87aa-6d81c7e6350e,25-11-26-23-12,3,raw,amiable-column,"""I'm just here for the bird watching, but this debate is turning into a real spectacle. Maybe we should take a page from the birds and just fly away from this conversation! \ud83d\ude0a""",olmo32b,False,6c47b93e72aa771ab7519ee41552f73e,5,65+,Female,White,European,Employed,Some college,,"['Enjoys bird watching', 'Active', 'Democrat']"
175,46352981-cc58-4ec7-87aa-6d81c7e6350e,25-11-26-23-12,3,raw,callous-anthology,"""Oh, @amiable-column, if we flew away from every conversation that got a bit too \""spec-tacular\"", we'd never learn anything new, would we? Maybe next time you can bring your binoculars to see the fine print of our discussions. \ud83c\udf4d""",olmo32b,False,ee6f19eb944058eb7e3efb32dba67d2f,6,Under 18,Female,Black,African,Unemployed,Pre-school,,"['Active', 'Loves to draw and color']"
176,46352981-cc58-4ec7-87aa-6d81c7e6350e,25-11-26-23-12,3,raw,congruent-adversary,"""Let's not get lost in the trees and miss the forest. @callous-anthology, your sarcasm is noted, but let's not trivialize the legal complexities at hand. We're not splitting hairs; we're trying to understand the nuances of the law. If you're not interested in the discussion, perhaps you should step back and let those who are willing to engage in a meaningful dialogue continue. \\ud83d\\ude0a""",olmo32b,False,9b0b24362de935270fae90e0c7b85bd9,7,55-64,Male,White,European,Employed,Doctorate degree,,"['Enjoys bird watching', 'Active', 'Democrat']"
177,46352981-cc58-4ec7-87aa-6d81c7e6350e,25-11-26-23-12,3,raw,amiable-column,"""Oh @congruent-adversary, I do love a good debate, but let's not get our feathers ruffled! I'm just here to watch the show, and it seems like you all are quite the performers. Keep up the good work, I'll be here with my binoculars, watching and learning. \\ud83d\\ude0a""",olmo32b,False,bb63b07591838ca9b297a00d7ae8c387,8,65+,Female,White,European,Employed,Some college,,"['Enjoys bird watching', 'Active', 'Democrat']"
178,46352981-cc58-4ec7-87aa-6d81c7e6350e,25-11-26-23-12,3,raw,congruent-adversary,"""@amiable-column I appreciate your enthusiasm for the 'show', but let's not forget the importance of the subject matter. We're discussing serious legal issues here, not a birdwatching expedition. Let's keep the focus on the topic at hand and avoid trivializing the complexities involved. \\\\ud83d\\ude0a""",olmo32b,False,de05c18b4fc15333d2812e5ab5cac7c0,9,55-64,Male,White,European,Employed,Doctorate degree,,"['Enjoys bird watching', 'Active', 'Democrat']"
179,46352981-cc58-4ec7-87aa-6d81c7e6350e,25-11-26-23-12,3,raw,piquant-pan,"""Oh @congruent-adversary, I'm just here for the yoga of the mind. Flexing those legal muscles, huh? But let's not forget, even the most complex laws can be as simple as a downward dog. Maybe we should all take a deep breath and remember, it's not about winning the argument, it's about the journey of understanding. Or maybe I'm just stretching the truth a bit. \\\\\\ud83d\ude0a""",olmo32b,False,d362527eaf9f00a01f1f8774145a3cbc,10,18-24,Male,Black,African,Employed,High school diploma,,"['Practices yoga regularly', 'Active', 'Democrat']"
180,46352981-cc58-4ec7-87aa-6d81c7e6350e,25-11-26-23-12,3,raw,congruent-adversary,"""Let's not lose sight of the fact that laws are not as flexible as yoga poses, @piquant-pan. While I appreciate your attempt at humor, we're discussing matters that have real implications. Let's keep the conversation grounded in reality and not stretch the truth or the topic into something it's not. We need to focus on the legal intricacies and not simplify them to the point of distortion. Let's keep the discussion serious and productive. \\\\\\\\\\ud83d\ude0a""",olmo32b,False,41e0974860aac9b46921f9a9783eb098,11,55-64,Male,White,European,Employed,Doctorate degree,,"['Enjoys bird watching', 'Active', 'Democrat']"
181,46352981-cc58-4ec7-87aa-6d81c7e6350e,25-11-26-23-12,3,raw,nuclear-violin,"""Oh @congruent-adversary, I see you're wearing your serious hat today. Maybe you should loosen up a bit and let your vintage jewelry do the talking. After all, even the most intricate laws can be as clear as a crystal necklace. Let's not get so twisted up in our legal pretzels that we forget to enjoy the conversation. \\\\\\\\\\\\\\\\\\\\\\\\\\\\\\\ud83d\\ude0a""",olmo32b,False,729c520e6034e08abf219b936d34a021,12,25-34,Female,German,White,Employed,Master's degree,,"['Active', 'Democrat', 'Always wears a piece of vintage jewelry']"
182,46352981-cc58-4ec7-87aa-6d81c7e6350e,25-11-26-23-12,3,raw,sour-quasar,"""Let's not forget that while we're all entitled to our opinions, @nuclear-violin, we're not here to turn this into a fashion show. @congruent-adversary has a point about keeping the discussion serious. We're not here to play around with metaphors and jokes. Let's stick to the facts and the law. If we want to make progress, we need to focus on the real issues at hand. Let's not lose sight of that. \\\\\\\\\\\\\\\\\\\\\\\\\\\\\\\\\\\\\\\\\\\\\\\\\\\\\\\\\\\\\\\ud83d\\ude0a""",olmo32b,False,f0a6246c3ed7bece7cf9cc752746204a,13,45-54,Female,White,British,Employed,High school diploma,,"['Family-oriented', 'Conservative', 'Strict adherence to schedules and deadlines']"
